"URL","Image URL","ASIN","Title","Brand","Fulfillment","Category","BSR","UPC","GTIN","EAN","ISBN","Subcategory","Subcategory BSR","Price","Price Trend (90 days) (%)","Parent Level Sales","ASIN Sales","Sales Trend (90 days) (%)","Parent Level Revenue","ASIN Revenue","Review Count","Reviews Rating","Seller","Seller Country/Region","Number of Active Sellers","Last Year Sales","Sales Year Over Year (%)","Size Tier","Length","Width","Height","Weight","Storage Fee (Jan - Sep)","Storage Fee (Oct - Dec)","Best Sales Period","Age (Month)","Number of Images","Variation Count","Sales to Reviews"
"https://amazon.com/dp/B09JT1VXGG","https://m.media-amazon.com/images/I/71Nj5HX5ClL._SX450_.jpg","B09JT1VXGG","Superior Tactical White Phosphor XLSH Gen 3 PVS-14 Night Vision MonocularsI Helmet Mounted, Waterproof, Rugged & Durable Goggles I Hands- Free & Perfect for Outdoor Adventures","Superior Tactical LLC S","FBM","Sports & Outdoors",707241,671495074748,"N/A",0671495074748,"N/A","Night Vision Monoculars",181,3499,-10,3,3,900,11928.96,11928.86,20,4.5,"superiortac","USA",1,15,"N/A","N/A","N/A","N/A","N/A","N/A","N/A","N/A","03/31/2024",51,7,0,0.17
"https://amazon.com/dp/B0CB7KRG4L","https://m.media-amazon.com/images/I/51Q6AQkk0qL._SX450_.jpg","B0CB7KRG4L","PVS-14 Monocular Night Vision Device, Head-Mounted Micro Light Infrared Monocular for Observation and Patrol","MAYD","FBM","Sports & Outdoors",710123,"N/A","N/A",7359500553275,"N/A","Night Vision Monoculars",181,218.88,-19,4,4,180,838.66,838.54,7,3.1,"ROUASD TOY","China",1,35,"N/A","Large Standard-Size",5.91,3.15,3.94,0.99,"N/A","N/A","11/30/2024",30,9,0,0.54
"https://amazon.com/dp/B0D7GZP27N","https://m.media-amazon.com/images/I/71xXK-M8w3L._SX450_.jpg","B0D7GZP27N","Nightiger Dual IR Night Vision Monocular for Adults Helmet OLED Large Circular Screen 850nm 940nm Rechargeable WiFi Night Vision Goggles HD Camera 4K Video Photo Digital Zoom Night Vision Binocular","Nightiger","FBA","Sports & Outdoors",715174,"N/A","N/A","N/A","N/A","Night Vision Monoculars",183,159.99,4,1,1,167,226.07,226.02,13,4.5,"Nightiger-USA","China",1,0,"N/A","Large Standard-Size",7.48,5.12,3.15,1.1,60.71,167.48,"01/31/2025",19,6,2,0.11
"https://amazon.com/dp/B0D814JVTN","https://m.media-amazon.com/images/I/51p7+JccJcL._SX450_.jpg","B0D814JVTN","HangTon Power Adapter Cable for PVS-31 Battery Pack to Wilcox GSGM ANVIS AVS-6/9 DPAM AN/PVS-23 AN/PVS31 Night Vision Goggles, Fischer 4 pin to Lemo 4 pin 20""","HangTon","FBA","Sports & Outdoors",725069,"N/A","N/A","N/A","N/A","Night Vision Monoculars",188,69,-36,18,5,2,1170.67,323.49,3,4.6,"Hangton connect","China",2,302,3,"Large Standard-Size",2,2,2,0.1,4.03,11.11,"01/31/2024",19,5,2,6.16
"https://amazon.com/dp/B0CKVK23HW","https://m.media-amazon.com/images/I/71UUxkUcqtL._SX450_.jpg","B0CKVK23HW","Anti-Blur Night Vision Monocular 30mm Lens 2.3X-9.2X Zoom,0.38 inch OLED Screen 1080p Digital Ranger Finder, 850nm Invisible IR waveligh for Outdoor Hunting Night Vision with WiFi APP","Guune","FBA","Sports & Outdoors",726418,"N/A","N/A","N/A","N/A","Night Vision Monoculars",189,235,-35,3,3,20,487.33,487.3,3,3.4,"Guune","China",1,10,43,"Large Standard-Size",2.75,4.75,8,1.45,52.61,145.14,"01/31/2024",27,6,0,0.85
"https://amazon.com/dp/B0DB5WY33G","https://m.media-amazon.com/images/I/51tLHSlNFFL._SX450_.jpg","B0DB5WY33G","AGM Global Vision 19-384 Thermal Imaging Monocular 20mK, 12 Micron, 384x288 (50 Hz)","AGM Global Vision","FBA","Sports & Outdoors",728978,810027772657,"N/A",0810027772657,"N/A","Night Vision Monoculars",191,1495,"N/A",0,1,,"-",1385.38,3,5,"Obsidian Brands","USA",1,7,"N/A","Large Standard-Size",3.75,8,9,2.75,135.94,375,"11/30/2024",18,8,0,0.06
"https://amazon.com/dp/B0DKTJNR5G","https://m.media-amazon.com/images/I/619T+X3ienL._SX450_.jpg","B0DKTJNR5G","Thermal Monocular,384x288 (AI Super Resolution) H3 Thermal Monocular for Hunting,(800×600) Micro-OLED Display,IP66 Thermal Night Vision with Wi-Fi Hotspot/STA/MIC,12hrs+ Battery Powers","GTGUARD","FBA","Sports & Outdoors",732875,"N/A","N/A","N/A","N/A","Night Vision Monoculars",192,599,-17,0,0,-75,"-","-",1,5,"V8 OFFICIAL","China",2,2,"N/A","Large Standard-Size",7.87,2.6,2.6,0.7,26.79,73.89,"10/31/2025",15,9,0,0.13
"https://amazon.com/dp/B0G8D97YJY","https://m.media-amazon.com/images/I/81M3LVursHL._SX450_.jpg","B0G8D97YJY","Handheld Night Vision Monocular with 2"" HD Screen - 800M Detection Range, 5W IR, 10X Zoom for Camping Hunting & Wildlife Observation, Includes Compass & Supports TF Card","Generic","-","Sports & Outdoors",740609,"N/A","N/A","N/A","N/A","Night Vision Monoculars",197,27.99,"N/A",0,0,,"-","-","N/A","N/A",,"N/A",1,0,"N/A","N/A","N/A","N/A","N/A","N/A","N/A","N/A","-",1,"N/A",0,"N/A"
"https://amazon.com/dp/B0DY2JQWMF","https://m.media-amazon.com/images/I/61Zj2Zyve4L._SX450_.jpg","B0DY2JQWMF","Guide TB430 Thermal Imaging Clip On Riflescope - 400x300 Sensor, NETD <25mK, 1950Yd Detection Range, Long Battery Life Up to 12 Hours, for Wildlife Viewing, Hunting & Outdoor","Guide Sensmart","FBM","Sports & Outdoors",750066,"N/A","N/A",6970883551484,"N/A","Night Vision Monoculars",199,1999,-41,1,1,,2529.57,1772.48,"N/A","N/A","RSD Outdoor","USA",1,0,"N/A","Large Standard-Size",7,6.8,12,3.3,"N/A","N/A","02/28/2025",11,1,3,"N/A"
"https://amazon.com/dp/B0FN7PJQ4B","https://m.media-amazon.com/images/I/618sbt2A0rL._SX450_.jpg","B0FN7PJQ4B","First Thermal Night Vision AR Glasses 384x288 Thermal Monocular 1500M Detection Thermal Imaging Multi-Functional Use,128GB Video Recording 80"" AR Display,Thermal Vision for Hunting,Fishing,Inspection","Guune","FBM","Sports & Outdoors",752536,"N/A","N/A","N/A","N/A","Night Vision Monoculars",197,2299,-31,3,2,-68,7451.73,3762.97,1,5,"Guune","China",1,0,"N/A","N/A","N/A","N/A","N/A","N/A","N/A","N/A","09/30/2025",5,9,2,3.24
"https://amazon.com/dp/B0FN7ZK1KZ","https://m.media-amazon.com/images/I/416UFZoidML._SX450_.jpg","B0FN7ZK1KZ","Guune Thermal Night Vision AI AR Glasses 384x288 12μm Head-Mounted Thermal AR Glasses for Hunting,Thermal Imaging 60Hz128GB,Thermal Monocular for Hunting,Fishing and Inspections","Guune","FBM","Sports & Outdoors",752536,"N/A","N/A","N/A","N/A","Night Vision Monoculars",197,2299,-27,3,2,-68,7451.73,3688.55,1,5,"Guune","China",1,0,"N/A","N/A","N/A","N/A","N/A","N/A","N/A","N/A","09/30/2025",5,9,2,3.24
"https://amazon.com/dp/B078NHJ9KW","https://m.media-amazon.com/images/I/714KRVO0FOL._SX450_.jpg","B078NHJ9KW","MOD Armory IC PVS-14 J Arm Adapter with NVG Dovetail Shoe or Bayonet Interface (Dovetail)","MOD Armory","FBM","Sports & Outdoors",760508,735255927870,"N/A",0735255927870,"N/A","Sights & Optics",2830,184.99,-37,2,2,,369.98,369.91,41,4.5,"MODArmory","USA",1,12,-73,"N/A","N/A","N/A","N/A","N/A","N/A","N/A","04/30/2024",97,1,2,0.05
"https://amazon.com/dp/B0CX3YQQQ5","https://m.media-amazon.com/images/I/71B0B2qVqFL._SX450_.jpg","B0CX3YQQQ5","GOYOJO NVG30 Night Vision Goggles for Adults, PVS-14 Helmet Mounted Night Vision Binoculars with 4 Color Modes 4X Magnification, HD Recording & Playback for Hunting Surveillance","GOYOJO","FBM","Sports & Outdoors",767666,658361256323,"N/A",0658361256323,"N/A","Night Vision Monoculars",203,1199,"N/A",0,0,,"-","-",5,3.3,"HUITEN","China",1,0,"N/A","Large bulky",11,11,12,6.6,"N/A","N/A","01/31/2025",22,7,0,0
"https://amazon.com/dp/B01MREL5ZC","https://m.media-amazon.com/images/I/31WMIZmAVJL._SX450_.jpg","B01MREL5ZC","NightStar 2x50mm Gen-1 Night Vision Monocular, Black, NS41250C","NightStar","FBM","Sports & Outdoors",769701,799599163912,00799599163912,0799599163912,"N/A","Night Vision Monoculars",205,167.76,-12,2,2,400,279.79,279.69,4,2.5,"KART IT","USA",3,11,10,"N/A","N/A","N/A","N/A","N/A","N/A","N/A","11/30/2025",110,6,0,0.42
"https://amazon.com/dp/B0CRZ5N21G","https://m.media-amazon.com/images/I/51CX0eL1Q4L._SX450_.jpg","B0CRZ5N21G","CEKOCK 850nm Cross Cursor Aiming Digital IR Night Vision Scope for Tactical Hunting with Long Distance Vision and Portable Design，Rechargeable, Not Allowed to Take Photos or Videos, Black","CEKOCK","FBM","Sports & Outdoors",769804,720118390502,"N/A",0720118390502,"N/A","Night Vision Monoculars",206,90,-32,0,0,-93,"-","-",11,3.6,"C Xinbei","N/A",2,25,"N/A","N/A","N/A","N/A","N/A","N/A","N/A","N/A","11/30/2024",24,7,0,0.01
"https://amazon.com/dp/B0DJCDP9JZ","https://m.media-amazon.com/images/I/61RMz3mXm0L._SX450_.jpg","B0DJCDP9JZ","Predator Thermal Optics Matrix 15-384 Thermal Monocular","Predator Thermal Optics","FBM","Sports & Outdoors",774359,666945619341,"N/A",0666945619341,"N/A","Night Vision Monoculars",205,1199.99,"N/A",0,0,,"-","-","N/A","N/A","Predator Thermal Optics","USA",2,0,"N/A","Large Standard-Size",15,7,6,4,"N/A","N/A","-",15,9,0,"N/A"
"https://amazon.com/dp/B0BC4CQKNC","https://m.media-amazon.com/images/I/41NkIXMmYxL._SX450_.jpg","B0BC4CQKNC","True WiFi Night Vision Monocular Support Smartphone iOS/Android 32G Super HD in Full Darkness Clearly Infrared Camera Telescope 12MP Photo Video Night Watching 5X Digital Zoom Night Vision Binocular","Bestguarder","FBA","Sports & Outdoors",777499,"N/A","N/A","N/A","N/A","Night Vision Monoculars",207,229.59,-16,1,1,,299.13,299.08,38,3.6,"bestguarder","China",1,10,-88,"Large Standard-Size",3.23,5.71,8.9,2.25,82.64,227.98,"12/31/2023",41,6,0,0.03
"https://amazon.com/dp/B0BH1J3NBV","https://m.media-amazon.com/images/I/61jw6aFdstL._SX450_.jpg","B0BH1J3NBV","Armasight MNVD-51 Pinnacle Gen 3 IIT, Night Vision Monocular","Armasight","Amazon","Sports & Outdoors",782124,810081911009,"N/A",0810081911009,"N/A","Night Vision Monoculars",209,4621.91,-12,0,0,,"-","-",1,3,"Amazon","N/A",1,3,200,"Large Standard-Size",4.33,5.67,10.08,1.62,"N/A","N/A","03/31/2025",39,6,0,0.35
"https://amazon.com/dp/B0B4HCKBBR","https://m.media-amazon.com/images/I/41qoRerwBVL._SX450_.jpg","B0B4HCKBBR","720p Digital Night Vision for Scope Monocular Attachment Video Camera VCR with 4.3inch LCD Display and 850nm Infrared IR Flashlight for Outdoor Tactical Rifle Hunting","NightCrystal","FBM","Sports & Outdoors",783967,"N/A","N/A","N/A","N/A","Night Vision Monoculars",209,129.99,29,1,1,-54,151.4,151.35,1,3,"NightCrystal Hunting Store","China",1,18,"N/A","Large Standard-Size",7.87,6.3,5.91,2.65,"N/A","N/A","10/31/2025",43,9,0,1.17
"https://amazon.com/dp/B0FWK4LDC3","https://m.media-amazon.com/images/I/41YT5zI1PdL._SX450_.jpg","B0FWK4LDC3","Theless Gear Night Vision Scope – 1080P Digital Infrared Attachment for Rifle Scopes, 850nm & 940nm IR, 4X Zoom, Tactical Hunting Optics, Long Range Night Vision Monocular","Theless Gear","FBM","Sports & Outdoors",785411,762168398510,"N/A",0762168398510,"N/A","Night Vision Monoculars",213,129.99,"N/A",0,0,,"-","-","N/A","N/A","Theless Gear","China",1,0,"N/A","N/A",6,4.1,1.5,"N/A","N/A","N/A","-",3,9,0,"N/A"
"https://amazon.com/dp/B0CQQYR6CV","https://m.media-amazon.com/images/I/71Rph7klVHL._SX450_.jpg","B0CQQYR6CV","Donpidd Stallarsight 500x Night Vision Ultra-Portable Telescope, Night Vision Scope, Ultra Long Distance, Stallarsight 500x Telescope for Bird Watching Travel Camping Hiking Travel (A)","Donpidd","FBM","Sports & Outdoors",798725,"N/A","N/A","N/A","N/A","Night Vision Monoculars",212,23.88,-12,0,0,-67,"-","-",7,3.9,"XHBHSH","China",1,15,"N/A","N/A","N/A","N/A","N/A","N/A","N/A","N/A","12/31/2023",25,7,2,0
"https://amazon.com/dp/B0CQQMM4FD","https://m.media-amazon.com/images/I/71HAYJAXdUL._SX450_.jpg","B0CQQMM4FD","Donpidd Stallarsight 500x Night Vision Ultra-Portable Telescope, Night Vision Scope, Ultra Long Distance, Stallarsight 500x Telescope for Bird Watching Travel Camping Hiking Travel (B)","Donpidd","FBM","Sports & Outdoors",798725,"N/A","N/A","N/A","N/A","Night Vision Monoculars",212,23.88,-9,0,0,-67,"-","-",7,3.9,"XHBHSH","China",1,15,"N/A","N/A","N/A","N/A","N/A","N/A","N/A","N/A","12/31/2023",25,7,2,0
"https://amazon.com/dp/B0DKTVR79B","https://m.media-amazon.com/images/I/71oZwlHXStL._SX450_.jpg","B0DKTVR79B","T2 Pro Android Thermal Monocular, Hunting Night Vision Scope for Phone, Detect Deer at 1579 Yards, 13mm Lens, Thermal Camera for Outdoor with Tactical Handle and Scope Mount (Not for iOS)","Thermal Master","FBA","Sports & Outdoors",803299,"N/A","N/A","N/A","N/A","Night Vision Monoculars",218,349,-28,0,0,,"-","-",28,3.5,"Thermal Master Official","China",1,0,"N/A","Large Standard-Size",3.31,7.48,11.54,1.92,143.85,396.83,"01/31/2025",13,6,0,0
"https://amazon.com/dp/B0CKS1Y83C","https://m.media-amazon.com/images/I/61jGAhoKGqL._SX450_.jpg","B0CKS1Y83C","Athlon Optics Cronus ATS 35Ml- 400 Thermal Monocular, 400X300 Thermal Sensor, 640X400 OLED Display","Athlon Optics","FBM","Sports & Outdoors",809549,813869023208,00813869023208,0813869023208,"N/A","Night Vision Monoculars",217,1949.99,-31,1,0,-108,1476.02,"-","N/A","N/A","Sportsgear Optics","USA",1,23,"N/A","Large Standard-Size",5.24,5.59,10.55,2.91,"N/A","N/A","04/30/2024",27,7,2,"N/A"
"https://amazon.com/dp/B0CKS23QT8","https://m.media-amazon.com/images/I/611nVBD7CLL._SX450_.jpg","B0CKS23QT8","Athlon Optics Cronus ATS 35M-400 Thermal Monocular, 400X300 @12 Μm Thermal Sensor, 640X400 OLED Display","Athlon Optics","FBM","Sports & Outdoors",809683,813869023154,"N/A",0813869023154,"N/A","Night Vision Monoculars",218,1549.99,-30,1,0,-108,1476.02,"-","N/A","N/A","Sportsgear Optics","USA",2,23,"N/A","Large Standard-Size",6.93,7.09,11.85,3.22,"N/A","N/A","04/30/2024",27,9,2,"N/A"
"https://amazon.com/dp/B0FLTSR7BF","https://m.media-amazon.com/images/I/61UFXcSI-LL._SX450_.jpg","B0FLTSR7BF","Gslxheal Digital Night Vision Scope Monocular | Night Vision Goggles for Adults with 4X Zoom, Infrared Thermal Spotting Camera for Camping Shooting","Gslxheal","FBM","Sports & Outdoors",817047,"N/A","N/A",1092713300439,"N/A","Night Vision Monoculars",219,198.89,"N/A",1,1,,198.89,198.85,"N/A","N/A","Peng xing","China",1,0,"N/A","N/A","N/A","N/A","N/A","N/A","N/A","N/A","11/30/2025",5,7,0,"N/A"
"https://amazon.com/dp/B0BQ31RHZM","https://m.media-amazon.com/images/I/51z5meixS5L._SX450_.jpg","B0BQ31RHZM","TEQIN Night Vision Monocular, Night Vision InfraredMonocular with 1.5"" TFT LCD Display Screen, 984ft/300M Viewing Range in 100% Dark, for Hunting Camping Travel Black","TEQIN","FBA","Sports & Outdoors",844296,"N/A","N/A",6955268550399,"N/A","Night Vision Monoculars",224,38.99,-21,3,3,-50,112.49,112.44,2,1.5,"Patricia.","China",1,21,"N/A","Large Standard-Size",3.15,3.15,7.09,0.71,35.39,97.64,"11/30/2024",37,9,1,1.44
"https://amazon.com/dp/B0BY2XD17D","https://m.media-amazon.com/images/I/61cr96YSQtL._SX450_.jpg","B0BY2XD17D","YSS New Aluminum Alloy PVS14 Night Vision J-Arm Mount fit for Helmet Openwork Design(Support Left Eye, Chinese Thread)","YSS","FBM","Sports & Outdoors",852609,729162534337,"N/A",0729162534337,"N/A","Night Vision Monoculars",226,130,-22,1,1,,192.44,192.38,3,4.6,"CANIS SPORT INC","China",1,1,-86,"Large Standard-Size",5,5,3,0.3,"N/A","N/A","03/31/2024",34,7,0,0.49
"https://amazon.com/dp/B07DGM5FQ8","https://m.media-amazon.com/images/I/41Rd4SDchDL._SX450_.jpg","B07DGM5FQ8","Integrated Components ANVIS Ground Mount Adapter with Mount Viewer and Rhino Back Plate (Size 3)","Integrated Components ANVIS","FBM","Sports & Outdoors",855952,735255927283,"N/A",0735255927283,"N/A","Night Vision Monoculars",226,625,"N/A",0,0,,"-","-","N/A","N/A","MODArmory","USA",1,0,"N/A","N/A","N/A","N/A","N/A","N/A","N/A","N/A","11/30/2024",91,3,2,"N/A"
"https://amazon.com/dp/B0FSFY9S97","https://m.media-amazon.com/images/I/519jcI6lM-L._SX450_.jpg","B0FSFY9S97","Guide TD633 LRF, Thermal Monocular 35mm 640x512 Thermal Imaging Monocular, 1950yd Detection Range, 2X Base Mag, 8X Zoom, Ideal for Night Hunting, 10 Year Warranty","Guide Sensmart","FBM","Sports & Outdoors",870513,"N/A","N/A",6970883551996,"N/A","Night Vision Monoculars",229,1999,-22,1,1,,2330.94,2330.93,"N/A","N/A","RSD Outdoor","USA",1,0,"N/A","N/A","N/A","N/A","N/A","N/A","N/A","N/A","10/31/2025",4,1,0,"N/A"
"https://amazon.com/dp/B0F1L8MMWJ","https://m.media-amazon.com/images/I/51o7ThIyDyL._SX450_.jpg","B0F1L8MMWJ","New Megaorei NK008 1080P 300M Hunting Digital Infrared Night Vision Scope Attachment Camcorder with Built-in 940nm Infrared Flashlight Monocular","megaorei","FBM","Sports & Outdoors",877810,717097235009,"N/A",0717097235009,"N/A","Night Vision Monoculars",234,99.99,-19,4,4,,421.95,421.86,"N/A","N/A","megaorei technology","China",1,0,"N/A","N/A","N/A","N/A","N/A","N/A","N/A","N/A","11/30/2025",13,8,0,"N/A"
"https://amazon.com/dp/B0DN8CF5C2","https://m.media-amazon.com/images/I/51tB6-JRnpL._SX450_.jpg","B0DN8CF5C2","AGM Global Vision REFURBISHED ASP TM35-384 Medium Range Thermal Imaging Monocular, White hot, Black hot, red hot, Fusion, 7.48x2.4x2.6","AGM Global Vision","FBM","Sports & Outdoors",879732,810164390950,"N/A",0810164390950,"N/A","Night Vision Monoculars",234,1099,163,2,3,,2487.51,3486.25,"N/A","N/A","Defend&Carry","USA",1,0,"N/A","Extra-large 150+ lb",24,30,30,25,"N/A","N/A","10/31/2025",76,1,0,"N/A"
"https://amazon.com/dp/B002BVUSSU","https://m.media-amazon.com/images/I/81IBnbbAyYL._SX450_.jpg","B002BVUSSU","Night Owl Optics 5-Power NOXM50 Night Vision Monocular","Night Owl","FBM","Sports & Outdoors",880367,804066783231,04139052350514,4139052350514,"N/A","Night Vision Monoculars",237,199.99,-28,1,1,20,211.14,211.07,336,3.6,"First Texas Products Corporation","USA",1,17,-54,"Large Standard-Size",8.8,4.8,2.9,1,"N/A","N/A","05/31/2024",199,5,0,0
"https://amazon.com/dp/B08F2V28CN","https://m.media-amazon.com/images/I/41f0xyzm0CL._SX450_.jpg","B08F2V28CN","X-Vision XANR100 Night Vision Rangefinder","X-Vision Night Vision","FBA","Sports & Outdoors",891205,850020714001,"N/A",0850020714001,"N/A","Monoculars",898,195,15,0,0,-140,"-","-",7,3.7,"Alpha 1717","USA",1,32,"N/A","Large Standard-Size",2.87,4.45,6.3,0.93,40.51,111.75,"03/31/2025",66,5,0,0
"https://amazon.com/dp/B0DLZJDBRM","https://m.media-amazon.com/images/I/61ZDCrvBRGL._SX450_.jpg","B0DLZJDBRM","BINOCK Night Vision Goggles Metal Accessory Night Vision Scope Accessory J Arm Bracket Night Vision Mount Z06 for PVS14 NVG10 NVG50 BTI10 NVG60","BINOCK","FBA","Sports & Outdoors",898527,"N/A","N/A","N/A","N/A","Night Vision Monoculars",242,19.99,-60,1,1,-29,24.61,24.55,2,2.4,"BINOCK Official Store","China",1,0,"N/A","Small Standard-Size",0.71,3.58,7.52,0.31,9.62,26.55,"12/31/2024",14,6,0,0.61
"https://amazon.com/dp/B0DKN7R112","https://m.media-amazon.com/images/I/51fDJIN28+L._SX450_.jpg","B0DKN7R112","All-Metal J-arm Night Vision NVG Mount for AN/PVS-14 Monocular, with Rotating Knuckle for Attachment to Helmets, Black","ZTFSETD","FBM","Sports & Outdoors",904264,730818963234,"N/A",0730818963234,"N/A","Night Vision Monoculars",241,45.99,"N/A",1,1,,45.99,45.96,"N/A","N/A","Kunshan Chuangxing","China",1,0,"N/A","N/A","N/A","N/A","N/A","N/A","N/A","N/A","-",15,7,0,"N/A"
"https://amazon.com/dp/B0CWTPMVRM","https://m.media-amazon.com/images/I/71MXz8PTRBL._SX450_.jpg","B0CWTPMVRM","NVG 2K Night Vision Goggles for Adults, Helmet Mounted Night Vision Monocular with 4 Color Modes 4X Magnification, HD Recording & Playback for Hunting Surveillance","GOYOJO","FBM","Sports & Outdoors",911548,658361254923,"N/A",0658361254923,"N/A","Night Vision Monoculars",244,529,"N/A",0,0,,"-","-",3,3,"HUITEN","China",1,0,"N/A","Large bulky",15.98,14.02,7.99,18.96,"N/A","N/A","01/31/2025",22,6,0,0
"https://amazon.com/dp/B09XMTYL4H","https://m.media-amazon.com/images/I/41N+ArsLI7L._SX450_.jpg","B09XMTYL4H","PARD Night Vision Scope, Hunting Night Vision with IR 850nm, Night Vision Monocular for Hunting, Surveillance, Animal Observation, NV008SPLRF-850nm","Pard","FBM","Sports & Outdoors",929400,"N/A","N/A","N/A","N/A","Night Vision Monoculars",248,499,-18,1,1,50,630.86,630.8,12,3.5,"PARD","China",1,20,"N/A","Large Standard-Size",4.53,5,11.5,3.35,"N/A","N/A","03/31/2025",45,6,0,0.11
"https://amazon.com/dp/B0CYH7V921","https://m.media-amazon.com/images/I/71M5nL9oDZL._SX450_.jpg","B0CYH7V921","Thermal Scope 12μm 400x300 Thermal Monocular Hunting Night Vision Scope 25mm IP67 Handheld Thermal Night Vision 8X Zoom WiFi Thermal Imaging Monocular,16GB Video Record","YWYLL","FBA","Sports & Outdoors",935958,"N/A","N/A","N/A","N/A","Night Vision Monoculars",252,1389,28,1,1,-122,1289.79,1289.74,1,5,"YWYLL","China",1,18,"N/A","Large Standard-Size",12.01,10.43,5.31,4.41,335.24,924.8,"09/30/2025",21,6,0,0.91
"https://amazon.com/dp/B0DNQ93Z48","https://m.media-amazon.com/images/I/61aha4yktYL._SX450_.jpg","B0DNQ93Z48","Thermal Monocular, 384x288 (AI Super Resolution) Thermal Imaging Monocular,1.43"" Large AMOLED Display,Thermal Night Vision with Wi-Fi Hotspot/STA/MIC,12hrs+ Battery Powers","GT AUDIO","FBA","Sports & Outdoors",937622,"N/A","N/A","N/A","N/A","Night Vision Monoculars",249,498.99,-12,0,0,-25,"-","-",4,2.9,"GT AUDIO","China",1,0,"N/A","Large Standard-Size",3.43,5.47,10.04,1.94,94.84,261.63,"02/28/2025",14,12,0,0.12
"https://amazon.com/dp/B07YCXRBNY","https://m.media-amazon.com/images/I/714eTHNlzQL._SX450_.jpg","B07YCXRBNY","AGM Global Vision Sidewinder TM35-384 Thermal Imaging Monocular","AGM Global Vision","FBM","Sports & Outdoors",942115,810027770127,"N/A",0810027770127,"N/A","Night Vision Monoculars",253,1995,"N/A",3,3,200,5127.83,5127.77,1,4,"RIVER RIDGE ENTERPRISES LLC","USA",2,20,122,"Large Standard-Size",4.45,9.25,13.27,4.3,"N/A","N/A","11/30/2024",62,3,0,2.72
"https://amazon.com/dp/B0DCQ4JYYS","https://m.media-amazon.com/images/I/51ZYMSGJ9LL._SX450_.jpg","B0DCQ4JYYS","ATN NVGONVG72G NVG7-2G, Night Vision Goggle gen 2+ 55-57lp/mm - Green Phosphor","ATN","FBM","Sports & Outdoors",946247,658175124382,00658175124382,0658175124382,"N/A","Night Vision Monoculars",254,2449,-57,0,0,,"-","-","N/A","N/A","Sparkfish","USA",1,1,"N/A","Large bulky",12,15,10,5,"N/A","N/A","08/31/2024",17,2,0,"N/A"
"https://amazon.com/dp/B0BH1L3G6B","https://m.media-amazon.com/images/I/51bGd+UW8IL._SX450_.jpg","B0BH1L3G6B","Armasight 6X Lens for PVS-14 with Waterproof Design, Lightweight Body, and 8-Degree Field of View (Black)","Armasight","Amazon","Sports & Outdoors",946867,810081910132,"N/A",0810081910132,"N/A","Night Vision Monoculars",255,249,-36,0,0,-109,"-","-",1,5,"Amazon","N/A",2,0,"N/A","Large Standard-Size",2.25,2.5,4.05,0.55,"N/A","N/A","10/31/2025",39,6,0,0
"https://amazon.com/dp/B0FRKV435T","https://m.media-amazon.com/images/I/61iT6FkSFcL._SX450_.jpg","B0FRKV435T","Sig Sauer Echo MV50-DV 1.5-24x50mm Dual View Thermal Monocular - Adjustable FOV, Photo & Video Capture, App Control, 10-Hour Runtime - Waterproof IP67 Nighttime Hunting Monocular (SOEC42320)","Sig Sauer","FBM","Sports & Outdoors",960413,798681704194,00798681704194,0798681704194,"N/A","Night Vision Monoculars",258,3999.99,-9,1,1,,4342.28,4342.23,"N/A","N/A","Sports-and-Gadgets","USA",4,0,"N/A","N/A","N/A","N/A","N/A","N/A","N/A","N/A","10/31/2025",4,7,0,"N/A"
"https://amazon.com/dp/B001DZQTNS","https://m.media-amazon.com/images/I/712okLXEjbL._SX450_.jpg","B001DZQTNS","Brunton Lite Tech Monocular","Brunton","FBA","Sports & Outdoors",989774,732773464085,"N/A",0732773464085,"N/A","Night Vision Monoculars",267,48.95,-2,0,0,200,"-","-",63,2.9,"Friend of Brand","USA",3,17,-43,"Large Standard-Size",5.5,6,2.4,0.25,39.87,110,"04/30/2024",256,6,0,0.01
"https://amazon.com/dp/B0F9YZPW5M","https://m.media-amazon.com/images/I/51SWSg3ro8L._SX450_.jpg","B0F9YZPW5M","Housoutil Monocular Night Vision Telescope Portable Telescope for Adults for Stargazing Outdoor Activities Hiking Camping","Housoutil","FBM","Sports & Outdoors",991969,"N/A","N/A","N/A","N/A","Night Vision Monoculars",268,13.69,3,4,4,,53.12,53.07,"N/A","N/A","Entertainment First","China",2,0,"N/A","Large Standard-Size",6.69,2.55,2.55,0.51,"N/A","N/A","11/30/2025",8,9,0,"N/A"
"https://amazon.com/dp/B00MN5GAM2","https://m.media-amazon.com/images/I/21xSoJfYhlL._SX450_.jpg","B00MN5GAM2","Walters 4x12 Monocular, 1.25 Inch Aperture, Manual Focus, 12.5 Degrees FOV, Beginner, Adults, Unisex","N/A","FBM","Sports & Outdoors",994929,"N/A","N/A","N/A","N/A","Night Vision Monoculars",270,165.34,-8,3,3,,527.3,527.22,6,4.5,"Willow Rock Health","USA",3,12,20,"Large Standard-Size",3.8,2,1.7,0.3,"N/A","N/A","11/30/2025",167,1,0,0.54
"https://amazon.com/dp/B0DMV5JSD7","https://m.media-amazon.com/images/I/51rIFSajOkL._SX450_.jpg","B0DMV5JSD7","Night Vision Monocular - High powerr Digital Adults Monocular, Portable infraredd Night Vision Monocular | Low Light Vision Device, Low Light Monocular for Outdoors, Camping Gear, Concert and Stadium","Generic","FBM","Sports & Outdoors",1000523,"N/A","N/A","N/A","N/A","Night Vision Monoculars",274,8.59,-12,2,2,,15.83,15.73,1,1,"sauvebe","China",1,19,"N/A","Large Standard-Size",4.37,1.85,1.89,0.15,"N/A","N/A","03/31/2025",14,8,0,2.01
"https://amazon.com/dp/B0FRKCDJPD","https://m.media-amazon.com/images/I/51OxMkssQfL._SX450_.jpg","B0FRKCDJPD","SIG SAUER Echo MV35 2-16x35mm Thermal Monocular - Digital Zoom, Photo & Video Capture, App Control, 10-Hour Runtime - Waterproof IP67 Nighttime Hunting Monocular, Flat Dark Earth (SOEC42200)","Sig Sauer","FBM","Sports & Outdoors",1002711,798681704170,00798681704170,0798681704170,"N/A","Night Vision Monoculars",274,2499.99,-25,0,0,-75,"-","-","N/A","N/A","MidwayUSA, Inc.","USA",3,0,"N/A","Large Standard-Size",1,1,1,2,"N/A","N/A","09/30/2025",4,7,0,"N/A"
"https://amazon.com/dp/B0FXRRLNPQ","https://m.media-amazon.com/images/I/610J3tRSWQL._SX450_.jpg","B0FXRRLNPQ","Night Vision Monocular, Infrared Imager Night Vision, 4X Electronic Zoom, Long Battery Life,Clip-on Night Vision Scope for Night Observation, Range up to 300 m","cdpdmai","FBM","Sports & Outdoors",1014013,"N/A","N/A",4953698076498,"N/A","Night Vision Monoculars",277,69.99,50,1,1,,97.99,97.95,"N/A","N/A","cdpdmai-us","China",1,0,"N/A","N/A","N/A","N/A","N/A","N/A","N/A","N/A","11/30/2025",3,7,0,"N/A"
