"https://amazon.com/dp/B0CFV58PD6","https://m.media-amazon.com/images/I/51-hP1D-QdL._SX450_.jpg","B0CFV58PD6","RUSUO Lens,Monocular Crossing Cursor Digital Night-Visions Device Infrared Day Night Use Night-Visions Device 500M Full Black Viewing Distance 4X Digital Zoom Night-Visions Device","RUSUO","FBM","Sports & Outdoors",2028439,"N/A","N/A","N/A","N/A","Night Vision Monoculars",515,88.99,-23,0,0,100,"-","-",1,5,"123Dengjiale","China",1,1,"N/A","N/A","N/A","N/A","N/A","N/A","N/A","N/A","03/31/2024",29,9,0,0.12
"https://amazon.com/dp/B0FLDL7Q2V","https://m.media-amazon.com/images/I/51BtnceHASL._SX450_.jpg","B0FLDL7Q2V","Caseeda Thermal Monocular for Hunting,Night Vision Scope with HD AMOLED Display, Video Recording, Built-in 32GB Memory, 8X Digital Zoom, 2200ft Range, WiFi, IP67 Waterproof","caseeda","-","Sports & Outdoors",2029407,"N/A","N/A","N/A","N/A","Night Vision Monoculars",515,465,46,0,0,-120,"-","-","N/A","N/A",,"N/A",1,0,"N/A","Large Standard-Size",8.8,5.3,3.5,2.2,"N/A","N/A","10/31/2025",5,8,1,"N/A"
"https://amazon.com/dp/B0DCQCY39D","https://m.media-amazon.com/images/I/61rgkLE0aNL._SX450_.jpg","B0DCQCY39D","ATN ACCOSMS44534 Tico Scope Mounting System - 44mm Objective - clamp 53.4mm","ATN","FBM","Sports & Outdoors",2052992,658175124788,"N/A",0658175124788,"N/A","Night Vision Monoculars",519,191.15,-28,0,0,,"-","-","N/A","N/A","Sparkfish","USA",3,0,"N/A","Large bulky",12,15,10,5,"N/A","N/A","08/31/2025",17,1,0,"N/A"
"https://amazon.com/dp/B0D5YLMHD9","https://m.media-amazon.com/images/I/61JKm9aUwvL._SX450_.jpg","B0D5YLMHD9","Night Vision Monocular Handheld 4K Full Color Night Vision Infrared Thermal Monocular 256x192 Three Modes WiFi Thermal Imaging Monocular Support Save Photo and Video with 128GB Large Storage Capacity","Guune","FBA","Sports & Outdoors",2062533,"N/A","N/A","N/A","N/A","Night Vision Monoculars",520,599,-18,0,0,,"-","-",3,5,"Guune","China",1,0,"N/A","Large Standard-Size",5.31,3.74,2.76,1.98,27.58,76.09,"01/31/2025",19,6,0,0
"https://amazon.com/dp/B00JK11388","https://m.media-amazon.com/images/I/31uQr+aa9cL._SX450_.jpg","B00JK11388","LRI bppnvg Night Vision LED, Green","LRI","FBM","Sports & Outdoors",2087362,790134008125,00790134008125,0790134008125,"N/A","Night Vision Monoculars",525,13.95,-17,0,0,,"-","-",2,4.4,"PhotonLight.com, Inc.","USA",2,0,"N/A","Small Standard-Size",5.3,2.4,0.7,0.02,"N/A","N/A","06/30/2025",141,7,0,0
"https://amazon.com/dp/B0DVTDSFBV","https://m.media-amazon.com/images/I/61l3QvENQOL._SX450_.jpg","B0DVTDSFBV","AGM Global Vision PVS-14E 3AL1 Night Vision Monocular with Gen 3 Auto-Gated Level 1, P43-Green Phosphor IIT, Auto Shut-Off, Manual Gain, Built-in IR Illuminator, Military-Grade NVG Made in USA","AGM Global Vision","Amazon","Sports & Outdoors",2092261,810164391476,"N/A",0810164391476,"N/A","Night Vision Monoculars",527,4195,-25,0,0,,"-","-","N/A","N/A","Amazon","N/A",3,0,"N/A","Large Standard-Size",4.49,7.32,12.56,2.65,"N/A","N/A","06/30/2025",11,8,0,"N/A"
"https://amazon.com/dp/B0FBM2LPK6","https://m.media-amazon.com/images/I/61oQjaP-SFL._SX450_.jpg","B0FBM2LPK6","Monoculars Telescope High Power Folding High-Powered Binoculars Nitrogen Waterproof Telescope with Low Light for Bird Watching Outdoor Sports Games Binoculars","Generic","FBM","Sports & Outdoors",2092967,"N/A","N/A","N/A","N/A","Night Vision Monoculars",529,126.99,-28,0,0,,"-","-","N/A","N/A","cjy19980515","China",1,0,"N/A","N/A","N/A","N/A","N/A","N/A","N/A","N/A","07/31/2025",7,5,0,"N/A"
"https://amazon.com/dp/B0FJFTWMMM","https://m.media-amazon.com/images/I/61w246qhUlL._SX450_.jpg","B0FJFTWMMM","PARD Thermal Monocular, Thermal Imaging Monocular with 12μm Pixel Size, WiFi, Waterproof, High-Sensitivity NETD ≤25mK for Hunting, Surveillance & Outdoor Exploration, Leopard 256 with 16mm Lens","Pard","-","Sports & Outdoors",2093000,"N/A","N/A","N/A","N/A","Night Vision Monoculars",528,649,-8,0,0,,"-","-","N/A","N/A",,"N/A",1,0,"N/A","Large Standard-Size",9.06,6.69,3.35,1.85,"N/A","N/A","-",6,4,8,"N/A"
"https://amazon.com/dp/B0FJFWSHV5","https://m.media-amazon.com/images/I/61w246qhUlL._SX450_.jpg","B0FJFWSHV5","PARD Thermal Monocular, Thermal Imaging Monocular with 12μm Pixel Size, WiFi, Waterproof, High-Sensitivity NETD ≤25mK for Hunting, Surveillance & Outdoor Exploration, Leopard 256 with 11mm Lens","Pard","-","Sports & Outdoors",2093095,"N/A","N/A","N/A","N/A","Night Vision Monoculars",528,510,-8,0,0,,"-","-","N/A","N/A",,"N/A",1,0,"N/A","Large Standard-Size",9.06,6.69,3.35,1.85,"N/A","N/A","-",6,5,8,"N/A"
"https://amazon.com/dp/B0CX8Q8Z42","https://m.media-amazon.com/images/I/41fqoGXAOLL._SX450_.jpg","B0CX8Q8Z42","AMNOUR PVS 14 PVS 31 Close Focus Stop Ring for Objective Lens D-Ring Night Vision Tube Monocular, Black, JTSF9648","AMNOUR","FBM","Sports & Outdoors",2094633,"N/A","N/A",3440368612717,"N/A","Night Vision Monoculars",530,75.25,-17,0,0,,"-","-","N/A","N/A","Shangxing Home Furnishing Store","China",2,0,"N/A","Small Standard-Size",1.18,0.79,0.39,0.11,"N/A","N/A","11/30/2025",22,4,1,"N/A"
"https://amazon.com/dp/B0CKZHCF6Y","https://m.media-amazon.com/images/I/51HdjcGqArL._SX450_.jpg","B0CKZHCF6Y","AGM 13F8P82325401 FoxBat-8 3AW1 – Night Vision Bi-Ocular 8X with Gen 3 ""Level 1""; Included: NVB, Long-Range Infrared Illuminator, Tripod, and Hard Case; Super-Fast, Multi-Coated, All-Glass Optics","Generic","FBM","Sports & Outdoors",2106069,810027773685,"N/A",0810027773685,"N/A","Night Vision Monoculars",532,5895,-7,0,0,,"-","-","N/A","N/A","EuroOptic (✅ Authorized Dealer ✅ Fastest Shipping)","USA",2,0,"N/A","N/A","N/A","N/A","N/A","N/A","N/A","N/A","06/30/2025",27,4,0,"N/A"
"https://amazon.com/dp/B0CX8JJTX4","https://m.media-amazon.com/images/I/51eTN3T25xL._SX450_.jpg","B0CX8JJTX4","Thermal Scope Hunting Night Vision 384x288 30mm Lens Thermal Monocular 1800M Detection Thermal Imaging Scope,IP67 Video Recording","YWYLL","FBM","Sports & Outdoors",2119084,"N/A","N/A","N/A","N/A","Night Vision Monoculars",534,1450,-28,0,0,,"-","-","N/A","N/A","shenzhenshijinmanxiukejiyouxiangongsi","China",1,0,"N/A","Large Standard-Size",14.96,6.69,5.51,3.75,"N/A","N/A","11/30/2024",22,6,0,"N/A"
"https://amazon.com/dp/B0F9ZW28ZM","https://m.media-amazon.com/images/I/61Y9T4dzuPL._SX450_.jpg","B0F9ZW28ZM","Caseeda AM-C1 256 * 190 (50Hz) Thermal imageing monocular & Night Vision monocular & 4K HD Googles, Day and Night See it All, with 13 Viewing Mode Waterproof Device for Hunting, Outdoor","AMAGICAR","FBA","Sports & Outdoors",2121940,"N/A","N/A","N/A","N/A","Night Vision Monoculars",535,475,-20,0,0,,"-","-","N/A","N/A","Amagicar   store","China",1,0,"N/A","Large Standard-Size",7.48,6.3,3.54,2.2,84.06,231.89,"05/31/2025",12,8,0,"N/A"
"https://amazon.com/dp/B0DPCCJFFT","https://m.media-amazon.com/images/I/51HKsiIL2AL._SX450_.jpg","B0DPCCJFFT","HMWOKPOT Night Vision Scope for 35-45mm Eyepiece Scope, DIY Night Vision(Day and Night) Long Viewing Range Night Hunting with Infrared Flashlight and 4.3 inch Display Screen","HMWOKPOT","FBM","Sports & Outdoors",2129688,"N/A","N/A",3001577972827,"N/A","Night Vision Monoculars",536,118.27,-27,0,0,,"-","-",1,4,"HMWOKPOT Shop","China",1,0,"N/A","N/A","N/A","N/A","N/A","N/A","N/A","N/A","05/31/2025",14,8,0,0
"https://amazon.com/dp/B0DVTDDMMN","https://m.media-amazon.com/images/I/61l3QvENQOL._SX450_.jpg","B0DVTDDMMN","AGM Global Vision PVS-14E NW1 Enhanced Night Vision Monocular – Gen 2+ Level 1, P45-White Phosphor IIT, Auto Shut-Off, Manual Gain, Built-in IR Illuminator, Lightweight & Compact Military-Grade NVG","AGM Global Vision","Amazon","Sports & Outdoors",2165096,810164391445,"N/A",0810164391445,"N/A","Night Vision Monoculars",544,3295,-47,0,0,,"-","-","N/A","N/A","Amazon","N/A",2,0,"N/A","Large Standard-Size",4.53,7.24,12.68,2.36,"N/A","N/A","04/30/2025",11,7,0,"N/A"
"https://amazon.com/dp/B0DJVL4JZT","https://m.media-amazon.com/images/I/31QAInrzv4L._SX450_.jpg","B0DJVL4JZT","4K HD Digital Infrared Night Vision Monocular Camera with Tactical Light Camera Night Vision Device","kjlhj","FBM","Sports & Outdoors",2176827,"N/A","N/A",8436678154875,"N/A","Night Vision Monoculars",546,68.88,"N/A",0,0,,"-","-","N/A","N/A","Fenglandianpu","N/A",1,0,"N/A","N/A","N/A","N/A","N/A","N/A","N/A","N/A","04/30/2025",15,9,0,"N/A"
"https://amazon.com/dp/B0DWKLX64H","https://m.media-amazon.com/images/I/51T6TwFJ-EL._SX450_.jpg","B0DWKLX64H","2025 Upgrade - Night Vision Monocular, 1312FT Long Range HD Hunting Infrared Goggles Night Vision Monocular for Adults - Ideal for Thermal Scope and Night Vision Binoculars","LMHSDTK","-","Sports & Outdoors",2177008,095900975701,"N/A",0095900975701,"N/A","Night Vision Monoculars",545,47.32,-28,0,0,,"-","-","N/A","N/A",,"N/A",1,0,"N/A","Large Standard-Size",3.27,3.35,7.09,0.75,"N/A","N/A","04/30/2025",72,9,0,"N/A"
"https://amazon.com/dp/B0CLDZVQ31","https://m.media-amazon.com/images/I/61orOcT0YwL._SX450_.jpg","B0CLDZVQ31","SUZLAZYR Digital Night Vision Rifle Scope with Crosshair, 200M Full Dark Infrared Night Vision Goggles, Can Photo Taking Video Recording, Support Sight of 40mm~46mm","SUZLAZYR","FBM","Sports & Outdoors",2206013,"N/A","N/A",1091428693379,"N/A","Night Vision Monoculars",548,149.99,-9,0,0,,"-","-","N/A","N/A","MaoTuo","China",1,0,"N/A","N/A","N/A","N/A","N/A","N/A","N/A","N/A","03/31/2025",27,7,0,"N/A"
"https://amazon.com/dp/B0DHRTH144","https://m.media-amazon.com/images/I/51q0FllPCZL._SX450_.jpg","B0DHRTH144","Digital Monocular Telescope, 2.5K HD NightVision Monocular, 10X Digital Zoom 7 Gear Infrared NightVision Monocular for Travel Concerts","GOWENIC","FBM","Sports & Outdoors",2214267,"N/A","N/A","N/A","N/A","Night Vision Monoculars",550,55.75,-12,0,0,,"-","-","N/A","N/A","Archuus","China",1,0,"N/A","Large Standard-Size",6.69,3.54,3.15,0.64,"N/A","N/A","03/31/2025",16,9,0,"N/A"
"https://amazon.com/dp/B0BBSW2BFG","https://m.media-amazon.com/images/I/51wkFYQJj5L._SX450_.jpg","B0BBSW2BFG","AGM Global Vision 11P14123484121 Model PVS-14 3AW2 Night Vision Monocular, Waterproof, Built-in Infrared Illuminator and Flood Lens, Manual Gain Control, 1x Magnification, Auto Shut-Off System","AGM Global Vision","FBM","Sports & Outdoors",2227134,785249841484,"N/A",0785249841484,"N/A","Night Vision Monoculars",551,5143.3,-12,0,0,,"-","-","N/A","N/A","Sale Stores ✅","USA",1,0,"N/A","N/A","N/A","N/A","N/A","N/A","N/A","N/A","02/28/2025",41,6,0,"N/A"
"https://amazon.com/dp/B0DCPXQ6P8","https://m.media-amazon.com/images/I/51TwaUrD0AL._SX450_.jpg","B0DCPXQ6P8","ATN NVMPPVS1453HFW PVS14-3HFW, Night Vision Monocular 51 FOV- Super High-Performance FOM 2376+ Gen 3 Auto-Gated, P45 White Phospher","ATN","FBM","Sports & Outdoors",2229855,658175124368,00658175124368,0658175124368,"N/A","Night Vision Monoculars",552,7249,-33,0,0,,"-","-","N/A","N/A","EuroOptic (✅ Authorized Dealer ✅ Fastest Shipping)","USA",1,0,"N/A","Large bulky",12,15,10,5,"N/A","N/A","02/28/2025",17,1,0,"N/A"
"https://amazon.com/dp/B0DPN15RH6","https://m.media-amazon.com/images/I/51PXyRKwuiL._SX450_.jpg","B0DPN15RH6","WGFXYBFY Rechargeable Night-Vision Monocular Device, 850nm Digital Infrared Night Vision Scope, with 1.54 Inch Display and 1700mah Battery, Supports Charging While Using, Black","WGFXYBFY","FBM","Sports & Outdoors",2232833,"N/A","N/A",1092148481420,"N/A","Night Vision Monoculars",553,129.99,-10,0,0,,"-","-","N/A","N/A","Xiaofugui Shop","China",1,0,"N/A","N/A","N/A","N/A","N/A","N/A","N/A","N/A","02/28/2025",13,7,0,"N/A"
"https://amazon.com/dp/B01HDXT6GA","https://m.media-amazon.com/images/I/910lFzWMcsL._SX450_.jpg","B01HDXT6GA","L3 Insight Technology PEQ-15 Pattern Generators (Tan)","L3","FBM","Sports & Outdoors",2242002,735255927092,"N/A",0735255927092,"N/A","Night Vision Monoculars",555,84.99,-6,0,3,,"-",222.95,"N/A","N/A","MODArmory","USA",1,0,"N/A","N/A","N/A","N/A","N/A","N/A","N/A","N/A","11/30/2025",115,1,0,"N/A"
"https://amazon.com/dp/B09W174NPF","https://m.media-amazon.com/images/I/41iGzrjoVoL._SX450_.jpg","B09W174NPF","UNI-T UTX318 Hunting Thermal Imager Handheld Night Vision Outdoor Monocular Observation Infrared Thermal Imager","UNI-T","FBM","Sports & Outdoors",2251125,749666767567,"N/A",6935750531808,"N/A","Night Vision Monoculars",558,599,-23,0,0,,"-","-","N/A","N/A","UNI-T US","USA",2,0,"N/A","N/A","N/A","N/A","N/A","N/A","N/A","N/A","02/28/2025",46,1,0,"N/A"
"https://amazon.com/dp/B0CKZCXQKY","https://m.media-amazon.com/images/I/51Zvxi09elL._SX450_.jpg","B0CKZCXQKY","AGM 13F8P822153211 FoxBat-8 NL1 – Night Vision Bi-Ocular 8X with Gen 2+ ""Level 1""; Included: NVB, Long-Range Infrared Illuminator, Tripod, and Hard Case; Super-Fast, Multi-Coated, All-Glass Optics","Generic","FBM","Sports & Outdoors",2253865,850038039813,"N/A",0850038039813,"N/A","Night Vision Monoculars",559,4640.3,-23,0,0,,"-","-","N/A","N/A","Sale Stores ✅","USA",1,0,"N/A","N/A","N/A","N/A","N/A","N/A","N/A","N/A","02/28/2025",27,7,0,"N/A"
"https://amazon.com/dp/B0DMD5H4HR","https://m.media-amazon.com/images/I/61ksIHEeCHL._SX450_.jpg","B0DMD5H4HR","Night Vision Goggles for Helmet, Head Mounted Digital Night Vision Monocular with 4 Color Modes, 3X Magnification Infrared HD Record&Playback Goggles for Hunting Surveillance Camping","allsNice","FBA","Sports & Outdoors",2254844,"N/A",06934399226298,"N/A","N/A","Night Vision Monoculars",561,219.89,-33,0,0,,"-","-","N/A","N/A","AllsNice","China",1,0,"N/A","Large Standard-Size",5.91,2.36,6.69,1.54,47.01,129.68,"01/31/2025",14,7,0,"N/A"
"https://amazon.com/dp/B0DN5M3V2Q","https://m.media-amazon.com/images/I/61OYyEPSqqL._SX450_.jpg","B0DN5M3V2Q","WGFXYBFY NVG 50 Night Vision Goggles, Helmet Mounted Night Vision Monocular, 4 Color Effects Day and Night Use Support WiFi, for Camping and Surveillance","WGFXYBFY","FBM","Sports & Outdoors",2264686,"N/A","N/A",1092148480577,"N/A","Night Vision Monoculars",563,659.99,-21,0,0,,"-","-","N/A","N/A","Xiaofugui Shop","China",1,0,"N/A","N/A","N/A","N/A","N/A","N/A","N/A","N/A","01/31/2025",14,6,0,"N/A"
"https://amazon.com/dp/B01M3Y4IJ3","https://m.media-amazon.com/images/I/71i-4+sLn2L._SX450_.jpg","B01M3Y4IJ3","NightStar Digital Night Vision 4x42mm Monocular, Black, NS41442","NIGHTSTAR","FBM","Sports & Outdoors",2271285,799599164032,00799599164032,0799599164032,"N/A","Night Vision Monoculars",567,123.13,1,0,0,,"-","-",1,5,"KART IT","USA",2,4,"N/A","Large Standard-Size",3.31,4.84,8.58,1.17,"N/A","N/A","01/31/2025",110,10,0,0
"https://amazon.com/dp/B07G9QMFHC","https://m.media-amazon.com/images/I/61kkngMpHXL._SX450_.jpg","B07G9QMFHC","Optex Outdoor 10X Stabilized Monocular","Optex Outdoor","FBM","Sports & Outdoors",2279981,867928000112,"N/A",0867928000112,"N/A","Night Vision Monoculars",567,299.99,-10,0,0,,"-","-",4,4.1,"Optex Systems","USA",1,4,"N/A","N/A","N/A","N/A","N/A","N/A","N/A","N/A","01/31/2025",89,4,0,0
"https://amazon.com/dp/B0D9K95J2Y","https://m.media-amazon.com/images/I/61UFyG6qyGL._SX450_.jpg","B0D9K95J2Y","SKIOVEMI Night Vision Scope/Digital Night Vision Goggles Monocular for Adults, Helmet Mounted Night Vision Goggles with 1.54 in HD Screen for Fishing, Hiking and Outdoor Activities","SKIOVEMI","FBM","Sports & Outdoors",2280436,"N/A","N/A",1091475293195,"N/A","Night Vision Monoculars",568,165,-37,0,0,,"-","-","N/A","N/A","SKIOVEMI","China",1,2,"N/A","N/A","N/A","N/A","N/A","N/A","N/A","N/A","12/31/2024",18,7,0,"N/A"
"https://amazon.com/dp/B0CX8P7B94","https://m.media-amazon.com/images/I/41dstfiE4eL._SX450_.jpg","B0CX8P7B94","AMNOUR PVS 14 PVS 31 Objective Lens Aluminum Holder Ring Fixing Ring locating Ring seat Ring Night Vision Tube Monocular, Black, JTSF9648","AMNOUR","FBM","Sports & Outdoors",2281104,"N/A","N/A",3440368612601,"N/A","Night Vision Monoculars",569,59.11,-21,0,0,,"-","-","N/A","N/A","Shangxing Home Furnishing Store","China",1,0,"N/A","Small Standard-Size",1.18,0.79,0.39,0.11,"N/A","N/A","01/31/2025",22,4,1,"N/A"
"https://amazon.com/dp/B0D3PVS99R","https://m.media-amazon.com/images/I/61GQJslpl3L._SX450_.jpg","B0D3PVS99R","LKJYBG 1080P Night Vision Goggles,Digital Night Vision Monocular,Rechargeable Digital Infrared Night Vision Scope with 3800 Mah,Travel Monoculars Save Photos & Videos for Camping(with 64GB Card) R7","LKJYBG","FBM","Sports & Outdoors",2289010,"N/A","N/A",6955635758625,"N/A","Night Vision Monoculars",570,48.89,-6,0,0,,"-","-",1,5,"LKJYBG","China",1,0,"N/A","Large Standard-Size",6.3,3.15,3.15,0.67,"N/A","N/A","11/30/2025",20,9,1,0.42
"https://amazon.com/dp/B0DPMMH6P2","https://m.media-amazon.com/images/I/71f9k07xxgL._SX450_.jpg","B0DPMMH6P2","WGFXYBFY 4K Night Vision Goggles, Head Mounted Night Vision Monocular 8X Digital Zoom 7-Level Infrared with Wristband, Headband and 32GB TF Card to Photo and Video for Camping","WGFXYBFY","FBM","Sports & Outdoors",2290220,"N/A","N/A",1092148481383,"N/A","Night Vision Monoculars",572,139.99,-18,0,0,,"-","-","N/A","N/A","Xiaofugui Shop","China",1,0,"N/A","N/A","N/A","N/A","N/A","N/A","N/A","N/A","12/31/2024",13,7,0,"N/A"
"https://amazon.com/dp/B0DN5PK1LG","https://m.media-amazon.com/images/I/61vh2ba3jYL._SX450_.jpg","B0DN5PK1LG","WGFXYBFY Night Vision Monocular for Adults, 940nm Infrared Night Vision Scope 45° Wide Field of View Night Vision Goggles, 4X Magnification Support WiFi for Camping and Observe Wildlife","WGFXYBFY","FBM","Sports & Outdoors",2295487,"N/A","N/A",1092148480553,"N/A","Night Vision Monoculars",573,659.99,-8,0,0,,"-","-","N/A","N/A","Xiaofugui Shop","China",1,0,"N/A","N/A","N/A","N/A","N/A","N/A","N/A","N/A","01/31/2025",14,6,0,"N/A"
"https://amazon.com/dp/B0DCQ49K9T","https://m.media-amazon.com/images/I/51AAeeFnsFL._SX450_.jpg","B0DCQ49K9T","ATN NVMPAN142G NVM14-2G, Night Vision Monocular gen 2+ 58-60lp/mm - P43 Green Phosphor","ATN","FBM","Sports & Outdoors",2298975,658175124214,00658175124214,0658175124214,"N/A","Night Vision Monoculars",574,2099,-6,0,0,,"-","-","N/A","N/A","EuroOptic (✅ Authorized Dealer ✅ Fastest Shipping)","USA",1,1,"N/A","Large bulky",12,15,10,5,"N/A","N/A","01/31/2025",17,1,0,"N/A"
"https://amazon.com/dp/B0D69TRB7P","https://m.media-amazon.com/images/I/61WHQKtR94L._SX450_.jpg","B0D69TRB7P","Twilite Night Vision Monocular - Full Color 4-8x40mm Digital Night Vision Camera for Camping Hunting & Fishing","Hwishare","FBA","Sports & Outdoors",2299617,767461375398,"N/A",0767461375398,"N/A","Night Vision Monoculars",576,999,-26,0,0,,"-","-","N/A","N/A","Hwishare US","China",1,0,"N/A","Large Standard-Size",9.8,8.1,3.1,2.6,123.89,341.78,"-",19,8,0,"N/A"
"https://amazon.com/dp/B0DNW2GPCV","https://m.media-amazon.com/images/I/61CARrF5SkL._SX450_.jpg","B0DNW2GPCV","WGFXYBFY 984 FT Night Vision Monocular, 1080P Infrared Night Vision Scope, with 7 Types of Infrared Crosshairs 4X Digital Zoom and 3400mah Rechargeable Battery, for Camping and Wildlife Watching,850NM","WGFXYBFY","FBM","Sports & Outdoors",2304765,"N/A","N/A",1092148480928,"N/A","Night Vision Monoculars",577,249.99,-28,0,0,,"-","-","N/A","N/A","Xiaofugui Shop","China",1,0,"N/A","N/A","N/A","N/A","N/A","N/A","N/A","N/A","11/30/2024",14,7,2,"N/A"
"https://amazon.com/dp/B0DNW3WSQT","https://m.media-amazon.com/images/I/61CARrF5SkL._SX450_.jpg","B0DNW3WSQT","WGFXYBFY 984 FT Night Vision Monocular, 1080P Infrared Night Vision Scope, with 7 Types of Infrared Crosshairs 4X Digital Zoom and 3400mah Rechargeable Battery, for Camping and Wildlife Watching,940NM","WGFXYBFY","FBM","Sports & Outdoors",2304765,"N/A","N/A",1092148480935,"N/A","Night Vision Monoculars",577,269.99,-23,0,0,,"-","-","N/A","N/A","Xiaofugui Shop","China",1,0,"N/A","N/A","N/A","N/A","N/A","N/A","N/A","N/A","11/30/2024",14,7,2,"N/A"
"https://amazon.com/dp/B0DNMP6J7Q","https://m.media-amazon.com/images/I/71c20eqzLhL._SX450_.jpg","B0DNMP6J7Q","WGFXYBFY 4.3"" Infrared Night Vision Scope 850nm Night Vision Monocular for Adults, Can Be Used Day or Night for Outdoor Hunting Device","WGFXYBFY","FBM","Sports & Outdoors",2305785,"N/A","N/A",1092148480737,"N/A","Night Vision Monoculars",578,129.99,-35,0,0,,"-","-","N/A","N/A","Xiaofugui Shop","China",1,0,"N/A","N/A","N/A","N/A","N/A","N/A","N/A","N/A","11/30/2024",14,7,0,"N/A"
"https://amazon.com/dp/B0D9S4FYQQ","https://m.media-amazon.com/images/I/61iQdtbX8XL._SX450_.jpg","B0D9S4FYQQ","SKIOVEMI Night Vision Monocular - 1080P Video Camera Infrared Dark Vision Device, 350M Photo Taking Video Recording for Outdoor Fishing Boating","SKIOVEMI","FBM","Sports & Outdoors",2306067,"N/A","N/A",1091475293355,"N/A","Night Vision Monoculars",579,174,-9,0,0,,"-","-","N/A","N/A","SKIOVEMI","China",1,0,"N/A","N/A","N/A","N/A","N/A","N/A","N/A","N/A","12/31/2024",18,7,0,"N/A"
"https://amazon.com/dp/B0BV6J7TZZ","https://m.media-amazon.com/images/I/31vzSXPfIQL._SX450_.jpg","B0BV6J7TZZ","TD430 TD Series Handheld Thermal Imaging Monocular Infrared Thermal Imager Scope Monocular (TD430)","GOYOJO","FBM","Sports & Outdoors",2312832,614162612836,"N/A",0614162612836,"N/A","Night Vision Monoculars",581,2130,-27,0,0,,"-","-","N/A","N/A","HUITEN","China",2,0,"N/A","N/A","N/A","N/A","N/A","N/A","N/A","N/A","-",11,9,0,"N/A"
"https://amazon.com/dp/B00TZHBBLG","https://m.media-amazon.com/images/I/71qcbN6moeL._SX450_.jpg","B00TZHBBLG","ATN PVS14-3 Night Vision Monocular US Gen 3","ATN","FBM","Sports & Outdoors",2324397,658175117506,"N/A",0658175117506,"N/A","Night Vision Monoculars",585,4716.76,-6,0,0,,"-","-","N/A","N/A","Sparkfish","USA",1,0,"N/A","N/A","N/A","N/A","N/A","N/A","N/A","N/A","11/30/2024",43,6,0,"N/A"
"https://amazon.com/dp/B0DN5GXB89","https://m.media-amazon.com/images/I/61VnXlAOWLL._SX450_.jpg","B0DN5GXB89","WGFXYBFY Rechargeable Night Vision Monocular for Adults, HD Recording and Playback, for Camping with 16GB Memory Card, NVG50 Infrared Night Vision Scope","WGFXYBFY","FBM","Sports & Outdoors",2331695,"N/A","N/A",1092148480560,"N/A","Night Vision Monoculars",585,659.99,-2,0,0,,"-","-","N/A","N/A","Xiaofugui Shop","China",1,0,"N/A","N/A","N/A","N/A","N/A","N/A","N/A","N/A","-",14,6,0,"N/A"
"https://amazon.com/dp/B0CQCKPQ8G","https://m.media-amazon.com/images/I/51deP42yEZL._SX450_.jpg","B0CQCKPQ8G","FUIBEJAE Pilot Pro Night Vision 5X Infrared Monocular Monocular, Infrared Monoculars with Night Vision Videos and Playback Function for Outdoor","FUIBEJAE","FBM","Sports & Outdoors",2333309,"N/A","N/A",3001741557102,"N/A","Night Vision Monoculars",586,59.2,-15,0,0,,"-","-","N/A","N/A","SHUOCHENGUK","China",1,0,"N/A","N/A","N/A","N/A","N/A","N/A","N/A","N/A","10/31/2024",25,8,0,"N/A"
"https://amazon.com/dp/B0CJQX78Q8","https://m.media-amazon.com/images/I/41SbfZW7NEL._SX450_.jpg","B0CJQX78Q8","IUPPA Digital Night Vision Scope Monocular 1080P 100-200M Travel Infrared Camcorder Support Photo Video Recording Mulle Language for Outdoor Camping Huntings Night Observation Boating","IUPPA","FBM","Sports & Outdoors",2346868,"N/A","N/A","N/A","N/A","Night Vision Monoculars",589,90.59,"N/A",0,0,,"-","-","N/A","N/A","YufaeleT","China",1,0,"N/A","N/A","N/A","N/A","N/A","N/A","N/A","N/A","-",28,9,0,"N/A"
"https://amazon.com/dp/B0DFYLLM95","https://m.media-amazon.com/images/I/610K+F09rcL._SX450_.jpg","B0DFYLLM95","Miasazyr Head-Mounted Night Vision Monocular, Night Vision Goggles for Adult, Infrared Monocular with 8X Digital Zoom, 4K Video & 36MP Photos, 3000mAh Rechargeable Battery for Camping","Miasazyr","FBM","Sports & Outdoors",2352934,"N/A","N/A",1091985561012,"N/A","Night Vision Monoculars",593,129.99,-10,0,0,,"-","-","N/A","N/A","Samanzyr","China",1,1,"N/A","N/A","N/A","N/A","N/A","N/A","N/A","N/A","11/30/2025",16,7,0,"N/A"
"https://amazon.com/dp/B0DB8KBGDS","https://m.media-amazon.com/images/I/71-gcYBy4IL._SX450_.jpg","B0DB8KBGDS","SKIOVEMI Head & Helmet Mounted Night Vision monocular, 4K HD Infrared Digital Night Vision Goggle with Photo and Video Shooting for Camping Travel","SKIOVEMI","FBM","Sports & Outdoors",2356596,"N/A","N/A",1091475293430,"N/A","Night Vision Monoculars",594,136,-27,0,0,,"-","-",1,5,"SKIOVEMI","China",1,0,"N/A","N/A","N/A","N/A","N/A","N/A","N/A","N/A","09/30/2024",18,7,0,0
"https://amazon.com/dp/B0DHLRPMPQ","https://m.media-amazon.com/images/I/71M1oDIbIfL._SX450_.jpg","B0DHLRPMPQ","Predator Thermal Optics Matrix 15-384 LRF Thermal Monocular","Predator Thermal Optics","FBM","Sports & Outdoors",2357467,666945619242,"N/A",0666945619242,"N/A","Night Vision Monoculars",596,1349.99,-30,0,0,,"-","-","N/A","N/A","Predator Thermal Optics","USA",1,0,"N/A","Large Standard-Size",15,7,6,4,"N/A","N/A","09/30/2024",15,9,0,"N/A"
"https://amazon.com/dp/B0DCPPKGPT","https://m.media-amazon.com/images/I/51TwaUrD0AL._SX450_.jpg","B0DCPPKGPT","ATN NVMPPVS1453W PVS14-3W, Night Vision Monocular 51 FOV Gen 3 Auto-Gated, P45-White Phosphor IIT","ATN","FBM","Sports & Outdoors",2358628,658175125174,"N/A",0658175125174,"N/A","Night Vision Monoculars",595,4749,-29,0,0,,"-","-","N/A","N/A","EuroOptic (✅ Authorized Dealer ✅ Fastest Shipping)","USA",2,0,"N/A","Large bulky",12,15,10,5,"N/A","N/A","09/30/2024",17,1,0,"N/A"