"https://amazon.com/dp/B0F4QQK5BN","https://m.media-amazon.com/images/I/61hd6KToPLL._SX450_.jpg","B0F4QQK5BN","1920P HD Dual Lens Endoscope Camera Semi-Rigid Snake Cable IP67 Waterproof 8LED Lights Dimmable HD Industrial Pipeline Inspection Probe Compatible with Smartphones Endoscope Camera (3.5ft)","LAUREII","FBA","Industrial & Scientific",124594,"N/A","N/A","N/A","N/A","Borescopes",297,16.12,1,12,5,-93,247.46,106.6,37,4,"Laureii Direct","China",1,0,"N/A","Large Standard-Size",1.46,5.08,5.12,0.18,19.12,52.74,"06/30/2025",10,8,3,0.32
"https://amazon.com/dp/B0F4QR3BF1","https://m.media-amazon.com/images/I/61mta6++hhL._SX450_.jpg","B0F4QR3BF1","1920P HD Dual Lens Endoscope Camera Semi-Rigid Snake Cable IP67 Waterproof 8LED Lights Dimmable HD Industrial Pipeline Inspection Probe Compatible with Smartphones Endoscope Camera (16.4ft)","LAUREII","FBA","Industrial & Scientific",124601,"N/A","N/A","N/A","N/A","Borescopes",297,19.5,-28,12,2,-93,247.46,42.14,37,4,"Laureii Direct","China",1,0,"N/A","Large Standard-Size",1.46,5.08,5.16,0.42,19.21,52.99,"06/30/2025",10,8,3,0.32
"https://amazon.com/dp/B0DD78SXJF","https://m.media-amazon.com/images/I/713wfsTzFUL._SX450_.jpg","B0DD78SXJF","Sewer Camera Self Leveling, Anysun Sewer Inspection Camera 250ft with 9'' Monitor and DVR Recorder with 32GB Card, Meter Marker, 12 Adjustable Lights","anysun","FBA","Industrial & Scientific",124682,717331217709,"N/A",0717331217709,"N/A","Borescopes",292,639.99,"N/A",21,5,43,13256.96,3169.72,30,4.5,"Nedive","China",1,283,"N/A","Large bulky",13.2,19,20.5,22.8,2588.55,7140.83,"03/31/2024",41,7,5,0.69
"https://amazon.com/dp/B0CYGYXDXZ","https://m.media-amazon.com/images/I/71PTZpu4+VL._SX450_.jpg","B0CYGYXDXZ","Sewer Camera with Self-Leveling, Built-in Distance Counter, Can Connect External Monitor, Zoom in and Out, IP68 Waterproof, 12 pcs Adjustable Light, Plumbing Drain Video Cam with DVR (100FT)","anysun","FBA","Industrial & Scientific",124837,717203891624,"N/A",0717203891624,"N/A","Borescopes",284,499.99,-23,20,1,-85,8443.1,559.97,520,4.3,"ToBestGift","China",1,763,"N/A","Large bulky",8.13,16.88,18.88,16.8,1304.49,3598.59,"04/30/2025",23,8,9,0.04
"https://amazon.com/dp/B09WMH43L3","https://m.media-amazon.com/images/I/71ZM7MeD1rL._SX450_.jpg","B09WMH43L3","Teslong Endoscope Replacement Cable with Light, Triple Lens Inspection Camera 7.9mm/0.3inch Waterproof Probe Compatible with NTS500, NTS300(10FT)","Teslong","FBA","Industrial & Scientific",125554,"N/A","N/A","N/A","N/A","Borescopes",299,89.99,824,19,19,,1741.82,1741.52,9,4.8,"Teslong","China",1,157,"N/A","Large Standard-Size",2.44,8.74,8.78,1.12,94.3,260.15,"11/30/2024",47,6,0,2.15
"https://amazon.com/dp/B0D8Q5TF22","https://m.media-amazon.com/images/I/61LfJ7z+k4L._SX450_.jpg","B0D8Q5TF22","LAUNCH VSP-600 Videoscope, 7mm Snake Camera with 6 LED Lights USB Borescope, IP67 Waterproof HD Borescope Inspection Camera, Industrial HD Endoscope for X-431 Series, Android Cellphone","LAUNCH","FBA","Industrial & Scientific",125714,"N/A","N/A","N/A","N/A","Borescopes",294,56.99,"N/A",20,20,,1164.14,1163.98,27,3.9,"Launch Tech USA","USA",1,290,"N/A","Large Standard-Size",1.97,5.16,11.61,0.62,59.42,163.91,"06/30/2025",19,7,0,0.76
"https://amazon.com/dp/B0CPDLCW1B","https://m.media-amazon.com/images/I/71A4eV97YzL._SX450_.jpg","B0CPDLCW1B","Ulefone uSmart Endoscope E02 for Ulefone Armor 30/29/28/27/26/24/21/18/Pad Series, IP67 Waterproof, 2M Semi-Rigid, 5.5 mm Borescope Dual Camera, 7 LED Lights","Ulefone","FBA","Industrial & Scientific",125967,"N/A","N/A","N/A","N/A","Borescopes",300,79.99,-11,18,5,-52,1297.36,372.89,161,4.2,"Ulefone Direct - US","China",2,310,"N/A","Large Standard-Size",1.57,5,8.46,0.47,33.44,92.24,"06/30/2024",25,7,2,0.11
"https://amazon.com/dp/B00GY7C9ZW","https://m.media-amazon.com/images/I/41bQR5I2XIL._SX450_.jpg","B00GY7C9ZW","Vividia Ablescope VA-400 v5 Rigid One-Way Articulating USB Borescope 8.5mm/0.33"" Diameter 42cm/16.5"" IP67 Waterproof Probe","VIVIDIA","FBA","Industrial & Scientific",126153,858499002834,"N/A",0858499002834,"N/A","Borescopes",287,235.8,-11,21,21,-14,4909.79,4909.65,202,3.9,"SmokeDaddy LLC","USA",2,200,-44,"Large bulky",3,4.4,28,2.55,186.08,513.33,"03/31/2024",147,9,0,0.1
"https://amazon.com/dp/B08DV62166","https://m.media-amazon.com/images/I/61mv61zhBuL._SX450_.jpg","B08DV62166","Ulefone uSmart Endoscope E01 for Ulefone Armor 30/29/28/27/26/24/21/18/Pad Series, IP67 Waterproof 3-in-1, 2M Semi-Rigid, 5.5 mm Borescope Inspection Camera, 6 LED Lights","Ulefone","FBA","Industrial & Scientific",126560,"N/A","N/A",6978200491086,"N/A","Borescopes",299,69.99,-12,18,13,-52,1297.36,924,161,4.2,"Ulefone Direct - US","China",2,310,"N/A","Large Standard-Size",1.57,5,8.46,0.29,33.44,92.24,"06/30/2024",67,7,2,0.11
"https://amazon.com/dp/B0DXP6S228","https://m.media-amazon.com/images/I/71jH9Pxg9TL._SX450_.jpg","B0DXP6S228","Dual-Lens Endoscope Camera with Light, Borescope with 5"" IPS Screen, Photo & Record Video Inspection Cameras with 32G SD Card, IP67 Waterproof Snake Camera, Tools Cool Gadgets for Men (16.5FT)","WINWEND","FBA","Industrial & Scientific",127234,"N/A","N/A","N/A","N/A","Borescopes",302,49.96,-33,22,22,-72,1064.87,1064.54,49,4.4,"POWEHIGH","China",1,0,"N/A","Large Standard-Size",2.99,5.87,11.06,1.19,97.73,269.61,"04/30/2025",12,9,0,0.45
"https://amazon.com/dp/B0FMKFY56V","https://m.media-amazon.com/images/I/717VNXCSkCL._SX450_.jpg","B0FMKFY56V","Sewer Camera 100ft/30M 7"" Rainproof IPS Screen Pipe Drain Inspection Camera DVR Recorder with Meter Marker 23MM 1080P Industrial Borescope 32G Card for Drain Pipe Plumbing","SYOWNFS","FBA","Industrial & Scientific",127316,"N/A","N/A","N/A","N/A","Borescopes",303,284.05,-17,11,3,63,2833.58,854.59,4,4,"ENNIO","China",1,0,"N/A","Large Standard-Size",8,13.5,16.5,11.2,897.19,2475,"09/30/2025",6,7,4,2.72
"https://amazon.com/dp/B0FMKG8RJK","https://m.media-amazon.com/images/I/717VNXCSkCL._SX450_.jpg","B0FMKG8RJK","Sewer Camera 66ft/20M 7"" Rainproof IPS Screen Pipe Drain Inspection Camera DVR Recorder with Meter Marker 23MM 1080P Industrial Borescope 32G Card for Drain Pipe Plumbing","SYOWNFS","FBA","Industrial & Scientific",127517,"N/A","N/A","N/A","N/A","Borescopes",304,251.79,-37,11,8,63,2833.58,1978.63,4,4,"ENNIO","China",1,0,"N/A","Large bulky",12.99,11.66,16.93,7.87,1291.04,3561.49,"09/30/2025",6,7,4,2.72
"https://amazon.com/dp/B0F6CSNVZJ","https://m.media-amazon.com/images/I/61hh5XaeX-L._SX450_.jpg","B0F6CSNVZJ","VEVOR Endoscope Camera with Light, 1920P HD Borescope for Android & iOS, 8 LED Lights Inspection Camera with 16.4FT Semi-Rigid Cable, 2X Zoom, IP67 Waterproof Snake Scope Camera for Auto, Plumbing","VEVOR","Amazon","Industrial & Scientific",127789,197988675518,"N/A",0197988675518,"N/A","Borescopes",305,23.99,9,40,14,-66,1010.86,343,56,3.7,"Amazon","N/A",2,0,"N/A","Large Standard-Size",1.38,5.39,5.91,0.44,"N/A","N/A","06/30/2025",10,9,3,0.72
"https://amazon.com/dp/B0F6CTJM12","https://m.media-amazon.com/images/I/619FVVvKV0L._SX450_.jpg","B0F6CTJM12","VEVOR Endoscope Camera with Light, 1920P HD Borescope for Android & iOS, 8 LED Lights Inspection Camera with 10FT Semi-Rigid Cable, 2X Zoom, IP67 Waterproof Snake Scope Camera for Auto, Plumbing","VEVOR","FBM","Industrial & Scientific",127793,197988678908,"N/A",0197988678908,"N/A","Borescopes",305,23.99,11,40,21,-66,1010.86,502.43,56,3.7,"VEVOR Shop","China",1,0,"N/A","Large Standard-Size",6.02,5.43,1.18,0.35,"N/A","N/A","06/30/2025",10,9,3,0.72
"https://amazon.com/dp/B0F6WZPTJZ","https://m.media-amazon.com/images/I/612qOALStNL._SX450_.jpg","B0F6WZPTJZ","VEVOR Endoscope Camera with 49.2FT Semi-Rigid Cable, 1920P HD Borescope for Android & iOS, Industrial Inspection Tool with Light - 8 LED, 2X Zoom, IP67 Waterproof Snake Camera for Auto, Plumbing","VEVOR","FBM","Industrial & Scientific",127793,197988676607,"N/A",0197988676607,"N/A","Borescopes",305,28.99,-16,40,5,-66,1010.86,164.62,56,3.7,"VEVOR Shop","China",1,0,"N/A","Large Standard-Size",2.91,5.71,5.98,1.48,"N/A","N/A","06/30/2025",10,9,3,0.72
"https://amazon.com/dp/B0FLNCK645","https://m.media-amazon.com/images/I/71Vvxzm78yL._SX450_.jpg","B0FLNCK645","Anykit Two-Way Articulating Borescope with Light, 1080P HD Articulating Borescope with Semi-Rigid Snake Camera, Flexible Snake Scope for Wall Automotive, IP67 Waterproof Inspection, 3.9FT","Anykit","FBA","Industrial & Scientific",128603,860012040162,"N/A",0860012040162,"N/A","Borescopes",305,69.99,-22,61,61,-87,3666.26,3665.94,51,4.7,"AnyKit","China",2,0,"N/A","Large Standard-Size",3.39,8.74,15.2,1.23,226.74,625.49,"11/30/2025",6,7,0,1.19
"https://amazon.com/dp/B0D9NXWB82","https://m.media-amazon.com/images/I/71cpmS-45FL._SX450_.jpg","B0D9NXWB82","150 FT Sewer Camera Snake,with 12 LED 32GB Card 4.3'' Video Screen,HD JQKJCAM Plumbing Pipe Drain Inspection Camera with Light Distance Counter for Plumber Householder(50M/165FT)","JQKJCAM","FBA","Industrial & Scientific",129512,"N/A","N/A","N/A","N/A","Borescopes",307,312,-11,12,1,308,3337.06,393.87,14,4.3,"JJKJ Cam","China",1,117,"N/A","Large Standard-Size",13.39,11.8,6.3,9.26,501.16,1382.52,"05/31/2024",19,8,19,0.89
"https://amazon.com/dp/B0DSB8W53Y","https://m.media-amazon.com/images/I/71H2fWpQnFL._SX450_.jpg","B0DSB8W53Y","Bore Scope Camera with Light, Borescope Inspection Camera, Industrial Camera 1080P HD 4.3"" Screen, IP67 Waterproof Snake Camera with 8 LED Lights, Drain Camera, Cool Gadgets for Men, 16.5Ft","Julaiwy","FBA","Industrial & Scientific",130298,"N/A","N/A","N/A","N/A","Borescopes",299,29.9,-52,95,95,309,2024.65,2024.55,9,4.8,"Kecowl","China",1,0,"N/A","Large Standard-Size",2.91,4.88,7.28,1.04,52.05,143.59,"01/31/2026",13,8,0,10.59
"https://amazon.com/dp/B008H1EAOQ","https://m.media-amazon.com/images/I/31m23GaGGmL._SX450_.jpg","B008H1EAOQ","RIDGID 40043 Micro CA-25 Hand-Held Inspection Camera with 4' Cable, Borescope, Red","RIDGID","Amazon","Industrial & Scientific",131045,637262214366,00095691400437,0095691400437,"N/A","Borescopes",310,123.93,-17,33,33,-37,3900.1,3899.88,327,4.5,"Amazon","N/A",10,359,-15,"Large Standard-Size",4.29,10.98,14.8,4.94,"N/A","N/A","09/30/2024",162,7,0,0.1
"https://amazon.com/dp/B09WMFVTWJ","https://m.media-amazon.com/images/I/81znhrYb6cL._SX450_.jpg","B09WMFVTWJ","Teslong Endoscope Replacement Cable with Light, Triple Lens Inspection Camera 7.9mm/0.3inch Waterproof Probe Compatible with NTS500, NTS300(16.5FT)","Teslong","FBA","Industrial & Scientific",131595,"N/A","N/A","N/A","N/A","Borescopes",311,99.99,-9,7,7,313,691.79,691.57,8,4.6,"Teslong","China",1,92,"N/A","Large Standard-Size",2.44,8.82,9.61,1.98,104.13,287.24,"03/31/2025",47,6,0,0.86
"https://amazon.com/dp/B0F9NMV4DC","https://m.media-amazon.com/images/I/51XiCjlMPaL._SX450_.jpg","B0F9NMV4DC","Sanyipace 512Hz Pipe Locator - Compatible with Sewer Camera 512Hz Transmitter, 16.5ft Range, 10H Battery, 3.5"" Screen, Far/Near Modes for Pipes, HVAC, Drain, Ideal for Plumber, Electrician, Contractor","Sanyipace","FBA","Industrial & Scientific",131683,"N/A","N/A","N/A","N/A","Borescopes",305,399.99,"N/A",29,8,,11286.03,3159.73,4,4.7,"Yans Minie","China",1,0,"N/A","Large Standard-Size",5.7,9.45,17.32,5.07,469.71,1295.75,"12/31/2025",9,7,2,7.32
"https://amazon.com/dp/B0DD2S2MXB","https://m.media-amazon.com/images/I/71XTozV+2IL._SX450_.jpg","B0DD2S2MXB","UNIOJO 5.2mm Borescope, Endoscope Camera with Light, IP67 Waterproof Sewer Camera with 4.3"" LCD Screen, 1080P HD with 8 LED Lights, 32GB Card, Carrying Case, Gadgets for Men & Tools for Men","UNIOJO","FBA","Industrial & Scientific",132809,"N/A","N/A","N/A","N/A","Borescopes",312,31.99,-20,19,19,29,741.18,740.99,649,4.2,"UNIOJO","China",2,206,-88,"Large Standard-Size",2.24,5.43,7.6,0.95,46.54,128.39,"03/31/2024",18,9,7,0.03
"https://amazon.com/dp/B0CS2CX8TR","https://m.media-amazon.com/images/I/5196SKmMFSL._SX450_.jpg","B0CS2CX8TR","Sanyipace 512Hz Pipe Locator Underground, Plumbing Tools, Sewer Camera Accessories, 3000mAh Battery Powered, Rechargeable Receiver Locating Wand - Blue & Black","Sanyipace","FBA","Industrial & Scientific",133335,"N/A","N/A","N/A","N/A","Borescopes",313,379.88,"N/A",29,21,,11286.03,8125.89,4,4.7,"Yans Minie","China",1,0,"N/A","Large Standard-Size",4.41,11.54,14.09,4.06,361.02,995.92,"12/31/2025",26,4,2,7.32
"https://amazon.com/dp/B0FL7HD4PD","https://m.media-amazon.com/images/I/81qaJEXKSzL._SX450_.jpg","B0FL7HD4PD","Sewer Camera 100FT/30M 23mm Pipe Inspection Camera DVR & Audio Recorder with 7"" IPS Screen, Plumbing Snake Borescope 12 LEDs HD 1000TVL, Included 32GB Card","GAMWATER","FBA","Industrial & Scientific",133415,614019415177,"N/A",0614019415177,"N/A","Borescopes",308,289.88,-21,18,18,36,4675.81,4675.68,6,3.8,"huizhoushishanmaikejiyouxiangongsi","China",1,0,"N/A","Large Standard-Size",16.9,13,7.88,11.1,871.63,2404.49,"10/31/2025",6,6,0,2.94
"https://amazon.com/dp/B0C2ZBB6V5","https://m.media-amazon.com/images/I/71SjUR4hqIL._SX450_.jpg","B0C2ZBB6V5","HBUDS Sewer Camera Self Leveling, 100ft Drain Pipe Cameras with Meter Counter, 12V 4500mAh Battery Plumbing Snake Camera with Light, 7"" Color HD Duct Chimney Sewer Inspection Cam, DVR Recorder 16GB","HBUDS","FBA","Industrial & Scientific",133521,774196180999,"N/A",0774196180999,"N/A","Borescopes",306,399.99,-22,19,4,-76,9476.32,1766.21,223,4.1,"Hanxuan tech","China",1,1281,"N/A","Large bulky",8.2,14.4,16.5,13.8,980.93,2706,"02/28/2025",42,7,6,0.09
"https://amazon.com/dp/B0C4H7RJY7","https://m.media-amazon.com/images/I/813dsUQyBwL._SX450_.jpg","B0C4H7RJY7","Triple Lens Borescope with 7"" IPS Screen, Teslong 1080P HD Industrial Endoscope Inspection Camera with Light, 16.5FT Flexible Automotive Mechanic Scope Tool, Waterproof Pipe Snake Camera in Wall Cam","Teslong","FBA","Industrial & Scientific",134286,"N/A","N/A","N/A","N/A","Borescopes",314,329.99,-17,29,29,-56,9477.06,9476.64,65,4.3,"Teslong","China",1,521,-12,"Large Standard-Size",4.29,13.07,14.72,5.67,415.54,1146.33,"02/28/2025",33,8,0,0.44
"https://amazon.com/dp/B0CCJ5R7RF","https://m.media-amazon.com/images/I/611XYYBfbqL._SX450_.jpg","B0CCJ5R7RF","Endoscope Camera with Light, 1920P HD Borescope with 8 Adjustable LED Lights, with iOS System,not for 15+","OKUBOX","FBA","Industrial & Scientific",134544,701807732650,"N/A",0701807732650,"N/A","Borescopes",316,13.99,-12,18,18,-72,262.5,262.2,207,3.9,"OKUBOX","China",1,1803,9,"Large Standard-Size",1.26,5.31,5.55,0.37,18.71,51.63,"03/31/2025",31,6,0,0.09
"https://amazon.com/dp/B0FPR1WXYW","https://m.media-amazon.com/images/I/71U52BDc5OL._SX450_.jpg","B0FPR1WXYW","Sanyipace Self-Leveling Sewer Camera 165FT/50M, Drain Inspection Camera with 512Hz Transmitter, Real-Time Distance Counter, 10"" IPS Screen Microphone Speaker, 0.27in Rigid Cable, 32GB TF Card Included","Sanyipace","FBA","Industrial & Scientific",135089,"N/A","N/A","N/A","N/A","Borescopes",317,1599.99,-13,22,7,,43396.47,11405.02,45,4,"Urselection","China",1,38,138,"Extra-large 50+ to 70 lb",12,23,27,30.5,3751.88,10350,"12/31/2025",5,6,11,0.49
"https://amazon.com/dp/B0FPQYQN2G","https://m.media-amazon.com/images/I/71S+PNuKtZL._SX450_.jpg","B0FPQYQN2G","Sanyipace Heavy-Duty Sewer Camera 328FT/100M, Self-Leveling, 0.27in Rigid Cable w/ 512Hz Transmitter, Real-Time Distance Counter, Plumbing Camera with Microphone Speaker, DVR Recorder, 32GB TF Card","Sanyipace","FBA","Industrial & Scientific",135089,"N/A","N/A","N/A","N/A","Borescopes",317,1999.99,58,22,5,,43396.47,9952.87,45,4,"Urselection","China",1,38,138,"Extra-large 50+ to 70 lb",12.25,22.5,27.25,38.85,3781.47,10431.64,"12/31/2025",5,6,11,0.49
"https://amazon.com/dp/B0DCS5S333","https://m.media-amazon.com/images/I/71uH3UnA0nL._SX450_.jpg","B0DCS5S333","Sanyipace Sewer Camera 165FT/50M with 512Hz Transmitter, Self-Leveling, Drain Plumbing Pipe Inspection Camera with Mic Speaker, DVR Recorder, 16GB TF Card, 9mm Rigid Cable, Pipe Pulley Guide Wheel","Sanyipace","FBA","Industrial & Scientific",135089,"N/A","N/A","N/A","N/A","Borescopes",317,2099.99,"N/A",22,3,,43396.47,6638.59,45,4,"Urselection","China",1,38,138,"Extra-large 70+ to 150 lb",16,29.5,32.5,60,7723.26,21305.56,"12/31/2025",18,7,11,0.49
"https://amazon.com/dp/B0CQC5KQ3X","https://m.media-amazon.com/images/I/715Q9nUNQ7L._SX450_.jpg","B0CQC5KQ3X","Sanyipace Sewer Camera 100FT/30M with DVR Recorder, Drain Camera with Lights, Pipe Sewer Scope Inspection Camera with IP68 Waterproof Camera Probe, 9"" Color Screen, 16GB TF Card, Camera Guide Wheel","Sanyipace","FBA","Industrial & Scientific",135089,"N/A","N/A","N/A","N/A","Borescopes",317,2199.99,38,22,4,,43396.47,8105.14,45,4,"Urselection","China",1,38,138,"Large bulky",16.4,20.4,20.9,42.3,3520.43,9711.53,"12/31/2025",21,6,11,0.49
"https://amazon.com/dp/B0DCS7LDWG","https://m.media-amazon.com/images/I/71e0dF+6jrL._SX450_.jpg","B0DCS7LDWG","Sanyipace Sewer Camera 230FT/70M with 512Hz Transmitter, Self-Leveling, Drain Plumbing Pipe Inspection Camera with Mic Speaker, DVR Recorder, 16GB TF Card, 9mm Rigid Cable, Pipe Pulley Guide Wheel","Sanyipace","FBA","Industrial & Scientific",135092,"N/A","N/A","N/A","N/A","Borescopes",317,2299.99,"N/A",22,2,,43396.47,3921.74,45,4,"Urselection","China",1,38,138,"Extra-large 70+ to 150 lb",14.76,28.35,31.5,58.42,6636.29,18307.01,"12/31/2025",18,7,11,0.49
"https://amazon.com/dp/B0C3VT1ZCN","https://m.media-amazon.com/images/I/517Ww28MsbL._SX450_.jpg","B0C3VT1ZCN","Endoscope Cable Camera for iPhone,1080P HD Borescope with 8 Adjustable LED Light, IP68 Waterproof 8MM Semi-Rigid Snake Camera for iPhone 14/13/12/11/Pro/Pro Max/Plus/Mini, 3.3FT / 1M","LUKZATEN","FBA","Industrial & Scientific",136487,617037578343,"N/A",0617037578343,"N/A","Borescopes",314,22.95,-18,6,4,-41,128.52,101.2,7,5,"Lukzaten US","China",1,111,26,"Large Standard-Size",2.45,6,6,0.15,44.41,122.5,"02/28/2025",34,9,4,0.8
"https://amazon.com/dp/B0FWQ9CYQ1","https://m.media-amazon.com/images/I/71UPtkIYaQL._SX450_.jpg","B0FWQ9CYQ1","LAUNCH VSP-600 Endoscope 5.5mm Ultra-Thin, Lens HD Wide Application Videoscope Borescope Camera with Light high Definition Multi-Angle Imaging One-Click Snapshot IP67 Waterproof with 2000mm USB Cable","LAUNCH","FBA","Industrial & Scientific",137148,860014855511,"N/A",0860014855511,"N/A","Borescopes",320,55.99,-8,11,11,,606.26,606.15,"N/A","N/A","LAUNCH brand store","N/A",1,0,"N/A","Large Standard-Size",5.12,1.97,11.42,0.66,57.91,159.76,"12/31/2025",4,7,0,"N/A"
"https://amazon.com/dp/B0CR3JKML1","https://m.media-amazon.com/images/I/51v+SkEGDvL._SX450_.jpg","B0CR3JKML1","Endoscope Camera for iPhone 14/13/12/11 Pro/Pro Max,1920P Inspection Camera with 8 Adjustable LED Lights, IP68 Waterproof Borescope Snake Camera for iPhone & iPad (16.5ft Semi-Rigid Cable)","LUKZATEN","FBA","Industrial & Scientific",137187,"N/A","N/A","N/A","N/A","Borescopes",321,21.95,-8,22,22,38,472.26,472.1,21,4.2,"Lukzaten US","China",1,228,23,"Large Standard-Size",1.46,4.76,4.8,0.4,16.79,46.33,"06/30/2025",26,9,0,1.02
"https://amazon.com/dp/B0D2RCQM7W","https://m.media-amazon.com/images/I/71WPwUpV9iL._SX450_.jpg","B0D2RCQM7W","Borescope Camera with Light, 1080P HD Industrial Endoscope with 4.3"" Screen, Semi-Rigid Cable, IP67 Waterproof Scope Camera for Pipe, Plumbing, Engine Inspection","EFUTONPRO","FBA","Industrial & Scientific",137965,628603143865,"N/A",0628603143865,"N/A","Borescopes",322,26.99,-50,12,3,-88,323.17,91.04,92,4.5,"Supermarket2010","China",1,1090,"N/A","Large Standard-Size",2.6,6.89,11.73,1.08,105.8,291.85,"06/30/2025",22,7,3,0.13
"https://amazon.com/dp/B0D4C8Q2XR","https://m.media-amazon.com/images/I/71vYXbdWEEL._SX450_.jpg","B0D4C8Q2XR","Triplett BR300CAM-10M Replacement Borescope 8mm Camera Probe 8mm for BR300, 10M Cable","Triplett","Amazon","Industrial & Scientific",138068,614395004200,00614395004200,0614395004200,"N/A","Borescopes",317,43.48,-55,15,2,56,2456.66,89.93,5,4.2,"Amazon","N/A",2,204,"N/A","Large Standard-Size",6,6,2,0.55,"N/A","N/A","09/30/2025",36,1,17,3.02
"https://amazon.com/dp/B0B2ZPN8RH","https://m.media-amazon.com/images/I/71p5pF63noL._SX450_.jpg","B0B2ZPN8RH","Autel MaxiVideo MV108S Inspection Camera - 8.5mm Diameter, Imager USB Endoscope with Light, 1920x1080 HD 2MP Borescope for Autel Scanner & PC, Upgraded Waterproof Inspection Camera and Cable USB","Autel","FBA","Industrial & Scientific",138135,793101650846,"N/A",0793101650846,"N/A","Borescopes",323,49,-26,18,18,,865.78,865.72,55,4.7,"Autel Powerful","China",1,0,"N/A","Large Standard-Size",1.85,6.93,12.56,0.84,81.07,223.65,"01/31/2026",44,7,2,0.32
"https://amazon.com/dp/B0D63F96LB","https://m.media-amazon.com/images/I/61bdv57u5EL._SX450_.jpg","B0D63F96LB","Sewer Camera Replacement 9inch Display Screen w/8GB DVR Video Rcording,JQKJCAM WP9600A WP90A Pipe Inspection Camera Drain Pipeline Endoscope System Monitor","JQKJCAM","FBA","Industrial & Scientific",138403,"N/A","N/A","N/A","N/A","Borescopes",320,119.9,-19,6,6,-69,725.86,725.75,6,1.9,"JJKJ Cam","China",1,166,"N/A","Large Standard-Size",10.6,9.45,2.36,1.22,119.02,328.34,"05/31/2025",26,6,0,1.01
"https://amazon.com/dp/B09KBSMWJ3","https://m.media-amazon.com/images/I/51p2PF8y8dL._SX450_.jpg","B09KBSMWJ3","DEPSTECH Accessories Including Hook Magnet Protective Cap Reset Pin, for DEPSTECH DS300 DS520 WF028 DS350 DS500 DS600 DS450 Dual Lens Inspection Camera, 7.9mm Dia Probe - Black","DEPSTECH","FBA","Industrial & Scientific",139160,"N/A","N/A","N/A","N/A","Borescopes",324,16.99,15,16,16,3,279.69,279.4,148,4.3,"Depstech","China",1,183,-24,"Large Standard-Size",0.87,3.46,3.78,0.04,5.73,15.8,"03/31/2024",52,9,2,0.11
"https://amazon.com/dp/B0FR1JJ8PR","https://m.media-amazon.com/images/I/41SbYPb2k3L._SX450_.jpg","B0FR1JJ8PR","Visual Endoscope Camera, Endoscope Camera 8 Adjustable LED Lights, Compatible with Android and iPhone","prabensei","FBA","Industrial & Scientific",139276,"N/A","N/A","N/A","N/A","Borescopes",325,45.99,-1,14,14,,642.29,642.15,3,2.9,"HEIYAO Direct Store","China",1,0,"N/A","Large Standard-Size",8.86,3.27,1.18,0.35,17.21,47.48,"12/31/2025",5,5,0,4.81
"https://amazon.com/dp/B0DKJ6W4TC","https://m.media-amazon.com/images/I/71ya60GCvLL._SX450_.jpg","B0DKJ6W4TC","FDGSAB Sewer Camera, 20/50m, 7"" Screen Pipeline Inspection Camera Waterproof IP68 w/12 Adjustable LEDs, DVR Function Have 32GB SD Card .for Sewer Line, Duct Drain Pipe Plumbing (66ft/20M DVR)","FDGSAB","FBA","Industrial & Scientific",139515,"N/A","N/A","N/A","N/A","Borescopes",320,309.99,-20,31,6,16,9288.31,1836.55,18,4.4,"sijifeng","China",1,414,"N/A","Large bulky",10.8,13.1,13.1,9.85,933.13,2574.15,"12/31/2025",16,7,6,1.72
"https://amazon.com/dp/B0D7VDMM6J","https://m.media-amazon.com/images/I/71Nj9GxQrhL._SX450_.jpg","B0D7VDMM6J","Julaiwy Borescope Camera with 8 LED Light, Industrial Endoscope Cameras with Light 4.3"" IPS 1920P HD Screen, Inspection Camera with 16.5ft Semi-Rigid Cable Waterproof, Sewer Drain Pipe Snake Cameras","Julaiwy","FBA","Industrial & Scientific",139786,"N/A","N/A","N/A","N/A","Borescopes",308,26.9,-32,19,19,-16,510.1,509.78,41,4.7,"Kecowl","China",1,238,"N/A","Large Standard-Size",2.72,5.71,10.43,1.23,81.56,224.99,"11/30/2024",20,9,0,0.46
"https://amazon.com/dp/B0DKR2SJ3B","https://m.media-amazon.com/images/I/715BFCLXqKL._SX450_.jpg","B0DKR2SJ3B","Triplett BR400A Waterproof High Definition Borescope with 360° Rotating Dual Camera","Triplett","Amazon","Industrial & Scientific",139847,614395005641,00614395005641,0614395005641,"N/A","Borescopes",328,549.99,"N/A",15,0,56,2456.66,"-",5,4.2,"Amazon","N/A",1,204,"N/A","Large Standard-Size",10,7.5,3.5,2.05,"N/A","N/A","09/30/2025",16,6,17,3.02
"https://amazon.com/dp/B0DKQPKJFC","https://m.media-amazon.com/images/I/71TfBYNZk1L._SX450_.jpg","B0DKQPKJFC","Triplett BR400ACAM-10M Replacement Camera for BR400A Borescope with 10M Cable","Triplett","Amazon","Industrial & Scientific",139848,614395005719,"N/A",0614395005719,"N/A","Borescopes",328,178.3,-31,15,1,56,2456.66,126.58,5,4.2,"Amazon","N/A",3,204,"N/A","Large Standard-Size",6,6,2,0.95,"N/A","N/A","09/30/2025",16,3,17,3.02
"https://amazon.com/dp/B09TBK4QZG","https://m.media-amazon.com/images/I/71QcbZF7-dL._SX450_.jpg","B09TBK4QZG","Triplett BR300 High Definition Forward View Videoscope with Waterproof 5.5mm Camera and 5"" Color LCD Display","Triplett","Amazon","Industrial & Scientific",139852,614395004187,"N/A",0614395004187,"N/A","Borescopes",328,144.07,-21,15,1,56,2456.66,124.09,5,4.2,"Amazon","N/A",8,204,"N/A","Large Standard-Size",3.31,7.28,9.53,1.77,"N/A","N/A","09/30/2025",48,2,17,3.02
"https://amazon.com/dp/B09GC5Z4GD","https://m.media-amazon.com/images/I/71qnfmN721L._SX450_.jpg","B09GC5Z4GD","Triplett BR500 High Definition Articulating Videoscope with Waterproof 6mm Camera and 3.5"" Color TFT LCD Display","Triplett","Amazon","Industrial & Scientific",139852,614395003692,"N/A",0614395003692,"N/A","Borescopes",328,878.31,-30,15,0,56,2456.66,"-",5,4.2,"Amazon","N/A",2,204,"N/A","Large bulky",7,16.13,17.75,10.75,"N/A","N/A","09/30/2025",51,3,17,3.02
"https://amazon.com/dp/B0BQWZCGFY","https://m.media-amazon.com/images/I/61M-z7ZtKoL._SX450_.jpg","B0BQWZCGFY","Triplett SBR2M Waterproof Security Camera Borescope","Triplett","Amazon","Industrial & Scientific",139853,614395004682,"N/A",0614395004682,"N/A","Borescopes",328,89.95,378,15,1,56,2456.66,106.64,5,4.2,"Amazon","N/A",1,204,"N/A","Large Standard-Size",1.3,4.41,6.18,0.3,"N/A","N/A","09/30/2025",38,4,17,3.02
"https://amazon.com/dp/B09TBMGC5B","https://m.media-amazon.com/images/I/717RgX+nvCL._SX450_.jpg","B09TBMGC5B","Triplett BR350 High Definition Forward and Side View Videoscope with Dual Waterproof 5mm Cameras and 5"" Color LCD Display","Triplett","Amazon","Industrial & Scientific",139853,614395004217,"N/A",0614395004217,"N/A","Borescopes",328,214.13,-19,15,1,56,2456.66,117.95,5,4.2,"Amazon","N/A",6,204,"N/A","Large Standard-Size",3.23,7.28,9.57,1.84,"N/A","N/A","09/30/2025",48,1,17,3.02
