"URL","Image URL","ASIN","Title","Brand","Fulfillment","Category","BSR","UPC","GTIN","EAN","ISBN","Subcategory","Subcategory BSR","Price","Price Trend (90 days) (%)","Parent Level Sales","ASIN Sales","Sales Trend (90 days) (%)","Parent Level Revenue","ASIN Revenue","Review Count","Reviews Rating","Seller","Seller Country/Region","Number of Active Sellers","Last Year Sales","Sales Year Over Year (%)","Size Tier","Length","Width","Height","Weight","Storage Fee (Jan - Sep)","Storage Fee (Oct - Dec)","Best Sales Period","Age (Month)","Number of Images","Variation Count","Sales to Reviews"
"https://amazon.com/dp/B0DJ7PB3TN","https://m.media-amazon.com/images/I/81G8Ga784KL._SX450_.jpg","B0DJ7PB3TN","Sewer Camera Self-Leveling, 9'' HD Plumbing Pipe Camera with Depth Marking, Zoom, and Adjustable Brightness LED Lights, Ideal for Drain, Pipes, Wells, Machinery, and Industrial Applications.","PeachLeaf","FBA","Industrial & Scientific",80475,717331238957,"N/A",0717331238957,"N/A","Borescopes",211,429.99,"N/A",30,3,,16248.38,1103.11,1,5,"YoJo-Tech","China",1,0,"N/A","Large bulky",11.4,17.1,19.8,19.5,1943.31,5360.85,"12/31/2025",17,7,13,"N/A"
"https://amazon.com/dp/B0DJ7Q8YNX","https://m.media-amazon.com/images/I/81IFtMfANRL._SX450_.jpg","B0DJ7Q8YNX","Sewer Camera Self-Leveling 200FT, Built-in 512HZ Transmitter, 7MM Cable, 9'' HD Plumbing Camera with Depth Marking, 1080P IPS Screen & DVR 32GB and Adjustable LED Lights","PeachLeaf","FBA","Industrial & Scientific",80475,717331239183,"N/A",0717331239183,"N/A","Borescopes",211,599.99,-26,30,4,,16248.38,2288.39,1,5,"YoJo-Tech","China",1,0,"N/A","Large bulky",12.17,18.5,21.61,19.91,2449.59,6757.48,"12/31/2025",17,8,13,29.56
"https://amazon.com/dp/B0DJ7PQ6BP","https://m.media-amazon.com/images/I/81IFtMfANRL._SX450_.jpg","B0DJ7PQ6BP","Sewer Camera Self-Leveling 300FT, Built-in 512HZ Transmitter, 7MM Cable, 9'' HD Plumbing Camera with Depth Marking, 1080P IPS Screen & DVR 32GB and Adjustable LED Lights","PeachLeaf","FBA","Industrial & Scientific",80475,717331239213,"N/A",0717331239213,"N/A","Borescopes",211,759.99,"N/A",30,1,,16248.38,855.65,1,5,"YoJo-Tech","China",1,0,"N/A","Large bulky",14.37,19.49,21.57,27.73,3041.55,8390.47,"12/31/2025",17,8,13,29.56
"https://amazon.com/dp/B0DP9S17QP","https://m.media-amazon.com/images/I/71Be5LANlYL._SX450_.jpg","B0DP9S17QP","Sanyipace Sewer Camera 65FT/20M, Self-Leveling Drain Pipe Plumbing Camera with 512Hz Transmitter, Clear Meter Marks, for Plumbers Homeowner Home Inspectors Construction Maintenance Worker","Sanyipace","FBA","Industrial & Scientific",80820,"N/A","N/A","N/A","N/A","Borescopes",219,343.09,-58,61,10,99,24695.1,3459.77,64,3.8,"Urselection","China",1,0,"N/A","Large Standard-Size",7,14,16,11.7,789.44,2177.78,"12/31/2025",13,7,11,0.96
"https://amazon.com/dp/B0G15X3PZ2","https://m.media-amazon.com/images/I/71KAVhAUvpL._SX450_.jpg","B0G15X3PZ2","Kcapyn Sewer Camera 100FT/30M Pipe Inspection Borescope Endoscope Camera with Light 6 LEDs 5"" IPS Screen 17MM Plumbing Snake 5000 Mah Battery,1080P High-Definition Industrial Sewer Camera","KCapyn","FBA","Industrial & Scientific",80894,"N/A","N/A","N/A","N/A","Borescopes",212,298.99,-8,38,38,,11309.78,11309.27,4,5,"XIPUKA SECURITY STORE","N/A",1,0,"N/A","Large Standard-Size",15.98,12.01,7.87,9.26,760.9,2099.05,"12/31/2025",1,9,0,9.47
"https://amazon.com/dp/B0D8SDT9HT","https://m.media-amazon.com/images/I/71yBs-5NVeL._SX450_.jpg","B0D8SDT9HT","Ralcam Two-Way Articulating Borescope, Endoscope Camera with Light 0.24in/6.2mm Articulated Inspection Camera, 3.3 FT Semi-Rigid HD Video Snake Scope for Automotive Aircraft Mechanics","Ralcam","FBA","Industrial & Scientific",81630,"N/A","N/A",6977924690294,"N/A","Borescopes",213,99.99,19,80,70,-75,8258.44,6956.24,182,4.6,"Ralcam","China",1,1941,"N/A","Large Standard-Size",2.99,8.62,12.32,2.06,160.06,441.54,"11/30/2024",19,9,5,0.44
"https://amazon.com/dp/B0CJC8KTBM","https://m.media-amazon.com/images/I/71HhC87QeUL._SX450_.jpg","B0CJC8KTBM","Endoscope Camera with Light, 5-inch Dual Lens 1920P HD Borescope, 7.9mm Camera with 9 LEDs, 16.5ft Semi-Rigid Cable, IP67 Waterproof - for Sewer/Drain Pipe, Automotive Inspection, Tools & Cool Gadgets","Daxiongmao","FBA","Industrial & Scientific",82055,739944332556,"N/A",0739944332556,"N/A","Borescopes",214,59.99,4,39,39,-79,2329.23,2329.06,89,4.5,"leersi_jet","China",1,0,"N/A","Large Standard-Size",3.15,5.55,7.87,1.12,69.27,191.09,"05/31/2025",12,8,0,0.44
"https://amazon.com/dp/B0CQYQQ78G","https://m.media-amazon.com/images/I/71MukEyJfTL._SX450_.jpg","B0CQYQQ78G","Anysun Sewer Camera with 512Hz Sonde, Self-Leveling 9"" HD Screen DVR Recorder, 32GB Card, IP68 Waterproof Plumbing Pipe Borescope Inspection, 7mm Cable with Meter Marks(300FT)","anysun","FBA","Industrial & Scientific",82437,774049901870,"N/A",0774049901870,"N/A","Borescopes",215,899.99,-14,28,3,-9,19955.55,2503.58,88,4.3,"ToBestGift","China",1,0,"N/A","Large bulky",13.9,18.9,20.9,24.55,2764.38,7625.89,"12/31/2025",26,8,12,0.32
"https://amazon.com/dp/B0CBS872G4","https://m.media-amazon.com/images/I/71ubwZVoOzL._SX450_.jpg","B0CBS872G4","Self-Leveling Sewer Camera 200FT, Anysun 9"" HD Screen DVR Recorder with 32GB Card, IP68 Waterproof Plumbing Cam Pipe Borescope Drain Inspection with 12pcs LED Light, 7mm Cable with Meter Marks","anysun","FBA","Industrial & Scientific",82440,774196188766,"N/A",0774196188766,"N/A","Borescopes",215,699.99,-7,28,6,-5,19968.1,3941.98,88,4.3,"ToBestGift","China",1,0,"N/A","Large bulky",12.13,17.36,19.92,20.64,2111.91,5825.96,"12/31/2025",31,7,12,0.32
"https://amazon.com/dp/B0G2L4ZXFW","https://m.media-amazon.com/images/I/71HjL5+m-dL._SX450_.jpg","B0G2L4ZXFW","Sewer Camera with Self-Leveling and Distance Count, 512Hz Sonde IP68 Waterproof Cam, 9"" Pipe Drain Inspection with 12pcs Light, DVR with 32GB Card, 7mm Cable (200FT)","anysun","FBA","Industrial & Scientific",82551,717639149382,"N/A",0717639149382,"N/A","Borescopes",215,949.99,"N/A",28,2,-5,19968.1,1801.85,88,4.3,"ToBestGift","China",1,0,"N/A","Large bulky",16,13,11,10,1151.94,3177.78,"12/31/2025",3,8,12,0.32
"https://amazon.com/dp/B0G1C9X4XH","https://m.media-amazon.com/images/I/71pd6+XH1dL._SX450_.jpg","B0G1C9X4XH","Sewer Camera with Self-Leveling and Distance Count, IP68 Waterproof Cam, 9"" Pipe Drain Inspection with 12pcs Light, DVR with 32GB Card, 7mm Cable (100FT)","anysun","FBA","Industrial & Scientific",82551,717639148316,"N/A",0717639148316,"N/A","Borescopes",215,659.99,"N/A",28,7,-5,19968.1,4598.67,88,4.3,"ToBestGift","China",1,0,"N/A","Large bulky",17,16,13,19,1780.28,4911.11,"12/31/2025",3,7,12,0.32
"https://amazon.com/dp/B0DQH18QGD","https://m.media-amazon.com/images/I/71ubwZVoOzL._SX450_.jpg","B0DQH18QGD","Self-Leveling Sewer Camera 300FT, Anysun 9"" HD Screen DVR Recorder with 32GB Card, IP68 Waterproof Plumbing Cam Pipe Borescope Drain Inspection with 12pcs LED Light, 7mm Cable with Meter Marks","anysun","FBA","Industrial & Scientific",82552,717504240985,"N/A",0717504240985,"N/A","Borescopes",215,799.99,"N/A",28,1,-5,19968.1,501.15,88,4.3,"ToBestGift","China",1,0,"N/A","Large bulky",12.2,16.54,10.24,17.64,1040.06,2869.13,"12/31/2025",14,7,12,0.32
"https://amazon.com/dp/B0G2RPNZRS","https://m.media-amazon.com/images/I/41mZlNO3jzL._SX450_.jpg","B0G2RPNZRS","1920P HD Endoscope Camera with Light, 8 Adjustable LED Lights, IP67 Waterproof Borescope, 32.8FT Semi-Rigid Snake Cable, Borescope Inspection Camera Compatible with iPhone Android iOS iPad Smartphone","Douevo","-","Industrial & Scientific",82829,768904901969,"N/A",0768904901969,"N/A","Borescopes",217,23.99,"N/A",28,5,,619.22,125.88,"N/A","N/A",,"N/A",1,0,"N/A","Large Standard-Size",4.8,4.8,1.5,0.35,"N/A","N/A","01/31/2026",3,"N/A",4,"N/A"
"https://amazon.com/dp/B0G2QPMPF4","https://m.media-amazon.com/images/I/71IK3hYk0SL._SX450_.jpg","B0G2QPMPF4","1920P Dual Lens Borescope with 8 Adjustable LED Lights,Endoscope Camera with Light,IP67 Waterproof Inspection Camera,16.4FT Semi-Rigid Snake Camera for iPhone& Android","Douevo","FBA","Industrial & Scientific",82829,768904901938,"N/A",0768904901938,"N/A","Borescopes",217,23.99,1600,28,5,,619.22,125.86,5,5,"JingQiBao","China",1,0,"N/A","Large Standard-Size",1.54,5.16,5.2,0.46,20.8,57.39,"01/31/2026",3,8,4,5.6
"https://amazon.com/dp/B0D6L54LZG","https://m.media-amazon.com/images/I/517ITemE2CL._SX450_.jpg","B0D6L54LZG","Vividia Grabber Borescope Retrieval Pickup Tool with USB Camera, LED Lights, Detachable Magnet for iOS/Android (Diameter 8mm Probe)","VIVIDIA","FBM","Industrial & Scientific",82878,"N/A","N/A","N/A","N/A","Borescopes",218,149.98,-7,23,17,300,3555.57,2532.44,4,3.7,"Oasis Scientific Inc.","USA",2,137,"N/A","Large Standard-Size",15,8.5,2.75,2,"N/A","N/A","12/31/2025",20,9,2,5.73
"https://amazon.com/dp/B0D6L3V6K3","https://m.media-amazon.com/images/I/61bWYx+O2DL._SX450_.jpg","B0D6L3V6K3","Vividia Grabber Borescope Retrieval Pickup Tool with USB Camera, LED Lights, Detachable Magnet for iOS/Android (Diameter 6mm Probe)","VIVIDIA","FBM","Industrial & Scientific",82882,"N/A","N/A","N/A","N/A","Borescopes",218,169.98,2,23,6,300,3555.57,1022.61,4,3.7,"Oasis Scientific Inc.","USA",1,137,"N/A","N/A","N/A","N/A","N/A","N/A","N/A","N/A","12/31/2025",20,9,2,5.73
"https://amazon.com/dp/B0G2RMMK9J","https://m.media-amazon.com/images/I/71MEbiDXNpL._SX450_.jpg","B0G2RMMK9J","1920P HD Endoscope Camera with Light, 8 Adjustable LED Lights, IP67 Waterproof Borescope, 16.4FT Semi-Rigid Snake Cable, Borescope Inspection Camera Compatible with iPhone Android iOS iPad Smartphone","Douevo","FBA","Industrial & Scientific",83275,768904901952,"N/A",0768904901952,"N/A","Borescopes",216,20.99,94,28,18,,619.22,367.12,1,5,"JingQiBao","China",1,0,"N/A","Large Standard-Size",1.54,5.12,5.28,0.44,20.96,57.82,"01/31/2026",3,8,4,27.99
"https://amazon.com/dp/B07THMMMK9","https://m.media-amazon.com/images/I/61eG8n79N-L._SX450_.jpg","B07THMMMK9","BlueFire Dual Lens Wireless Endoscope,Zoomable Focus 1800mA Battery Wireless Endoscope,1080P 5.5mm Semi-Rigid Inspection Camera for iOS and Android Smartphone, Tablet(11.5FT)","BlueFire","FBA","Industrial & Scientific",83660,"N/A","N/A","N/A","N/A","Borescopes",220,30.99,-10,24,24,-58,738.67,738.29,38,4,"BlueFire Tech","China",1,107,88,"Large Standard-Size",2.3,4.4,4.9,0.57,24.97,68.87,"11/30/2025",79,6,0,0.64
"https://amazon.com/dp/B0FSQFN58Q","https://m.media-amazon.com/images/I/61x+0iwaOoL._SX450_.jpg","B0FSQFN58Q","Zealtron Two-Way Articulating Borescope with Light, 3.9mm Articulating Probe Industrial Endoscope Camera with 3.3ft/1m Self-Resetting Tube, 5"" IPS Screen Inspection Camera with Light for Engine/Pipe","zealtron","FBA","Industrial & Scientific",84029,"N/A","N/A","N/A","N/A","Borescopes",220,189.99,-12,30,30,73,5724.23,5724.08,22,4.3,"Zealtron","China",1,0,"N/A","Large Standard-Size",2.25,10.05,17.06,1.55,194.22,535.79,"10/31/2025",5,8,0,1.37
"https://amazon.com/dp/B0F9KTCD56","https://m.media-amazon.com/images/I/51la8qlVu2L._SX450_.jpg","B0F9KTCD56","Articulating Borescope Inspection Camera, 180° Rotatable Head, 1M/3.28FT, IP67 Waterproof, 6 LED Lights, Android iOS Compatible","LANTOTEK","FBA","Industrial & Scientific",84136,"N/A","N/A","N/A","N/A","Borescopes",221,38,-46,18,18,609,693.23,693.13,3,4.4,"LANTOTEK","China",1,0,"N/A","Large Standard-Size",2.36,4.17,13.86,1.17,68.67,189.44,"12/31/2025",9,6,0,6.08
"https://amazon.com/dp/B0C3D545P1","https://m.media-amazon.com/images/I/71e60m+TBWL._SX450_.jpg","B0C3D545P1","Sewer Camera with Locator, Anysun Self Leveling Sewer Inspection Camera 200ft with Meter Marker and DVR, 9'' HD Monitor with 12 Adjustable Lights(32GB Card)","anysun","FBA","Industrial & Scientific",84609,774196181200,00774196181200,0774196181200,"N/A","Borescopes",222,1299.99,-43,35,3,-42,34185.54,4127.03,157,4.2,"Nedive","China",1,682,13,"Large bulky",13,19,20,25.4,2487.15,6861.11,"02/28/2025",34,7,8,0.23
"https://amazon.com/dp/B0C3D3SXDN","https://m.media-amazon.com/images/I/71XeEVBSW5L._SX450_.jpg","B0C3D3SXDN","Sewer Camera with Locator, Anysun Self Leveling Sewer Inspection Camera 150ft with Meter Marker and DVR, 9'' HD Monitor with 12 Adjustable Lights(32GB Card)","anysun","FBA","Industrial & Scientific",84612,774196181170,"N/A",0774196181170,"N/A","Borescopes",222,1199.99,-43,36,4,-42,34600.81,5380.08,157,4.2,"Nedive","China",1,683,14,"Large bulky",13.62,18.81,20.98,23.74,2706.12,7465.16,"02/28/2025",34,7,8,0.23
"https://amazon.com/dp/B0CYSTX8HK","https://m.media-amazon.com/images/I/71nZmy7kGgL._SX450_.jpg","B0CYSTX8HK","Anysun Sewer Camera with 512hz sonde, Self Leveling Sewer Inspection Camera 150ft with 7MM Cable and Meter Marker, 9'' Monitor and DVR, 12 Adjustable Lights(32GB Card)","anysun","FBA","Industrial & Scientific",84702,774049583830,"N/A",0774049583830,"N/A","Borescopes",223,769.99,-14,27,8,-73,19907.77,5785.29,15,4.2,"Nedive","China",1,386,"N/A","Large bulky",11.5,17.2,19.5,18.15,1941.94,5357.08,"08/31/2025",23,7,3,1.79
"https://amazon.com/dp/B0CYSJHBGQ","https://m.media-amazon.com/images/I/71nZmy7kGgL._SX450_.jpg","B0CYSJHBGQ","Anysun Sewer Camera with 512hz sonde, Self Leveling Sewer Inspection Camera 200ft with 7MM Cable and Meter Marker, 9'' Monitor and DVR, 12 Adjustable Lights(32GB Card)","anysun","FBA","Industrial & Scientific",84706,774049583854,"N/A",0774049583854,"N/A","Borescopes",223,839.99,-13,27,4,-73,19907.77,3245.11,15,4.2,"Nedive","China",1,386,"N/A","Large bulky",12,17,20,20.1,2054.17,5666.67,"08/31/2025",23,7,3,1.79
"https://amazon.com/dp/B0B3DBLPF2","https://m.media-amazon.com/images/I/612b5cUj7YL._SX450_.jpg","B0B3DBLPF2","Sanyipace Sewer Camera Charger, Drain Camera Accessories, 12V DC Adapter, 100VAC-240VAC/DC, Battery Power Charger for Pipe Camera, Works with All Sanyipace Sewer Cameras Except S8417D - US Plug","Sanyipace","FBA","Industrial & Scientific",85045,"N/A","N/A","N/A","N/A","Borescopes",222,25.99,-30,20,20,,531.54,531.2,4,5,"SanyipaceDirect Store","China",1,0,"N/A","Large Standard-Size",1.87,2.98,3.65,0.18,10.24,28.25,"12/31/2025",44,1,0,6.81
"https://amazon.com/dp/B093SXC6X7","https://m.media-amazon.com/images/I/81pEAtrPxtS._SX450_.jpg","B093SXC6X7","Sewer Camera with Locator, Anysun 165ft Pipe Video Inspection Camera with 512Hz Sonde and Receiver, 7” LCD Monitor DVR Recorder, IP68 Waterproof (8GB SD Card Included)","anysun","FBA","Industrial & Scientific",85067,770456789353,"N/A",0770456789353,"N/A","Borescopes",223,699.99,-75,36,6,-42,34600.81,4045.46,157,4.2,"Nedive","China",1,683,14,"Large bulky",7.75,19,23.5,23,1742.2,4806.08,"02/28/2025",58,7,8,0.23
"https://amazon.com/dp/B0C3D3JM9K","https://m.media-amazon.com/images/I/71gcyMUIhtL._SX450_.jpg","B0C3D3JM9K","Sewer Camera with Locator, Anysun Self Leveling Sewer Inspection Camera 100ft with Meter Marker and DVR, 9'' HD Monitor with 12 Adjustable Lights(32GB Card)","anysun","FBA","Industrial & Scientific",85069,774196181149,"N/A",0774196181149,"N/A","Borescopes",223,1059.99,-29,36,6,-42,34600.81,6575.99,157,4.2,"Nedive","China",1,683,14,"Large bulky",13,19,20.5,22.15,2549.33,7032.64,"02/28/2025",34,7,8,0.23
"https://amazon.com/dp/B0DD6KFQKW","https://m.media-amazon.com/images/I/71dp-dPx77L._SX450_.jpg","B0DD6KFQKW","Sewer Camera with Locator, Anysun Self Leveling Sewer Inspection Camera 250ft with Meter Marker and DVR, 9'' HD Monitor with 12 Adjustable Lights(32GB Card)","anysun","FBA","Industrial & Scientific",85070,717018396833,"N/A",0717018396833,"N/A","Borescopes",223,1299.99,-29,36,3,-42,34600.81,4534.35,157,4.2,"Nedive","China",1,683,14,"Large bulky",14.6,19.5,21,27.7,3010.11,8303.75,"02/28/2025",30,7,8,0.23
"https://amazon.com/dp/B0DD716469","https://m.media-amazon.com/images/I/71myxpMtEEL._SX450_.jpg","B0DD716469","Sewer Camera with Locator, Anysun Self Leveling Sewer Inspection Camera 300ft with Meter Marker and DVR, 9'' HD Monitor with 12 Adjustable Lights(32GB Card)","anysun","FBA","Industrial & Scientific",85072,717331217594,"N/A",0717331217594,"N/A","Borescopes",223,1499.99,-16,36,2,-42,34600.81,2826.78,157,4.2,"Nedive","China",1,683,14,"Large bulky",15,19.2,21.1,29.35,3059.5,8440,"02/28/2025",30,7,8,0.23
"https://amazon.com/dp/B0DM8TJGN1","https://m.media-amazon.com/images/I/71XOMUtKeWL._SX450_.jpg","B0DM8TJGN1","EIXAUP Sewer Camera Self Leveling, Sewer Inspection Camera 100 ft/30 m with Distance Counter, 7'' IPS 1080P Monitor and DVR Recorder, IP68 Waterproof, 12 Adjustable LED Lights(16GB Card)","EIXAUP","FBA","Industrial & Scientific",85345,"N/A","N/A","N/A","N/A","Borescopes",224,359.99,-24,33,15,49,15959.51,5342.95,10,4.7,"SYST","China",1,0,"N/A","Large bulky",11,13.3,15.5,12.8,1141.7,3149.51,"09/30/2025",15,7,5,3.3
"https://amazon.com/dp/B0DZ2DWH1G","https://m.media-amazon.com/images/I/71N1X2N3dSL._SX450_.jpg","B0DZ2DWH1G","EIXAUP Sewer Camera Self Leveling with Distance Counter, 200 ft/60 m, 7mm Thicker Cable, 7"" IPS 1080P Monitor, 12 Adjustable Lights, IP68 Pipe Inspection Camera with DVR and 32GB Card","EIXAUP","FBA","Industrial & Scientific",85346,"N/A","N/A","N/A","N/A","Borescopes",224,615.99,-28,33,5,49,15959.51,3392.77,10,4.7,"SYST","China",1,0,"N/A","Large bulky",11.5,15.7,18.5,18.85,1681.69,4639.13,"09/30/2025",11,7,5,3.3
"https://amazon.com/dp/B0C9L96KF7","https://m.media-amazon.com/images/I/71jpuGm37JL._SX450_.jpg","B0C9L96KF7","Borescope Inspection with Light, Industrial Endoscope Camera with 4.3” HD Screen, Waterproof Digital Snake Camera, Semi-Rigid Cable Bore Scope for Home Pipe, Engine, Inside Wall, Duct (11.5 FT)","Anykit","FBA","Industrial & Scientific",85448,"N/A","N/A","N/A","N/A","Borescopes",226,50.81,-5,62,62,,2359.05,2358.91,425,4.5,"AnyKit","China",1,73,"N/A","Large Standard-Size",2.21,4.85,7.68,0.9,41.44,114.33,"07/31/2024",32,9,0,0.15
"https://amazon.com/dp/B0DYP4MVQ5","https://m.media-amazon.com/images/I/71XOMUtKeWL._SX450_.jpg","B0DYP4MVQ5","EIXAUP Sewer Camera Self Leveling with 512Hz Sonde Transmitter,100 ft/30 m, 7"" IPS 1080P Monitor, Distance Counter, 12 Adjustable Lights, IP68 Pipe Inspection Camera with DVR and 32GB Card","EIXAUP","FBA","Industrial & Scientific",86140,"N/A","N/A","N/A","N/A","Borescopes",227,517.99,-14,33,9,49,15959.51,4820.72,10,4.7,"SYST","China",1,0,"N/A","Large bulky",11.15,13.51,15.25,12.92,1156.58,3190.56,"09/30/2025",11,7,5,3.3
"https://amazon.com/dp/B0DYP3S7NW","https://m.media-amazon.com/images/I/71SdpvpE6mL._SX450_.jpg","B0DYP3S7NW","EIXAUP Sewer Camera Self Leveling with 512Hz Locator,100 ft/30 m, 7"" IPS 1080P Monitor, Distance Counter, 12 Adjustable Lights, IP68 Pipe Inspection Camera with DVR and 32GB Card","EIXAUP","FBA","Industrial & Scientific",86255,"N/A","N/A","N/A","N/A","Borescopes",227,729.99,-15,33,3,49,15959.51,2402.22,10,4.7,"SYST","China",1,0,"N/A","Large bulky",11.75,15,16.25,16.6,1441.98,3977.86,"09/30/2025",12,7,5,3.3
"https://amazon.com/dp/B0FM7QKR3S","https://m.media-amazon.com/images/I/41srww9ZNyL._SX450_.jpg","B0FM7QKR3S","JINXINEBAY 10 Inch IPS Sewer Inspection Camera with 512Hz Locator, 1080P AHD, 50M Cable, DVR, Auto Self-Leveling, 5X Zoom, TF Card, LED Lights for Pipe/Wall/Drain (165FT)","JINXINEBAY","FBA","Industrial & Scientific",86799,"N/A","N/A","N/A","N/A","Borescopes",228,799.99,-14,20,6,515,15973.97,4883.86,7,4.8,"JINXINEBAY Store","China",1,0,"N/A","Large bulky",13.5,16,18.5,28.05,2011.88,5550,"12/31/2025",6,8,4,2.89
"https://amazon.com/dp/B07RYN9QPC","https://m.media-amazon.com/images/I/41HprMYMlgL._SX450_.jpg","B07RYN9QPC","Endoscope, Ihong Android OTG 1.5M Waterproof Snake HD Video Borescope Soft Wire with USB Type-C 6 Led Lights Security Cable Compatible with Samsung Galaxy/Sony/Nexus Android Smartphone Computer","DEFLECTAIR","FBA","Industrial & Scientific",87868,"N/A","N/A","N/A","N/A","Borescopes",230,9.99,-8,39,39,-1,390.7,390.16,1038,3.5,"Putian Cai Nei Trading Co., Ltd.","China",1,361,"N/A","Large Standard-Size",1.26,4.76,5.08,0.13,15.34,42.32,"02/28/2025",81,8,0,0.04
"https://amazon.com/dp/B0FFGDMNSX","https://m.media-amazon.com/images/I/71WyORtnf-L._SX450_.jpg","B0FFGDMNSX","𝟐𝟎𝟐𝟔 𝐧𝐞𝐰 9” Sewer Camera, HD 1080P w/DVR-32GB, [All-in-One Design with Magnetic Box] Drain Pipe Inspection Camera, [One Big Screw Unlock] Sewer Pipe Cam, 4500mAh, Cable Markers, 100ft/30m","ChoosePRO","FBA","Industrial & Scientific",88731,"N/A","N/A","N/A","N/A","Borescopes",233,399.99,-21,18,18,25,7071.96,7071.65,8,3.6,"ChoosePRO Direct","Hong Kong",1,0,"N/A","Large Standard-Size",7.72,13.89,16.14,15.06,871.36,2403.76,"09/30/2025",8,6,0,2.21
"https://amazon.com/dp/B0G6XZYHRW","https://m.media-amazon.com/images/I/715+P7zfHrL._SX450_.jpg","B0G6XZYHRW","EASTBEAR Dual-Lens Endoscope Camera with Light, 1920P HD Borescope with 8 Adjustable LEDs, 16.4FT Semi-Rigid Snake Cable, IP67 Waterproof Inspection Camera for iOS & Android - Black","EASTBEAR","FBA","Industrial & Scientific",89241,726870777797,"N/A",0726870777797,"N/A","Borescopes",234,29.99,-30,33,52,,995.2,1563.88,17,4.3,"EASTBEAR Store","N/A",1,0,"N/A","Large Standard-Size",1.58,4.93,5.12,0.41,20.08,55.39,"01/31/2026",2,7,2,1.95
"https://amazon.com/dp/B0DNMH4MR6","https://m.media-amazon.com/images/I/41o2hFJ--NL._SX450_.jpg","B0DNMH4MR6","VEVOR Sewer Camera with 512Hz Locator, 98 ft/30 m, 9"" Drain Inspection Camera with Self-Leveling, 36X Zoom, Plumbing Camera with Lights-12 LED, 32GB Card, IP68 Waterproof Snake Camera for Duct Pipe","VEVOR","FBM","Industrial & Scientific",89575,197988808633,"N/A",0197988808633,"N/A","Borescopes",235,669.9,-17,19,19,-47,11196.73,11196.6,10,4.7,"Suplander","China",2,0,"N/A","Large bulky",7.17,16.3,23.15,16.8,"N/A","N/A","03/31/2025",15,12,0,1.89
"https://amazon.com/dp/B0G1MM25PR","https://m.media-amazon.com/images/I/61xVv84VBjL._SX450_.jpg","B0G1MM25PR","Anykit 360° 4 Ways Articulating Borescope, Industrial Endoscope with 0.26 in Articulated Snake Camera, Inspection Camera with 6 Adjustable LED Lights Compatible with Phone and Android - 3.3 FT","Anykit","FBA","Industrial & Scientific",90147,"N/A","N/A","N/A","N/A","Borescopes",238,199.99,30,39,39,,7463.25,7463.09,2,5,"AnyKit","China",1,0,"N/A","Large Standard-Size",3.07,11.61,14.48,2.47,259.85,716.81,"12/31/2025",3,6,0,19.51
"https://amazon.com/dp/B0FM7X3P5X","https://m.media-amazon.com/images/I/71-C0anQ4qL._SX450_.jpg","B0FM7X3P5X","JINXINEBAY 10 Inch IPS Sewer Inspection Camera with 512Hz Locator, 1080P AHD, 50M Cable, DVR, Auto Self-Leveling, 5X Zoom, TF Card, LED Lights for Pipe/Wall/Drain (100FT/512hz Locator)","JINXINEBAY","FBA","Industrial & Scientific",90500,"N/A","N/A","N/A","N/A","Borescopes",239,899.99,-12,20,4,515,15973.97,3173.28,7,4.8,"JINXINEBAY Store","China",1,0,"N/A","Large bulky",14,18.5,20,30.05,2607.99,7194.44,"12/31/2025",6,7,4,2.89
"https://amazon.com/dp/B0FS68V4ZV","https://m.media-amazon.com/images/I/71qpTwd8vmL._SX450_.jpg","B0FS68V4ZV","DEPSTECH DS700SE Triple Lens Endoscope Camera with Lights: 7'' IPS Screen and 16.5FT Flexible Cable Inspection Snake Camera, Industrial Borescope with Video and Sound Recording for Auto, Sewer, Pipe","DEPSTECH","FBA","Industrial & Scientific",90634,"N/A","N/A","N/A","N/A","Borescopes",236,99.99,-40,28,28,-52,2893.38,2892.96,15,4.7,"DEPSTECH Authorized Store","China",1,0,"N/A","Large Standard-Size",2.91,8.62,17.56,3.68,221.77,611.78,"11/30/2025",3,8,0,1.88
"https://amazon.com/dp/B0FQBWRMHQ","https://m.media-amazon.com/images/I/71n5SFybwnL._SX450_.jpg","B0FQBWRMHQ","ZORLET Dual Lens 360° Articulating Borescope with Light, 5'' HD Monitor 4-Way Joystick Inspection Camera, 0.25in Slim Probe 5.0FT Semi-Rigid Snake Industrial Endoscope Camera for Automotive Mechanics","Zorlet","FBA","Industrial & Scientific",90961,"N/A","N/A","N/A","N/A","Borescopes",236,309.99,-12,29,29,20,8918.18,8917.75,28,4.9,"Shenzhen ShenshijieTechnology Co., Ltd","China",1,0,"N/A","Large Standard-Size",15.8,8.5,4.5,4,304.27,839.37,"12/31/2025",5,9,0,1.03
"https://amazon.com/dp/B0B31HCHNB","https://m.media-amazon.com/images/I/71feyxR9H2L._SX450_.jpg","B0B31HCHNB","Autel MaxiVideo MV108S Digital Inspection Camera, 2026 Upgrade MV108/ MV105S/ MV105, 2MP 1920x1080, IP67 Waterproof Industrial Endoscope, 39.37'' Flexible Snake Cable, Compatible w/Autel Scanner & PC","Autel","FBA","Industrial & Scientific",91082,762917121895,"N/A",0762917121895,"N/A","Borescopes",241,49,3,17,17,27,830.69,830.53,51,4.7,"Autel Store","China",1,190,-43,"Large Standard-Size",2.01,6.85,12.68,0.88,87.9,242.48,"10/31/2024",44,7,0,0.33
"https://amazon.com/dp/B0FHK3NQ4R","https://m.media-amazon.com/images/I/71n6pok+KQL._SX450_.jpg","B0FHK3NQ4R","Sanyipace 18MM Sewer Camera, 66FT/20M Drain Inspection Camera with Microphone and Speaker, 1080P IP68 Waterproof Pipe Camera with 8 LEDs, Stiff Cable for Drain Duct Plumbing Inspection, 32GB Card","Sanyipace","FBA","Industrial & Scientific",91603,"N/A","N/A","N/A","N/A","Borescopes",237,199.88,-30,96,37,181,24742.25,7308.39,138,4.3,"Yans Minie","China",1,0,"N/A","Large bulky",9,10.6,11.3,7.2,542.75,1497.25,"12/31/2025",7,6,6,0.69
"https://amazon.com/dp/B0DJLM28ZL","https://m.media-amazon.com/images/I/71W2tuT5afL._SX450_.jpg","B0DJLM28ZL","Sanyipace Sewer Camera 100FT/30M, 0.67in/17mm Pipe Inspection Camera with Light, 5600mAh Battery, Mic & Speaker, 4.3"" Screen, 8 LEDs, 1000TVL Plumbing Snake Camera, Included 16GB Card","Sanyipace","FBA","Industrial & Scientific",91603,"N/A","N/A","N/A","N/A","Borescopes",237,299.98,"N/A",96,11,181,24742.25,3307.59,138,4.3,"Yans Minie","China",1,0,"N/A","Large bulky",11,12.25,14.5,11.9,983.72,2713.72,"12/31/2025",16,7,6,0.69
"https://amazon.com/dp/B0DP9QQZC1","https://m.media-amazon.com/images/I/717mx0ETEpL._SX450_.jpg","B0DP9QQZC1","Sanyipace Sewer Camera 165FT/50M, 0.67in/17mm Pipe Inspection Camera with Light, 5600mAh Battery, Meter Maker, Mic & Speaker, 4.3"" Screen, 8 LEDs, 1000TVL Plumbing Snake Camera, Included 32GB Card","Sanyipace","FBA","Industrial & Scientific",91607,"N/A","N/A","N/A","N/A","Borescopes",237,359.99,"N/A",96,7,181,24742.25,2609.24,135,4.4,"Yans Minie","China",1,0,"N/A","Large bulky",11.02,12.52,14,13.5,972.5,2682.76,"12/31/2025",15,6,6,0.71
