"URL","Image URL","ASIN","Title","Brand","Fulfillment","Category","BSR","UPC","GTIN","EAN","ISBN","Subcategory","Subcategory BSR","Price","Price Trend (90 days) (%)","Parent Level Sales","ASIN Sales","Sales Trend (90 days) (%)","Parent Level Revenue","ASIN Revenue","Review Count","Reviews Rating","Seller","Seller Country/Region","Number of Active Sellers","Last Year Sales","Sales Year Over Year (%)","Size Tier","Length","Width","Height","Weight","Storage Fee (Jan - Sep)","Storage Fee (Oct - Dec)","Best Sales Period","Age (Month)","Number of Images","Variation Count","Sales to Reviews"
"https://amazon.com/dp/B0FNN7VV63","https://m.media-amazon.com/images/I/71O4yW5C1kL._SX450_.jpg","B0FNN7VV63","Two-Way Articulating Borescope 1080P, Industrial Endoscope Camera with Light, Inspection Snake Camera with 5.5mm Probe for Automotive Aircraft Home Mechanics (5.5FT)","gogolux","FBA","Industrial & Scientific",142317,722302655268,"N/A",0722302655268,"N/A","Borescopes",312,139.99,-12,26,26,,3595.1,3594.96,26,4.8,"Womfenn US Official","China",1,0,"N/A","Large Standard-Size",3.27,8.7,14.68,2.76,210.27,580.04,"12/31/2025",6,7,0,1.07
"https://amazon.com/dp/B0G58JRBW8","https://m.media-amazon.com/images/I/412W-VFQw9L._SX450_.jpg","B0G58JRBW8","Endoscope Camera with Light, 1920P HD Borescope Tools with 8 Adjustable LED Lights, Endoscope with Semi-Rigid Snake Camera, Inspection Borescope for iOS and Android 16.4ft Single Lens","COOVIE","FBA","Industrial & Scientific",143625,"N/A","N/A","N/A","N/A","Borescopes",330,25.99,1350,50,31,,1402.69,797.76,14,4.6,"Alice Windowshop","China",1,0,"N/A","Large Standard-Size",1.5,5,5,0.6,18.88,52.08,"01/31/2026",2,7,2,3.55
"https://amazon.com/dp/B0DG95BKNW","https://m.media-amazon.com/images/I/71LCg8UNbZL._SX450_.jpg","B0DG95BKNW","Anysun Sewer Camera with Locator Set, Self-Leveling, 7mm Cable with Depth Marking, IP68 Waterproof Plumbing Endoscope Drain Snake Camera with 9'' Color Screen, 12pcs Light, Recorder with 32GB(200FT)","anysun","FBA","Industrial & Scientific",143698,717331218829,"N/A",0717331218829,"N/A","Borescopes",316,1129.99,-60,11,2,,12028.09,2144.75,8,4.8,"ToBestGift","China",1,0,"N/A","Large bulky",14.4,19.4,21.05,28.2,2960.68,8167.4,"01/31/2026",17,8,10,1.41
"https://amazon.com/dp/B0F7XSRSBR","https://m.media-amazon.com/images/I/71+5StWglcL._SX450_.jpg","B0F7XSRSBR","Endoscope Camera with Light, 1920P HD Borescope Camera for iPhone, 16.4 Ft Semi-Rigid Snake Camera - 8 Adjustable LEDs, IP67 Waterproof Inspection Tools for iOS and Android, Cool Gadgets for Men","Ennovor","FBA","Industrial & Scientific",143847,"N/A","N/A","N/A","N/A","Borescopes",317,16.99,-1,13,85,,224.87,1505.74,17,3.4,"ENNOVOR","China",1,0,"N/A","Large Standard-Size",1.5,4.76,4.92,0.42,17.69,48.79,"11/30/2025",4,9,0,0.78
"https://amazon.com/dp/B0FFXZGVQJ","https://m.media-amazon.com/images/I/71LCg8UNbZL._SX450_.jpg","B0FFXZGVQJ","Anysun Sewer Camera 100ft with Locator Set, Self-Leveling, 7mm Cable with Depth Marking, IP68 Waterproof Plumbing Endoscope Drain Snake Camera with 9'' Color Screen, 12pcs Light, Recorder with 32GB","anysun","FBA","Industrial & Scientific",143947,717661515308,"N/A",0717661515308,"N/A","Borescopes",316,969.99,-59,11,5,,12028.09,4522.79,8,4.8,"ToBestGift","China",1,0,"N/A","Large bulky",18,14,20,22,2537.5,7000,"01/31/2026",17,8,10,1.41
"https://amazon.com/dp/B0FHHF2V6P","https://m.media-amazon.com/images/I/819kFsOWuML._SX450_.jpg","B0FHHF2V6P","Hialemi Portable 9'' Sewer Camera with 512Hz Transmitter - 7MM/ 164Ft/ 50M Self Leveling Drain Camera & Meter Counter & 5X Zoom - 145° Plumbing Pipe Inspection Cam - 1080P IPS Screen & DVR 32GB","Hialemi","FBA","Industrial & Scientific",143962,"N/A","N/A","N/A","N/A","Borescopes",318,999.99,-21,21,4,,18332.28,3519.98,7,4.7,"Hialemi-US Direct","China",1,0,"N/A","Large bulky",13,16,21,25.9,2199.17,6066.67,"11/30/2025",7,9,6,3.05
"https://amazon.com/dp/B0DSHGG8VW","https://m.media-amazon.com/images/I/719-w+QCPhL._SX450_.jpg","B0DSHGG8VW","Two-Way Articulating Borescope Camera with Light, GODIAG Industrial Endoscope with 0.33in Articulated Snake Cam, Video Inspection Scope with Light for Automotive Aircraft Mechanics- 5.5FT","GODIAG","FBA","Industrial & Scientific",144264,889327085668,"N/A",0889327085668,"N/A","Borescopes",318,81.69,-40,6,1,-80,431.01,124.95,61,4.4,"GODIAG SHOP","N/A",1,289,"N/A","Large Standard-Size",2.91,9.45,17.48,2.85,242.27,668.33,"02/28/2025",12,7,2,0.09
"https://amazon.com/dp/B07VD9DDK4","https://m.media-amazon.com/images/I/41A1ZLEoqWL._SX450_.jpg","B07VD9DDK4","WiFi Boroscope","Cal-Van Tools","Amazon","Industrial & Scientific",145535,047084000847,"N/A",0047084000847,"N/A","Borescopes",330,71.9,-4,15,15,66,1085.03,1084.89,75,4.6,"Amazon","N/A",29,258,-2,"Large Standard-Size",2.05,4.13,4.49,0.31,"N/A","N/A","08/31/2025",79,1,0,0.2
"https://amazon.com/dp/B0FPQTBND3","https://m.media-amazon.com/images/I/41IzMU3INoL._SX450_.jpg","B0FPQTBND3","Sanyipace Sewer Camera 230FT/70M with Self-Leveling, Pipe Inspection Camera w/h 512Hz Probe, Real-Time Feet/Meter Counter, Bulit-In Microphone Speaker, Keyboard Input, 32GB TF Card, 0.27in Rigid Cable","Sanyipace","-","Industrial & Scientific",145578,"N/A","N/A","N/A","N/A","Borescopes",323,1799.99,"N/A",22,0,,43396.47,"-","N/A","N/A",,"N/A",1,38,138,"Large bulky",11.75,22.25,26.5,33.6,"N/A","N/A","12/31/2025",5,"N/A",11,"N/A"
"https://amazon.com/dp/B0D7RL6YN5","https://m.media-amazon.com/images/I/61bvuTHwmHL._SX450_.jpg","B0D7RL6YN5","Inspection Endoscope, Industrial Borescope Camera with 4.3"" IPS Screen, 1920P HD Snake Camera with 8 LED Lights, 16.5FT Semi-Rigid Cord Bore Scope - Cool Gadgets Tool","COOVIE","FBA","Industrial & Scientific",145644,"N/A","N/A","N/A","N/A","Borescopes",335,28.99,-12,54,54,94,1577.05,1576.37,52,4.1,"Alice Windowshop","China",1,384,"N/A","Large Standard-Size",2.64,5.67,10.31,1.23,77.7,214.34,"10/31/2025",20,7,0,1.05
"https://amazon.com/dp/B0G58HV3CX","https://m.media-amazon.com/images/I/61gfDxQvezL._SX450_.jpg","B0G58HV3CX","Endoscope Camera with Light,16.4ft Dual-Lens Borescope Tools with 8 Adjustable LED Lights, Endoscope with Semi-Rigid Snake Camera, IP67 Waterproof Inspection Borescope for iOS and Android","COOVIE","FBA","Industrial & Scientific",146875,"N/A","N/A","N/A","N/A","Borescopes",338,29.99,-34,50,19,,1402.69,604.26,15,4.7,"Alice Windowshop","China",1,0,"N/A","Large Standard-Size",1.5,4.8,4.8,0.1,17.4,48,"01/31/2026",2,7,2,3.83
"https://amazon.com/dp/B0FRSSTC51","https://m.media-amazon.com/images/I/71BY6BHjMmL._SX450_.jpg","B0FRSSTC51","Oiiwak Sewer Camera 100ft, Drain Pipe Inspection Camera with 7"" IPS HD Screen, DVR & Audio Recorder Industrial Borescope Camera for Plumbing Drain Pipe Inspection, IP68 Waterproof, 32GB Card, 12 LEDs","Oiiwak","FBA","Industrial & Scientific",147620,"N/A","N/A","N/A","N/A","Borescopes",340,439.99,"N/A",0,0,,"-","-",77,4.4,"Oiiwak Tech","China",1,14,"N/A","Large Standard-Size",16.73,12.99,7.68,11.07,840.31,2318.11,"11/30/2024",1,9,7,"N/A"
"https://amazon.com/dp/B0FC639HC1","https://m.media-amazon.com/images/I/71Qeg9Lvk2L._SX450_.jpg","B0FC639HC1","Sewer Camera with 18mm 512hz Transmit,Pipe Inspection Camera 7"" DVR Waterproof IP68 Borescope Plumbing Drain Endoscope 32GB Card for Home Wall Duct Drain Pipe Plumbing","JINXINEBAY","FBA","Industrial & Scientific",147733,"N/A","N/A","N/A","N/A","Borescopes",340,389.99,-19,9,9,-28,3507.76,3507.57,1,5,"31yoosee","China",1,0,"N/A","Large bulky",10.75,12.9,14.5,13,1012.38,2792.76,"12/31/2025",8,6,2,9.3
"https://amazon.com/dp/B0CP6P5C3M","https://m.media-amazon.com/images/I/71bjXFpn8TL._SX450_.jpg","B0CP6P5C3M","Ralcam 360° Articulating Borescope Camera with Light, 4-Way Joystick Endoscope Inspection Camera, 5 inch 6.0mm Waterproof Snake Scope for Mechanics Automotive Wall Pipe Engine 3.3FT","Ralcam","FBA","Industrial & Scientific",151344,717977777438,"N/A",0717977777438,"N/A","Borescopes",345,399.99,-22,57,2,,20965.93,983.21,38,4.5,"Ralcam","China",1,0,"N/A","Large Standard-Size",3.94,1.97,5.91,3.64,23.04,63.57,"01/31/2026",59,9,3,1.51
"https://amazon.com/dp/B0F8BN91TL","https://m.media-amazon.com/images/I/712Fz1BbU7L._SX450_.jpg","B0F8BN91TL","4-Way 360° Articulating Borescope, Ralcam Joystick 5"" Endoscope Camera with Light, 6.2mm/0.24in Slim Snake Inspection Camera with 5.0ft Semi-Rigid Cable for Engine, Pipe, HVAC Inspection","Ralcam","FBA","Industrial & Scientific",151348,"N/A","N/A","N/A","N/A","Borescopes",345,379.99,-27,57,33,,20965.93,10737.43,39,4.5,"Ralcam","China",1,0,"N/A","Large Standard-Size",3.62,12.6,14.13,3.53,324.72,895.77,"01/31/2026",9,8,3,1.51
"https://amazon.com/dp/B08X1X82DD","https://m.media-amazon.com/images/I/41f5sX1HPAL._SX450_.jpg","B08X1X82DD","USB Snake Inspection Camera, 2.0 MP IP67 Waterproof USB C Borescope, Type-C Scope Camera with 8 Adjustable LED Lights for Android, PC2","AIATE","FBA","Industrial & Scientific",151541,"N/A","N/A",4817447515754,"N/A","Borescopes",346,12.9,-11,17,17,108,224.72,224.4,1193,3.7,"DDLOVEPP","China",1,119,-67,"Large Standard-Size",1.46,4.76,4.84,0.35,16.93,46.72,"02/29/2024",60,5,0,0.01
"https://amazon.com/dp/B0CG1X6TPN","https://m.media-amazon.com/images/I/71nLEhOO8kL._SX450_.jpg","B0CG1X6TPN","KMDES 5 inch IPS Dual Lens Articulating Borescope, IP67 Waterproof Endoscope Camera with Light, 1080P HD 360° Rotate Snake Camera Video Repair Inspection Scope for Automotive Aircraft Mechanics -4.9FT","KMDES","FBA","Industrial & Scientific",151749,"N/A","N/A","N/A","N/A","Borescopes",327,89.99,-47,39,30,-103,3012.96,2843.98,256,4.6,"KMDES","China",1,2060,"N/A","Large Standard-Size",3.43,9.45,17.09,3,278.9,769.37,"11/30/2024",30,7,4,0.15
"https://amazon.com/dp/B0DKJ3N5C7","https://m.media-amazon.com/images/I/71ya60GCvLL._SX450_.jpg","B0DKJ3N5C7","FDGSAB Sewer Camera, 20/50m, 7"" Screen Pipeline Inspection Camera Waterproof IP68 w/12 Adjustable LEDs, DVR Function Have 32GB SD Card .for Sewer Line, Duct Drain Pipe Plumbing (98.4ft/30M DVR)","FDGSAB","FBA","Industrial & Scientific",152428,"N/A","N/A","N/A","N/A","Borescopes",347,339.99,-15,31,3,16,9288.31,889.99,18,4.4,"sijifeng","China",1,414,"N/A","Large bulky",13.2,13.2,13.4,10.6,1175.52,3242.8,"12/31/2025",16,7,6,1.72
"https://amazon.com/dp/B0DKJ61PW6","https://m.media-amazon.com/images/I/71ya60GCvLL._SX450_.jpg","B0DKJ61PW6","FDGSAB Sewer Camera, 20/50m, 7"" Screen Pipeline Inspection Camera Waterproof IP68 w/12 Adjustable LEDs, DVR Function Have 32GB SD Card .for Sewer Line, Duct Drain Pipe Plumbing (164ft/50M DVR)","FDGSAB","FBA","Industrial & Scientific",152428,"N/A","N/A","N/A","N/A","Borescopes",347,369.99,-22,31,2,16,9288.31,686.9,18,4.4,"sijifeng","China",1,414,"N/A","Large bulky",10.8,13.3,13.3,12.1,961.84,2653.35,"12/31/2025",16,7,6,1.72
"https://amazon.com/dp/B0DKJ8HHDT","https://m.media-amazon.com/images/I/71ya60GCvLL._SX450_.jpg","B0DKJ8HHDT","FDGSAB Sewer Camera, 20/50m, 7"" Screen Pipeline Inspection Camera Waterproof IP68 w/12 Adjustable LEDs, DVR Function Have 32GB SD Card .for Sewer Line, Duct Drain Pipe Plumbing (164ft/50M)","FDGSAB","FBA","Industrial & Scientific",152433,"N/A","N/A","N/A","N/A","Borescopes",347,329.99,-8,31,4,16,9288.31,1203.96,18,4.4,"sijifeng","China",1,414,"N/A","Large bulky",10.75,13.13,13.25,12,941.6,2597.51,"12/31/2025",16,7,6,1.72
"https://amazon.com/dp/B0DKJ73NT4","https://m.media-amazon.com/images/I/71ya60GCvLL._SX450_.jpg","B0DKJ73NT4","FDGSAB Sewer Camera, 20/50m, 7"" Screen Pipeline Inspection Camera Waterproof IP68 w/12 Adjustable LEDs, DVR Function Have 32GB SD Card .for Sewer Line, Duct Drain Pipe Plumbing (98.4ft/30M)","FDGSAB","FBA","Industrial & Scientific",152434,"N/A","N/A","N/A","N/A","Borescopes",347,299.99,-33,31,6,16,9288.31,1904.34,18,4.4,"sijifeng","China",1,414,"N/A","Large bulky",10.63,13,13.25,10.5,921.87,2543.08,"12/31/2025",16,7,6,1.72
"https://amazon.com/dp/B0DKJFCHS5","https://m.media-amazon.com/images/I/71ya60GCvLL._SX450_.jpg","B0DKJFCHS5","FDGSAB Sewer Camera, 20/50m, 7"" Screen Pipeline Inspection Camera Waterproof IP68 w/12 Adjustable LEDs, DVR Function Have 32GB SD Card .for Sewer Line, Duct Drain Pipe Plumbing (66ft/20M)","FDGSAB","FBA","Industrial & Scientific",152434,"N/A","N/A","N/A","N/A","Borescopes",347,269.99,-14,31,10,16,9288.31,2765.48,18,4.4,"sijifeng","China",1,414,"N/A","Large bulky",10.75,13.13,13.13,9.85,933.07,2573.98,"12/31/2025",16,7,6,1.72
"https://amazon.com/dp/B0FF4X5J9S","https://m.media-amazon.com/images/I/71rIoHcUHnL._SX450_.jpg","B0FF4X5J9S","TIANSIAO Dual Lens Endoscope Camera with Light, 1920P HD Borescope with 4.3"" IPS Screen, IP67 Waterproof Inspection Camera with 8 Adjustable LEDs, 16.5ft Semi-Rigid Cable, 32GB Card-Black","Tiansiao","FBA","Industrial & Scientific",152448,"N/A","N/A","N/A","N/A","Borescopes",348,39.79,-6,9,9,-47,361.27,361.18,13,5,"TIANXIAO US","N/A",1,0,"N/A","Large Standard-Size",2.44,4.96,7.17,0.99,43.69,120.52,"08/31/2025",8,7,0,0.7
"https://amazon.com/dp/B0F9KZ44WV","https://m.media-amazon.com/images/I/71EaE1PQcaL._SX450_.jpg","B0F9KZ44WV","Sewer Camera 100ft,SPRIDRAIN Drain Pipe Camera HD 5in Screen with 32GB DVR,Waterproof IP68 Works Underwater Up to 10Meters Sewer Inspection borescopes for Plumber(Fits Pipes>0.7"" Diameter,100ft/30M)","SPRIDRAIN","FBA","Industrial & Scientific",152794,"N/A","N/A","N/A","N/A","Borescopes",349,229.99,-26,9,9,-57,1980.98,1980.83,3,3.1,"SYANSPAN TECH","China",1,0,"N/A","Large Standard-Size",11.2,8,12,11,541.33,1493.33,"10/31/2025",5,6,0,2.92
"https://amazon.com/dp/B0D17T3N3P","https://m.media-amazon.com/images/I/71+qCQSBz2L._SX450_.jpg","B0D17T3N3P","Julaiwy Industrial Endoscope Borescope Camera with Light, Borescope Inspection Camera, Industrial Cameras 1080P HD 4.3"" Screen, IP67 Waterproof Snake Cameras with 8 LED lights, Gadgets for Men, 16.5Ft","Julaiwy","FBA","Industrial & Scientific",153380,"N/A","N/A","N/A","N/A","Borescopes",350,29.9,-23,4,4,-95,107.95,107.84,54,4.4,"Kecowl","China",1,300,"N/A","Large Standard-Size",2.99,4.88,7.32,1.12,53.77,148.34,"11/30/2024",22,8,0,0.07
"https://amazon.com/dp/B072JCVB6T","https://m.media-amazon.com/images/I/716MR-eVGNL._SX450_.jpg","B072JCVB6T","Professional Borescope Camera Case for Depstech USB, Wireless Endoscope, Goodan, Shekar, Pancellent, Fantronics, Sokos, BlueFire, Smart Divider, Designed Accessories Pockets for USB, Side View Mirror","CaseSack","FBA","Industrial & Scientific",154083,729680113144,"N/A",0729680113144,"N/A","Borescopes",338,15.98,-10,9,9,35,137.19,137,275,4.3,"Casesack","Hong Kong",2,129,5,"Large Standard-Size",2.5,5.5,7,0.34,48.46,133.68,"06/30/2025",102,7,0,0.03
"https://amazon.com/dp/B0FK29787B","https://m.media-amazon.com/images/I/81DDddwWxAL._SX450_.jpg","B0FK29787B","Anysun 9'' Sewer Camera Self Leveling, 7MM Fiberglass Cable, Length Marker, 5100mAh, IPS Screen, HD 1080P with DVR - 32GB, IP68 Sewer Scope Pipe Drain Plumbing Inspection Cameras Borescope Snake-100Ft","anysun","FBA","Industrial & Scientific",154132,"N/A","N/A","N/A","N/A","Borescopes",351,459.99,"N/A",5,4,,2499.22,1987.78,1,5,"Yongchangsheng tech","China",1,0,"N/A","Large bulky",18,18,10,16,1631.25,4500,"11/30/2025",3,7,2,5.31
"https://amazon.com/dp/B0FK4K2Y6W","https://m.media-amazon.com/images/I/815LBRWx+QL._SX450_.jpg","B0FK4K2Y6W","Sewer Inspection Camera with 512Hz Locator, 250Ft/10"" HD, Self-Leveling Pipe Inspection Camera for HVAC/Pool/Petrol Pipes, High-Rise Drains, Pest Detection, Urban Sewers Maintenance, Pros & DIYers","SumKea","FBM","Industrial & Scientific",154804,774882256717,"N/A",0774882256717,"N/A","Borescopes",336,1499.99,-19,5,0,-17,4953.32,"-",2,5,"SumKea","China",1,0,"N/A","Extra-large 70+ to 150 lb",24.4,21.98,19.69,54.89,"N/A","N/A","09/30/2025",7,9,4,2.38
"https://amazon.com/dp/B0CYGX2KY3","https://m.media-amazon.com/images/I/71EcUvEQ2ML._SX450_.jpg","B0CYGX2KY3","Sewer Camera with Self-Leveling, Can Connect External Monitor, Zoom in and Out, IP68 Waterproof, 12 pcs Adjustable Light, Plumbing Cam with DVR, for Sewer Line, Drain, Duct, Plumbing (165FT)","anysun","FBA","Industrial & Scientific",155096,717203891600,"N/A",0717203891600,"N/A","Borescopes",352,479.99,-45,20,2,-85,8443.1,733.86,520,4.3,"ToBestGift","China",1,763,"N/A","Large bulky",8,17,18.75,18.6,1283.85,3541.67,"04/30/2025",23,9,9,0.04
"https://amazon.com/dp/B07PWZ3KKF","https://m.media-amazon.com/images/I/71-VLmkuBGL._SX450_.jpg","B07PWZ3KKF","Sewer Camera 100FT, Can Connect External Monitor, Zoom in and Out, IP68 Waterproof, 12 pcs Adjustable Light, Plumbing Snake Cam with DVR Pipe Video Inspection, for Sewer Line, Drain, Duct, Plumbing","anysun","FBA","Industrial & Scientific",155100,717326221162,"N/A",0717326221162,"N/A","Borescopes",352,399.99,-28,20,4,-85,8443.1,1558.02,520,4.3,"ToBestGift","China",1,763,"N/A","Large bulky",8,14.75,16.75,15.1,995.11,2745.14,"04/30/2025",84,8,9,0.04
"https://amazon.com/dp/B09HSC4Q8Y","https://m.media-amazon.com/images/I/71gP6gP6QyL._SX450_.jpg","B09HSC4Q8Y","Sewer Camera with Locator, Anysun 165FT with 512HZ Locator Set and Receiver for Drain Plumbing Video Inspection 7'' LCD HD Screen Waterproof IP68 Cameras with 12pcs LED Light(8GB SD Card-DVR Record)","anysun","FBA","Industrial & Scientific",155100,770887234347,"N/A",0770887234347,"N/A","Borescopes",352,799.99,-26,20,1,-85,8443.1,693.27,520,4.3,"ToBestGift","China",1,763,"N/A","Large bulky",12.4,19.6,25,25.38,3059.1,8438.89,"04/30/2025",52,9,9,0.04
"https://amazon.com/dp/B0CRNQK3SF","https://m.media-amazon.com/images/I/7168d1FQwmL._SX450_.jpg","B0CRNQK3SF","MATRIXCAMP Dual Lens Borescope, Endoscope Camera with Light for iPhone, iPad, Android, 1920P IP67 Waterproof,16.5FT Semi-Rigid Snake Camera,9 Adjustable Lights,Cool Gadgets for Men","MATRIXCAMP","FBA","Industrial & Scientific",155560,"N/A","N/A","N/A","N/A","Borescopes",353,19.99,"N/A",0,0,-137,"-","-",197,4.3,"glowlink","China",1,3533,"N/A","Large Standard-Size",1.57,4.84,5.2,0.44,19.89,54.88,"11/30/2024",25,6,12,0
"https://amazon.com/dp/B0D59Y7B2D","https://m.media-amazon.com/images/I/71F7JiFrCaL._SX450_.jpg","B0D59Y7B2D","Hijoy Articulating Borescope Camera with Light - Two-Way Endoscope with 8 Adjustable LED Lights | 5"" LCD Screen | 1920P HD Inspection Cameras with 0.33in Articulated Snake Camera for Men | S30","Hijoy","FBA","Industrial & Scientific",156742,735550191600,"N/A",0735550191600,"N/A","Borescopes",357,100.99,-86,3,24,,253.83,2488.22,108,4.3,"Hijoy-US","China",1,3,"N/A","Large Standard-Size",3.23,9.37,17.01,2.91,259.19,715.01,"07/31/2024",16,9,0,0.02
"https://amazon.com/dp/B0D9NVPM2Q","https://m.media-amazon.com/images/I/71GCNJ0pVaL._SX450_.jpg","B0D9NVPM2Q","150 FT Sewer Camera Snake,with 32GB Card 4.3'' Video Screen,JQKJCAM Sewer Inspection Pipe Drain Camera with Light Meter Counter,17MM/0.67'' Plumbing Borescope for Plumber Householder(50M)","JQKJCAM","FBA","Industrial & Scientific",156917,"N/A","N/A","N/A","N/A","Borescopes",338,312.64,-24,12,1,308,3337.06,279.92,14,4.3,"JJKJ Cam","China",1,117,"N/A","Large Standard-Size",13.39,11.8,6.3,9.26,501.16,1382.52,"05/31/2024",19,8,19,0.89
"https://amazon.com/dp/B0D9NVFZNM","https://m.media-amazon.com/images/I/71GCNJ0pVaL._SX450_.jpg","B0D9NVFZNM","Sewer Pipe Snake Camera 25FT,with 32GB Card 4.3'' Video Screen,HD JQKJCAM Duct Sewer Drain Inspection Camera with Light Meter Counter,17MM/0.67‘’ Industrial Endoscope for Pipes(10M/33FT)","JQKJCAM","FBA","Industrial & Scientific",156920,"N/A","N/A","N/A","N/A","Borescopes",338,228,-26,12,4,308,3337.06,924.37,14,4.3,"JJKJ Cam","China",1,117,"N/A","Large Standard-Size",13.39,11.8,6.3,7,501.16,1382.52,"05/31/2024",19,8,19,0.89
"https://amazon.com/dp/B0D5M7WTV8","https://m.media-amazon.com/images/I/71Wc4xa-bPL._SX450_.jpg","B0D5M7WTV8","Anysun Self Leveling Sewer Inspection Camera with Distance Counter, 7MM Thicker Cable, 100Ft with 9'' 1080P Screen & DVR, IP68 Waterproof Drain Pipe Camera Borescope with Light, 32GB Card","anysun","FBA","Industrial & Scientific",157086,"N/A","N/A","N/A","N/A","Borescopes",339,699.99,-9,27,6,-64,21739,4464.22,29,4.3,"Yongchangsheng tech","China",1,503,"N/A","Large bulky",11.3,15.3,18.75,17.7,1632.1,4502.34,"03/31/2025",19,7,9,0.94
"https://amazon.com/dp/B0DCZFWVH8","https://m.media-amazon.com/images/I/71wK-rCMgBL._SX450_.jpg","B0DCZFWVH8","YINCORD Industrial Endoscope - Handheld Snake Camera with 16.4ft/5m Flexible Cable, 1080P HD IP67 Waterproof 8mm Probe, 4.3"" IPS Screen, 8 LED Lights for Home Wall Pipe Automotive","YINCORD","FBA","Industrial & Scientific",157353,"N/A","N/A","N/A","N/A","Borescopes",355,29.69,-26,7,7,200,211.64,211.55,33,3.9,"YINCORD DIRECT","China",1,49,"N/A","Large Standard-Size",3.03,5.24,5.63,1.12,44.99,124.12,"11/30/2024",18,9,0,0.22
"https://amazon.com/dp/B0DDG3FMPV","https://m.media-amazon.com/images/I/81HZoHO+hBL._SX450_.jpg","B0DDG3FMPV","[Dual-Lens] Inspection Endoscope, Industrial Borescope Camera with Light, IP67 Waterproof Drain Pipe Scope Camera, 16.5ft Semi-Rigid Cord Borescope with Light, 1080 HD Screen(32GB Capacity)","COOVIE","FBA","Industrial & Scientific",158668,"N/A","N/A","N/A","N/A","Borescopes",360,44.99,-12,16,16,11,722.91,722.75,28,4.2,"Alice Windowshop","China",1,186,"N/A","Large Standard-Size",3.9,5.2,10.35,1.34,105.68,291.52,"12/31/2025",18,6,0,0.6
"https://amazon.com/dp/B0G25T561Y","https://m.media-amazon.com/images/I/317gWMT7N2L._SX450_.jpg","B0G25T561Y","Pipe Inspection Camera with 9 Inch 1080P Display, DVR Recording, 512Hz Locator, 30ft/50ft Fiberglass Cable, HD Stainless Steel Probe for Sewer Drain Plumbing HVAC Inspection","Festisoul","FBM","Industrial & Scientific",158826,"N/A","N/A",6967803648492,"N/A","Borescopes",361,614.99,4,12,12,,7096.39,7096.11,3,5,"Miandongbu","China",1,0,"N/A","Large bulky",18.7,13.39,9.84,18.52,"N/A","N/A","01/31/2026",3,8,5,3.84
"https://amazon.com/dp/B0CYH6NPFK","https://m.media-amazon.com/images/I/71EcUvEQ2ML._SX450_.jpg","B0CYH6NPFK","Sewer Camera with Self-Leveling, Can Connect External Monitor, Zoom in and Out, IP68 Waterproof, 12 pcs Adjustable Light, Plumbing Cam with DVR, for Sewer Line, Drain, Duct, Plumbing (100FT)","anysun","FBA","Industrial & Scientific",161550,717203891594,"N/A",0717203891594,"N/A","Borescopes",366,429.99,212,20,3,-85,8443.1,1363.26,520,4.3,"ToBestGift","China",1,763,"N/A","Large bulky",7.75,14.75,17,15.1,978.4,2699.05,"04/30/2025",23,8,9,0.04
"https://amazon.com/dp/B09HSBR5RG","https://m.media-amazon.com/images/I/71gP6gP6QyL._SX450_.jpg","B09HSBR5RG","Sewer Camera with Locator, Anysun 100FT with 512HZ Locator Set and Receiver for Drain Plumbing Video Inspection 7'' LCD HD Screen Waterproof IP68 Cameras with 12pcs LED Light(8GB SD Card-DVR Record)","anysun","FBA","Industrial & Scientific",161555,770887234323,"N/A",0770887234323,"N/A","Borescopes",366,729.99,"N/A",20,0,-85,8443.1,"-",520,4.3,"ToBestGift","China",1,763,"N/A","Large bulky",8.2,16.7,21.8,19.8,1503.01,4146.24,"04/30/2025",52,8,9,0.04
"https://amazon.com/dp/B0D2HVFB6Y","https://m.media-amazon.com/images/I/713-ouSdr0L._SX450_.jpg","B0D2HVFB6Y","Sewer Camera 100FT Self Leveling (Upright Images),W/ 12LED 7''HD 16GB DVR Monitor Meter Counter,23MM/0.9'' JQKJCAM Pipe Drain Camera Snake 100 FT with Light Waterproof for Plumbing Inspection (30M)","JQKJCAM","FBA","Industrial & Scientific",162020,"N/A","N/A","N/A","N/A","Borescopes",362,439.5,-9,9,3,-44,3979.05,1111.78,4,2.6,"JJKJ Cam","China",1,179,"N/A","Large bulky",7,14.75,16,11.6,831.74,2294.44,"12/31/2024",22,9,25,2.23
"https://amazon.com/dp/B0D2HW4WDH","https://m.media-amazon.com/images/I/71ZlFPOjnML._SX450_.jpg","B0D2HW4WDH","Sewer Camera with Locator Self Leveling 150FT,HD 23MM/0.9'' JQKJCAM Plumbing Drain Sewer Scope Camera Snake with 12 Light 9''HD 16GB Screen Meter Counter for Pipe Line Inspection (165FT/50M)","JQKJCAM","FBA","Industrial & Scientific",162026,"N/A","N/A","N/A","N/A","Borescopes",362,693,-21,9,1,-44,3979.05,874.76,4,2.6,"JJKJ Cam","China",1,179,"N/A","Large bulky",7,16,22,18,1240.56,3422.22,"12/31/2024",22,9,25,2.23
"https://amazon.com/dp/B0CGMZ6V4N","https://m.media-amazon.com/images/I/71QWzbQekLL._SX450_.jpg","B0CGMZ6V4N","HBUDS Self Leveling Sewer Inspection Camera with Locator 165ft, 9"" Color Monitor Drain Pipe Cameras with 512Hz Sonde and Receiver, 12V 4500mAh Rechargeable Battery Plumbing Camera Snake with DVR 16GB","HBUDS","FBA","Industrial & Scientific",162216,717021376044,"N/A",0717021376044,"N/A","Borescopes",348,979.99,-31,19,1,-76,9476.32,1056.82,223,4.1,"Hanxuan tech","China",2,1281,"N/A","Large bulky",8.5,17.8,24.17,23.85,1841.16,5079.06,"02/28/2025",30,7,6,0.09
"https://amazon.com/dp/B0CJFX7FMY","https://m.media-amazon.com/images/I/51FVHo9vWEL._SX450_.jpg","B0CJFX7FMY","Pipe Inspection Camera Accessory, 23mm Sewer Inspection Camera, Stainless Steel Professional IP68 Pipe Drain, Leak Detection Tools","Hyuduo","FBA","Industrial & Scientific",162548,"N/A","N/A","N/A","N/A","Borescopes",350,161.62,-26,5,5,44,735.95,735.84,1,5,"Mixitech-US","China",2,0,"N/A","Large Standard-Size",2.48,3.94,6.85,0.44,33.68,92.91,"07/31/2025",29,9,0,5.01
"https://amazon.com/dp/B0BLTX4VFJ","https://m.media-amazon.com/images/I/71LprGmMT7L._SX450_.jpg","B0BLTX4VFJ","Autel MaxiVIDEO MV108S Digital Inspection Camera - 2MP 1080P, Up of MV108/MV105S, IP67 Waterproof Industrial Endoscope, 8 LED Lights (Hook/Mirror/Magnet Included), Work w/PC & Autel Scanners","Autel","FBA","Industrial & Scientific",162794,792499186142,"N/A",0792499186142,"N/A","Borescopes",347,49,-6,14,14,-65,675.17,675.07,14,4.7,"Autel Exclusive","China",1,131,470,"Large Standard-Size",2.64,5.2,9.92,0.99,68.56,189.14,"11/30/2025",39,8,0,0.98
"https://amazon.com/dp/B0CNLB131J","https://m.media-amazon.com/images/I/71iWpnE8PyL._SX450_.jpg","B0CNLB131J","ANYSUN Sewer Camera's Accessories- 9' Screen (Only Support Model：9DX23)","anysun","FBM","Industrial & Scientific",162827,774182335877,"N/A",0774182335877,"N/A","Borescopes",364,129.99,-40,8,8,,1093.44,1093.36,2,5,"ToBestGift","China",1,0,"N/A","N/A","N/A","N/A","N/A","N/A","N/A","N/A","01/31/2026",27,3,2,4.21
