"https://amazon.com/dp/B0FMDTV17J","https://m.media-amazon.com/images/I/71-C0anQ4qL._SX450_.jpg","B0FMDTV17J","JINXINEBAY 10 Inch IPS Sewer Inspection Camera with 512Hz Locator, 1080P AHD, 50M Cable, DVR, Auto Self-Leveling, 5X Zoom, TF Card, LED Lights for Pipe/Wall/Drain (165FT/512hz Locator)","JINXINEBAY","FBA","Industrial & Scientific",91884,"N/A","N/A","N/A","N/A","Borescopes",236,999.99,-23,20,2,515,15973.97,1874.63,7,4.8,"JINXINEBAY Store","China",1,0,"N/A","Large bulky",14,18.5,20,32.35,2607.99,7194.44,"12/31/2025",6,8,4,2.89
"https://amazon.com/dp/B0FF1WH9GJ","https://m.media-amazon.com/images/I/71XbmMZQPYL._SX450_.jpg","B0FF1WH9GJ","Zealtron Dual Lens Endoscope Camera with Light, 5.0'' IPS Screen Inspection Camera, 1080P HD Handheld Borescope with 8 LED Lights, 7.9mm IP67 Waterproof Lens with 16.5ft Semi-Rigid Cable","zealtron","FBA","Industrial & Scientific",92742,"N/A","N/A","N/A","N/A","Borescopes",241,49.99,-9,28,28,,1396.98,1396.83,90,4.7,"Zealtron","China",1,0,"N/A","Large Standard-Size",2.99,6.22,10.87,1.39,101.78,280.78,"11/30/2025",8,7,2,0.31
"https://amazon.com/dp/B0BTNSJ4PZ","https://m.media-amazon.com/images/I/71IZI6WfOxL._SX450_.jpg","B0BTNSJ4PZ","5FT Dual Lens Probe, 5mm/0.2inch Diameter Semi-Rigid Cable Compatible with MS450 Inspection Camera","Teslong","FBA","Industrial & Scientific",92972,"N/A","N/A","N/A","N/A","Borescopes",241,59.99,-17,30,30,26,1827.46,1827.32,11,4.6,"Teslong","China",1,283,5,"Large Standard-Size",1.85,5.63,6.54,0.24,34.3,94.61,"01/31/2025",36,6,0,2.77
"https://amazon.com/dp/B0CQ55VS2B","https://m.media-amazon.com/images/I/61hkols6rZL._SX450_.jpg","B0CQ55VS2B","LSOSVSEU 23mm Pipe Sewer Inspection Camera Protective Cover, 90mm Guide Wheels Protect The Pipe Video Inspection Camera in The Pipe Walls, Pipe Inspection Camera Accessories","LSOSVSEU","FBA","Industrial & Scientific",93080,"N/A","N/A","N/A","N/A","Borescopes",242,24.99,-18,8,8,-50,197.86,197.69,13,3.8,"Outdoor Relax","China",1,175,"N/A","Large Standard-Size",1.89,3.78,5.35,0.22,19.24,53.09,"02/29/2024",26,9,0,0.64
"https://amazon.com/dp/B0FFGZC3WX","https://m.media-amazon.com/images/I/71MBkC6oDvL._SX450_.jpg","B0FFGZC3WX","Teslong Dual Lens 360 Articulating Borescope with Light, 5'' Monitor Industrial Inspection Camera with 4-Way Joystick Articulation, HD Endoscope Camera for Automotive and Mechanics (0.24inch-5FT)","Teslong","FBA","Industrial & Scientific",93448,"N/A","N/A","N/A","N/A","Borescopes",240,499.99,-20,40,40,-73,19925.59,19925.05,19,4,"Teslong","China",1,0,"N/A","Large Standard-Size",6.06,10.71,14.45,3.62,472.18,1302.56,"10/31/2025",8,9,0,2.1
"https://amazon.com/dp/B0FM3HCZBK","https://m.media-amazon.com/images/I/71Co3rOrm3L._SX450_.jpg","B0FM3HCZBK","JINXINEBAY 10 Inch IPS Sewer Inspection Camera with 512Hz Locator, 1080P AHD, 50M Cable, DVR, Auto Self-Leveling, 5X Zoom, TF Card, LED Lights for Pipe/Wall/Drain (100FT)","JINXINEBAY","FBA","Industrial & Scientific",95208,"N/A","N/A","N/A","N/A","Borescopes",241,699.99,"N/A",20,9,515,15973.97,6476.85,7,4.8,"JINXINEBAY Store","China",1,0,"N/A","Large bulky",14,16,18.5,25.7,2086.39,5755.56,"12/31/2025",6,7,4,2.89
"https://amazon.com/dp/B077CMZHLM","https://m.media-amazon.com/images/I/71eXzolivaS._SX450_.jpg","B077CMZHLM","Pipe Pipeline Inspection Camera, Drain Sewer Industrial Endoscope HBUDS Waterproof IP68 Snake Video System with 7 Inch LCD Monitor 1000TVL Camera","HBUDS","FBM","Industrial & Scientific",95256,758762725319,"N/A",0758762725319,"N/A","Borescopes",242,399.99,"N/A",56,15,1213,22897.79,5983.9,152,4,"ZI QUN","China",1,0,"N/A","Large bulky",8,15,17.15,14,"N/A","N/A","12/31/2025",99,7,10,0.37
"https://amazon.com/dp/B0FLXTG78F","https://m.media-amazon.com/images/I/71DabcxohBL._SX450_.jpg","B0FLXTG78F","HBUDS Sewer Camera 100ft, Self Leveling Drain Camera with Meter Counter, 7mm Thick Cable, 9"" HD Screen 1080P Plumbing Cameras Snake with Light, 5100mAh Battery Duct Pipe Video Inspection Cam DVR 32GB","HBUDS","FBA","Industrial & Scientific",95259,769016776544,"N/A",0769016776544,"N/A","Borescopes",242,499.99,-38,56,9,1213,22897.79,3936.31,152,4,"Hanxuan tech","China",1,0,"N/A","Large bulky",21.5,18,12.5,17.6,2435.55,6718.75,"12/31/2025",6,7,10,0.37
"https://amazon.com/dp/B0FKB6Q7DF","https://m.media-amazon.com/images/I/71ueIKG9ogL._SX450_.jpg","B0FKB6Q7DF","Anysun Self-Leveling Sewer Camera with Meter Marking, 9'' IPS Screen, HD 1080P Resolution, 5100mAh Battery, 165ft 5mm Cable Sewer Drain Video Inspection Camera with DVR Recorder and 32GB SD Card","anysun","FBA","Industrial & Scientific",95692,769016773888,"N/A",0769016773888,"N/A","Borescopes",245,429.99,-20,30,16,-40,14398.51,6957.45,5,4.8,"HZDZ_Shop","Hong Kong",1,0,"N/A","Large bulky",12.48,13.3,14.17,15.96,1184.16,3266.66,"10/31/2025",6,7,9,5.99
"https://amazon.com/dp/B0FKB5FTTH","https://m.media-amazon.com/images/I/71ay9ZiiBSL._SX450_.jpg","B0FKB5FTTH","Anysun Self-Leveling Sewer Camera with 9'' Screen, 100ft 7mm Cable, Sewer Drain Video Inspection Camera with DVR Recorder and 32GB SD Card, Plumbing Snake Cam for Pipe Inspection","anysun","FBA","Industrial & Scientific",95706,769016773895,"N/A",0769016773895,"N/A","Borescopes",245,449.99,-18,30,8,-40,14398.51,3784.11,5,4.8,"HZDZ_Shop","Hong Kong",1,0,"N/A","Large bulky",12.68,18.78,21.89,16.93,2624.44,7239.83,"10/31/2025",6,7,9,5.99
"https://amazon.com/dp/B0FDF9WVNK","https://m.media-amazon.com/images/I/71+QZTEIitL._SX450_.jpg","B0FDF9WVNK","BESTISAN Dual Lens Articulating Borescope, 5"" Endoscope Camera with Light, 1080P Two-Way Articulated Industrial Flexible Snake Inspection Camera for Auto Home Wall & HVAC-5FT","BESTISAN","FBA","Industrial & Scientific",96009,"N/A","N/A","N/A","N/A","Borescopes",246,99.99,-49,33,33,9,3519.26,3518.81,34,4.9,"BESTISAN US","USA",1,0,"N/A","Large Standard-Size",3.43,8.78,16.69,3.15,253.06,698.09,"10/31/2025",13,9,0,0.98
"https://amazon.com/dp/B0FP26Y1ZQ","https://m.media-amazon.com/images/I/71DabcxohBL._SX450_.jpg","B0FP26Y1ZQ","HBUDS Sewer Camera, Self Leveling Drain Camera 200ft with Meter Counter, 7mm Thick Cable, 9"" HD Screen 1080P Plumbing Cameras Snake with Light, 5100mAh Battery Duct Pipe Video Inspection Cam DVR 32GB","HBUDS","FBA","Industrial & Scientific",97233,769016779651,"N/A",0769016779651,"N/A","Borescopes",245,549.99,-9,56,5,1213,22897.79,3011.87,152,4,"ZI QUN","China",2,0,"N/A","Large bulky",21.5,18,12.5,20.9,2435.55,6718.75,"12/31/2025",6,7,10,0.37
"https://amazon.com/dp/B0FY3BCW4L","https://m.media-amazon.com/images/I/71FODI+6jxL._SX450_.jpg","B0FY3BCW4L","HBUDS Sewer Camera with 512Hz Sonde, Self Leveling 230ft Drain Camera with Meter Counter, 7mm Cable, 9"" HD Screen 1080P Plumbing Cameras Snake with Light, 5100mAh Battery Pipe Inspection DVR 32GB","HBUDS","FBA","Industrial & Scientific",97238,717839117365,"N/A",0717839117365,"N/A","Borescopes",245,699.99,"N/A",56,0,1213,22897.79,"-",153,4.1,"ZI QUN","China",2,0,"N/A","Large bulky",18.6,12.4,21.6,20,2508.21,6919.2,"12/31/2025",4,7,10,"N/A"
"https://amazon.com/dp/B0FLXR4H4W","https://m.media-amazon.com/images/I/71DabcxohBL._SX450_.jpg","B0FLXR4H4W","HBUDS Sewer Camera, Self Leveling Drain Camera 65ft with Meter Counter, 7mm Thick Cable, 9"" HD Screen 1080P Plumbing Cameras Snake with Light, 5100mAh Battery Duct Pipe Video Inspection Cam DVR 32GB","HBUDS","FBA","Industrial & Scientific",97238,769016776537,"N/A",0769016776537,"N/A","Borescopes",245,369.99,-17,56,26,1213,22897.79,9706.88,151,4.2,"ZI QUN","China",1,0,"N/A","Large bulky",21.5,18,12.5,16.5,2435.55,6718.75,"12/31/2025",6,7,10,0.37
"https://amazon.com/dp/B0DR8ZGWQB","https://m.media-amazon.com/images/I/81x8cZAhZAL._SX450_.jpg","B0DR8ZGWQB","Gifts for Men, Triple Lens Endoscope Camera with Light, 1080P Industrial Borescope with 32GB Card - IP68 & 4.5"" Sewer Inspection Camera with 16.5FT Semi-Rigid Cable, Cool Tools for Men","ADvancore","FBA","Industrial & Scientific",97295,"N/A","N/A","N/A","N/A","Borescopes",246,65.99,5,55,9,-103,3209.35,607.26,220,4.4,"ADvancore","China",1,0,"N/A","Large Standard-Size",3.5,5.47,9.02,1.21,86.94,239.84,"11/30/2025",13,6,8,0.25
"https://amazon.com/dp/B0DR8WQ1Y8","https://m.media-amazon.com/images/I/819GmmYXsIL._SX450_.jpg","B0DR8WQ1Y8","Dual Lens Endoscope Camera with Light, 1080P Borescope with 32GB Card - IP68 & 4.5"" Sewer Inspection Camera with 16.5FT Semi-Rigid Cable, Birthday Gifts for Men, Tools Cool Gadgets - Yellow","ADvancore","FBA","Industrial & Scientific",97469,"N/A","N/A","N/A","N/A","Borescopes",247,49.99,-26,55,25,-103,3209.35,1254.28,220,4.4,"ADvancore","China",1,0,"N/A","Large Standard-Size",3.5,5.39,9.09,1.23,86.34,238.17,"11/30/2025",12,6,8,0.25
"https://amazon.com/dp/B0DNW997X5","https://m.media-amazon.com/images/I/71NHjzyk3zL._SX450_.jpg","B0DNW997X5","Anysun Sewer Camera with 512hz Sonde 200ft, Self Leveling Sewer Inspection Camera with Distance Counter, 7MM Diameter Cable with Trolley and Wheels, 9"" HD Monitor with DVR Drain Pipe Camera(32GB Card)","anysun","FBA","Industrial & Scientific",98127,717504238036,"N/A",0717504238036,"N/A","Borescopes",249,899.99,91,11,3,14,9795.33,2738.55,2,5,"Nedive","China",1,0,"N/A","Extra-large 50+ to 70 lb",17,21,24,37.6,4313.75,11900,"07/31/2025",12,7,2,5.67
"https://amazon.com/dp/B0DNW97B3J","https://m.media-amazon.com/images/I/711uUjuSdaL._SX450_.jpg","B0DNW97B3J","Anysun Sewer Camera with 512hz Sonde 150ft, Self Leveling Sewer Inspection Camera with Distance Counter, 7MM Diameter Cable with Trolley and Wheels, 9"" HD Monitor with DVR Drain Pipe Camera(32GB Card)","anysun","FBA","Industrial & Scientific",98127,717504238029,"N/A",0717504238029,"N/A","Borescopes",249,849.99,-41,11,8,14,9795.33,7056.39,2,5,"Nedive","China",1,0,"N/A","Large bulky",15,19,23,29.45,3300.26,9104.17,"07/31/2025",12,7,2,5.67
"https://amazon.com/dp/B0DNMF126P","https://m.media-amazon.com/images/I/7147Zyg2IaL._SX450_.jpg","B0DNMF126P","VEVOR Sewer Camera with 512Hz Locator, 98 ft/30 m, Self-Leveling Drain Inspection Camera with 9"" 1080P HD Screen, 36X Zoom, Snake Plumbing Camera with Lights-12 LED, 32GB SD Card for Duct Pipe","VEVOR","FBM","Industrial & Scientific",99237,197988991342,"N/A",0197988991342,"N/A","Borescopes",252,543.9,-57,37,23,-28,22341.62,12267.94,17,3.4,"Supdear","China",1,371,"N/A","Large bulky",11.42,15.75,18.19,16.67,"N/A","N/A","11/30/2025",15,9,2,2.17
"https://amazon.com/dp/B0F6CS8QNY","https://m.media-amazon.com/images/I/61WFZMOJoGL._SX450_.jpg","B0F6CS8QNY","VEVOR Endoscope Camera with Light, Dual Lens Borescope for Android & iOS, 1920P HD Inspection Camera, 8 + 1 LED Lights, 2X Zoom, 10FT Snake Cable, IP67 Waterproof","VEVOR","Amazon","Industrial & Scientific",100689,197988675990,"N/A",0197988675990,"N/A","Borescopes",253,23.99,-13,50,27,316,1206.08,654.62,21,4.2,"Amazon","N/A",1,0,"N/A","Small Standard-Size",0.28,5.28,5.35,0.35,"N/A","N/A","09/30/2025",10,9,2,2.4
"https://amazon.com/dp/B0F6CP46VD","https://m.media-amazon.com/images/I/611QKUY7QAL._SX450_.jpg","B0F6CP46VD","VEVOR Endoscope Camera with Light, Dual Lens Borescope for Android & iOS, 1920P HD Inspection Camera with 8 + 1 LED Light, 2X Zoom, 16.4FT Snake Cable, IP67 Waterproof Snake Camera for Auto, Plumbing","VEVOR","FBM","Industrial & Scientific",100690,197988674665,"N/A",0197988674665,"N/A","Borescopes",253,23.99,263,50,23,316,1206.08,550.65,21,4.2,"VEVOR Shop","China",1,0,"N/A","Large Standard-Size",6.02,5.43,1.18,0.44,"N/A","N/A","09/30/2025",10,9,2,2.4
"https://amazon.com/dp/B06XKDL1YR","https://m.media-amazon.com/images/I/71AMaS+kW9L._SX450_.jpg","B06XKDL1YR","RIDGID 36848 Model Micro CA-150 Hand-Held Inspection Camera, Borescope","RIDGID","Amazon","Industrial & Scientific",101590,095691368485,00095691368485,0095691368485,"N/A","Borescopes",250,231.99,-45,18,18,123,4089.4,4089.24,98,4.1,"Amazon","N/A",14,150,-15,"Large bulky",5.2,15.24,15.27,5.97,"N/A","N/A","03/31/2024",107,19,0,0.18
"https://amazon.com/dp/B0CY24NLQB","https://m.media-amazon.com/images/I/718GBnX849L._SX450_.jpg","B0CY24NLQB","Danculpe Sewer Camera Self-Leveling with Distance Counter,10"" LCD Pipe Inspection Camera with DVR, IP68 Waterproof Plumbing Cameras 100FT/30M, 12 Adjustable LEDs and 16GB Card for Plumbers","Danculpe","FBA","Industrial & Scientific",101625,794969825971,"N/A",0794969825971,"N/A","Borescopes",255,388.99,-11,14,8,,6125.54,3148.33,13,4,"hainanshengtianaikejiyouxiangongsi","China",1,0,"N/A","Large bulky",8.6,17.6,19,16.8,1447.91,3994.22,"12/31/2025",23,6,4,1.08
"https://amazon.com/dp/B0CX4C3QXK","https://m.media-amazon.com/images/I/51Im2mzfZuL._SX450_.jpg","B0CX4C3QXK","Teslong Mirrors Set of Rifle Borescope, Only Applies to NTG200H Barrel Bore Scope.","Teslong","FBA","Industrial & Scientific",101667,"N/A","N/A","N/A","N/A","Borescopes",252,19.99,-10,13,13,59,255.26,255.01,6,3.6,"Teslong","China",1,137,"N/A","Large Standard-Size",1.02,2.95,2.95,0.09,4.47,12.33,"02/28/2025",23,2,0,2.56
"https://amazon.com/dp/B0CY2CTSH8","https://m.media-amazon.com/images/I/71uoyEa9lJL._SX450_.jpg","B0CY2CTSH8","Danculpe Sewer Camera with Locator, Self-Leveling, Distance Counter, 10'' LCD Pipe Inspection Camera with DVR, IP68 Waterproof Industrial Plumbing Cameras 12 LEDs & 16GB Card (100FT/30M)","Danculpe","FBA","Industrial & Scientific",101752,794969825988,"N/A",0794969825988,"N/A","Borescopes",256,635.99,-24,14,2,,6125.54,1292.62,13,4,"hainanshengtianaikejiyouxiangongsi","China",1,0,"N/A","Large bulky",8.4,19.2,25,23.1,2030,5600,"12/31/2025",23,6,4,1.08
"https://amazon.com/dp/B0FLPY94WG","https://m.media-amazon.com/images/I/71r546qqDsL._SX450_.jpg","B0FLPY94WG","Sewer Camera 100ft/30m, 17mm Plumbing Snake Borescope with 8pcs LEDs Light, 4.3"" Screen 1000TVL Pipe Inspection Camera with 8500mAh Battery Without Recorder","GAMWATER","FBA","Industrial & Scientific",103281,614019414972,"N/A",0614019414972,"N/A","Borescopes",255,201.97,-27,39,11,300,8276.58,2384.15,4,3,"huizhoushishanmaikejiyouxiangongsi","China",1,0,"N/A","Large Standard-Size",12,10.44,7.1,7.72,447.83,1235.4,"12/31/2025",6,6,4,12.97
"https://amazon.com/dp/B0BJKTWZBV","https://m.media-amazon.com/images/I/71ubwZVoOzL._SX450_.jpg","B0BJKTWZBV","Self-Leveling Sewer Camera 100FT, Anysun 9"" HD Screen Pipe Borescope Drain Inspection with 12pcs LED Light, DVR Recorder with 32GB Card, IP68 Waterproof Plumbing Cam, 7mm Cable with Meter Marks","anysun","FBA","Industrial & Scientific",103534,774638981412,"N/A",0774638981412,"N/A","Borescopes",258,599.99,-7,28,10,-5,19968.1,6000.87,88,4.3,"ToBestGift","China",1,0,"N/A","Large bulky",11.5,17.3,19.75,16.4,1978.27,5457.31,"12/31/2025",40,7,12,0.32
"https://amazon.com/dp/B0FLDQ4P5J","https://m.media-amazon.com/images/I/718mc0YmmsL._SX450_.jpg","B0FLDQ4P5J","Sewer Camera 100FT/30M,Pipe Inspection Camera DVR & Audio Recorder,18MM Borescopes Plumbing Snake with 8500mAh Battery 4.3"" IPS Screen, 8 LEDs HD 1000TVL, Included 32GB Card","GAMWATER","FBA","Industrial & Scientific",103589,614019415184,"N/A",0614019415184,"N/A","Borescopes",256,252.58,-20,39,6,300,8276.58,1590.8,4,3,"huizhoushishanmaikejiyouxiangongsi","China",1,0,"N/A","Large Standard-Size",12,10.25,7.1,7.72,439.68,1212.92,"12/31/2025",6,6,4,9.73
"https://amazon.com/dp/B0FLQ3Y8J5","https://m.media-amazon.com/images/I/71p7T47+fEL._SX450_.jpg","B0FLQ3Y8J5","Sewer Camera 66ft/20m, 17MM Plumbing Snake Borescope with 8pcs LEDs Light, 4.3"" Screen 1000TVL Pipe Inspection Camera with 8500mAh Battery Without Recorde","GAMWATER","FBA","Industrial & Scientific",103589,614019414996,"N/A",0614019414996,"N/A","Borescopes",256,189.86,-12,39,18,300,8276.58,3327.15,4,3,"huizhoushishanmaikejiyouxiangongsi","China",2,0,"N/A","Large Standard-Size",7.95,11.06,12.17,6.61,538.75,1486.21,"12/31/2025",6,6,4,9.73
"https://amazon.com/dp/B0CMTV1YRC","https://m.media-amazon.com/images/I/71L6C25SHwL._SX450_.jpg","B0CMTV1YRC","Sewer Camera 165ft/50m,0.9in/22mm Pipe Inspection Camera with 12pcs LEDs Light, 4.3"" Screen 1000TVL Plumbing Snake Borescope with 4500mAh Battery DVR Recorder, Included 16GB Card","SYOWNFS","FBA","Industrial & Scientific",103881,"N/A","N/A","N/A","N/A","Borescopes",257,322.73,15,44,7,-15,11987.95,2105.47,89,4.1,"ENNIO","China",1,1440,9,"Large bulky",8.25,11.13,15.75,9.4,728.12,2008.62,"02/28/2025",27,7,4,0.5
"https://amazon.com/dp/B0CMTV6VNZ","https://m.media-amazon.com/images/I/71L6C25SHwL._SX450_.jpg","B0CMTV6VNZ","Sewer Camera 100ft/30m,0.9in/22mm Pipe Inspection Camera with 12pcs LEDs Light, 4.3"" Screen 1000TVL Plumbing Snake Borescope with 4500mAh Battery DVR Recorder, Included 16GB Card","SYOWNFS","FBA","Industrial & Scientific",103881,"N/A","N/A","N/A","N/A","Borescopes",257,260.05,-17,44,25,-15,11987.95,6415.58,89,4.1,"ENNIO","China",1,1440,9,"Large bulky",8.6,11,15.5,8.25,738.24,2036.53,"02/28/2025",27,7,4,0.5
"https://amazon.com/dp/B0CMX4SD6M","https://m.media-amazon.com/images/I/71L6C25SHwL._SX450_.jpg","B0CMX4SD6M","Sewer Camera,0.9in/22mm Pipe Inspection Camera with 12pcs LEDs Light, 4.3"" Screen 1000TVL Plumbing Snake Borescopes with 4500mAh Battery DVR Recorder, Included 16GB Card (66FT/20M)","SYOWNFS","FBA","Industrial & Scientific",103886,"N/A","N/A","N/A","N/A","Borescopes",257,265.99,-8,44,13,-15,11987.95,3466.07,89,4.1,"ENNIO","China",1,1440,9,"Large bulky",8.58,11.02,15.98,7.6,760.71,2098.52,"02/28/2025",27,7,4,0.5
"https://amazon.com/dp/B0DBVC7H92","https://m.media-amazon.com/images/I/51eL31jlghL._SX450_.jpg","B0DBVC7H92","17MM Sewer Camera Guide Wheel,JQKJCAM Sewer Camera Roller Guide Accessory/Parts,90MM/3.5'' Protector Cover with Pulleys for 0.67'' Pipe Drain Duct Inspection Camera","JQKJCAM","FBA","Industrial & Scientific",104184,"N/A","N/A","N/A","N/A","Borescopes",259,22.8,-4,11,11,-54,257.54,257.32,7,3.9,"JJKJ Cam","China",1,0,"N/A","Large Standard-Size",1.85,4.13,6.38,0.29,24.54,67.7,"07/31/2025",18,6,0,1.62
"https://amazon.com/dp/B0FLJN7FVT","https://m.media-amazon.com/images/I/71qTAkf2eoL._SX450_.jpg","B0FLJN7FVT","Sewer Camera 66FT/20M Pipe Inspection Camera DVR & Audio Recorder,18MM Borescopes Plumbing Snake with 8500mAh Battery 4.3"" IPS Screen, 8 LEDs HD 1000TVL, Included 32GB Card","GAMWATER","FBA","Industrial & Scientific",104241,614019414989,"N/A",0614019414989,"N/A","Borescopes",260,256.38,-8,39,4,300,8276.58,973.94,4,3,"huizhoushishanmaikejiyouxiangongsi","China",1,0,"N/A","Large Standard-Size",12,10.23,7.1,7.72,438.82,1210.55,"12/31/2025",6,6,4,9.73
"https://amazon.com/dp/B0DLS22PKT","https://m.media-amazon.com/images/I/71IsfO7S-FL._SX450_.jpg","B0DLS22PKT","Anysun Sewer Camera Self Leveling with Locator, 7MM Stronger Pushrod, Meter Marker, 32GB Card, 9'' HD Monitor, 100Ft/30M Sewer Pipe Drain Inspection Camera IP68 with DVR Industrial Borescope Snake","anysun","FBA","Industrial & Scientific",104575,"N/A","N/A","N/A","N/A","Borescopes",482,1299.99,-3,21,1,,15616.88,1700.79,3,5,"Yongchangsheng tech","China",1,107,"N/A","Large bulky",13,19,20.5,22,2549.33,7032.64,"02/28/2025",13,8,9,7.08
"https://amazon.com/dp/B0DKBSW4WR","https://m.media-amazon.com/images/I/71IsfO7S-FL._SX450_.jpg","B0DKBSW4WR","Anysun Sewer Camera Self Leveling with Locator, 7MM Stronger Pushrod, Meter Marker, 32GB Card, 9'' HD Monitor, 300Ft/91.5M Sewer Pipe Drain Inspection Camera IP68 with DVR Industrial Borescope Snake","anysun","FBA","Industrial & Scientific",104579,"N/A","N/A","N/A","N/A","Borescopes",482,1499.99,-25,21,1,,15616.88,1560.63,3,5,"Yongchangsheng tech","China",1,107,"N/A","Large bulky",14.5,19.45,21,29.6,2981.83,8225.73,"02/28/2025",13,8,9,7.08
"https://amazon.com/dp/B0DKX9FZ8M","https://m.media-amazon.com/images/I/71CmC8rGZ2L._SX450_.jpg","B0DKX9FZ8M","Anysun Sewer Camera Self Leveling with 512Hz Sonde, 7MM Thick Pushrod, Length Mark, 32GB Card, 9'' HD Monitor with DVR, 300Ft Sewer Scope Pipe Drain Inspection Camera IP68 Borescope w/Adjustable LEDs","anysun","FBA","Industrial & Scientific",104580,"N/A","N/A","N/A","N/A","Borescopes",482,799.99,-33,21,3,,15616.88,2054.98,3,5,"Yongchangsheng tech","China",1,107,"N/A","Large bulky",13.75,19,20.75,25.15,2729.29,7529.08,"02/28/2025",14,8,9,7.08
"https://amazon.com/dp/B0CZ74N3K3","https://m.media-amazon.com/images/I/61vVWHoOsiL._SX450_.jpg","B0CZ74N3K3","WP9600FTR 512HZ Sewer Camera Head Replacement Parts Self Leveling with Locator 12 Lights Guide Wheel Protective Cover,Accessory for 23MM JQKJCAM Pipe Drain Sewer Inspection Camera SP09F WP90F WP9612","JQKJCAM","FBA","Industrial & Scientific",104890,"N/A","N/A","N/A","N/A","Borescopes",261,319,-20,27,27,77,8465.74,8465.6,1,5,"JJKJ Cam","China",1,0,"N/A","Large Standard-Size",0.9,6.69,0.9,0.88,2.73,7.53,"12/31/2025",23,5,0,26.53
"https://amazon.com/dp/B0DSZT4GNC","https://m.media-amazon.com/images/I/81PEy8k1IGL._SX450_.jpg","B0DSZT4GNC","JYTONE Endoscope Camera with Light, 5.5mm Waterproof Borescope with 4.3"" HD Screen, 33ft Semi-Rigid Cable for Automotive, Plumbing, Pipe Inspection","JYTONE","FBA","Industrial & Scientific",105382,"N/A","N/A","N/A","N/A","Borescopes",262,50.99,-9,157,8,247,5566.75,384.07,98,4.4,"ERYUHAIAN","China",2,0,"N/A","Large Standard-Size",3.19,6.06,10.83,1.66,105.39,290.74,"12/31/2025",13,7,3,1.6
"https://amazon.com/dp/B0DSZNLHLW","https://m.media-amazon.com/images/I/81PEy8k1IGL._SX450_.jpg","B0DSZNLHLW","JYTONE Endoscope Camera with Light, 5.5mm Waterproof Borescope with 4.3"" HD Screen, 16.5ft Semi-Rigid Cable for Automotive, Plumbing, Pipe Inspection","JYTONE","FBA","Industrial & Scientific",105386,"N/A","N/A","N/A","N/A","Borescopes",262,45.99,18,157,16,247,5566.75,682.65,102,4.4,"ZHIYUE TECH","China",1,0,"N/A","Large Standard-Size",3.11,6.02,10.83,1.28,102.08,281.61,"12/31/2025",13,7,3,1.61
"https://amazon.com/dp/B08D9GDQD5","https://m.media-amazon.com/images/I/71EVKoAubeL._SX450_.jpg","B08D9GDQD5","Teslong Rigid Rifle Borescope, 0.2inch Rod Digital Gun Barrel Bore Scope Gun Cleaning Camera-Fits .20 Caliber & Larger Hunting Shooting Firearms, 26inch Long Insertion Tube & 4.5inch 1080P HD Screen","Teslong","FBA","Industrial & Scientific",105422,"N/A","N/A","N/A","N/A","Borescopes",260,149.99,-20,60,60,-38,9060.67,9060.53,395,4.7,"Teslong","China",1,823,-4,"Large bulky",1.97,4.09,30.39,2.75,123.28,340.09,"02/28/2025",67,7,0,0.15
"https://amazon.com/dp/B0CQYW4MHD","https://m.media-amazon.com/images/I/61ryucDPfNL._SX450_.jpg","B0CQYW4MHD","Sewer Camera Replacement Ultra High Definition 9inch Display Screen w/16GB DVR Video Rcording,JQKJCAM Drain Pipe Borescope Accessory,Monitor of Pipe Inspection Camera SP09A SP09F 9600F WP90F","JQKJCAM","FBA","Industrial & Scientific",105521,"N/A","N/A","N/A","N/A","Borescopes",263,138.9,-7,33,33,368,4584.52,4584.01,9,4.3,"JJKJ Cam","China",1,217,"N/A","Large Standard-Size",10.6,9.45,2.36,1.22,119.02,328.34,"12/31/2025",26,9,0,3.67
"https://amazon.com/dp/B0FLNJ8CNL","https://m.media-amazon.com/images/I/710X8kEq2BL._SX450_.jpg","B0FLNJ8CNL","Ralcam 3mm Two-Way Articulating Borescope, 5 Inch HD Industrial Endoscope Inspection Camera with Light, Stainless Steel Flexible Fiber Optic Scope Camera 0.12in Automotive Mechanics Tool","Ralcam","FBA","Industrial & Scientific",105977,"N/A","N/A","N/A","N/A","Borescopes",264,799.99,-21,74,11,133,21954.86,8835.99,55,4.4,"AijR","China",1,0,"N/A","Large Standard-Size",3.46,8.82,16.69,2.67,256.43,707.41,"01/31/2026",6,8,5,1.35
"https://amazon.com/dp/B0FJLL4LY1","https://m.media-amazon.com/images/I/71qLoBDjd5L._SX450_.jpg","B0FJLL4LY1","Ralcam 3.9mm Two-Way Articulating Borescope, 5 Inch HD Industrial Endoscope Inspection Camera with Light, Stainless Steel Flexible Fiber Optic Scope Camera 0.15in Automotive Mechanics Tool","Ralcam","FBA","Industrial & Scientific",106109,"N/A","N/A","N/A","N/A","Borescopes",265,329.99,-3,74,24,161,21443.02,7825.05,55,4.4,"AijR","China",1,0,"N/A","Large Standard-Size",3.46,8.7,16.7,2.57,253.1,698.2,"01/31/2026",7,8,5,1.35
"https://amazon.com/dp/B0DCSBF3FL","https://m.media-amazon.com/images/I/71Offtk4Y-L._SX450_.jpg","B0DCSBF3FL","Sanyipace Sewer Camera 328FT/100M with 512Hz Transmitter, Self-Leveling, Drain Plumbing Pipe Inspection Camera with Mic Speaker, DVR Recorder, 16GB TF Card, 9mm Rigid Cable, Pipe Pulley Guide Wheel","Sanyipace","FBA","Industrial & Scientific",106313,"N/A","N/A","N/A","N/A","Borescopes",277,2499.99,"N/A",22,1,,43396.47,2979.31,45,4,"Urselection","China",1,38,138,"Extra-large 70+ to 150 lb",15.75,29.25,32.75,68.85,7596.15,20954.88,"12/31/2025",18,7,11,0.49
"https://amazon.com/dp/B0DBHT4HVX","https://m.media-amazon.com/images/I/61hXmPVUC2L._SX450_.jpg","B0DBHT4HVX","Teslong Endoscope Replacement Cable with Light, Single Lens Inspection Camera 3.9mm/0.15inch Waterproof Probe Compatible with NTS500, NTS300(3.3FT)","Teslong","FBA","Industrial & Scientific",106357,"N/A","N/A","N/A","N/A","Borescopes",266,69.99,-12,18,18,-39,1256.67,1256.35,1,5,"Teslong","China",1,191,"N/A","Large Standard-Size",1.34,8.74,8.78,0.29,51.77,142.82,"10/31/2025",19,5,0,17.97
"https://amazon.com/dp/B0DDH1FWHT","https://m.media-amazon.com/images/I/71Unn1G2LrL._SX450_.jpg","B0DDH1FWHT","Borescope,Camii Endoscope Camera with Light,1920P Snake Scope Inspection Cameras with 8 Adjustable LED Lights, Endoscope with 10ft Semi-Rigid Cable Snake Camera for iPhone, iPad,","Camii","FBA","Industrial & Scientific",106482,"N/A","N/A","N/A","N/A","Borescopes",267,59.99,"N/A",35,0,-75,922.39,"-",93,3.9,"Camii-Direct","China",1,596,"N/A","Large Standard-Size",0.87,6.5,6.54,0.29,18.62,51.37,"06/30/2025",18,9,3,0.38
"https://amazon.com/dp/B0DDGXHPYT","https://m.media-amazon.com/images/I/71zYIUFcrAL._SX450_.jpg","B0DDGXHPYT","[Dual-Lens] Borescope Camera with Light, 1920P HD Endoscope with 8+1 Adjustable LED Lights, IP67 Waterproof 16.5ft Semi-Rigid Snake Cable Inspection Camera for iPhone, iPad and Android Phone (Type C)","Camii","FBA","Industrial & Scientific",106583,"N/A","N/A","N/A","N/A","Borescopes",268,25.99,-24,35,35,-75,922.39,921.93,93,3.9,"Camii-Direct","China",1,596,"N/A","Large Standard-Size",1.02,6.46,6.5,0.46,21.56,59.49,"06/30/2025",18,9,3,0.38
