"https://amazon.com/dp/B0G1R33CDS","https://m.media-amazon.com/images/I/71bhvb5RhpL._SX450_.jpg","B0G1R33CDS","Two-Way Articulating Borescope Camera with Light, 1080P HD Snake Camera with 360° Rotation, 5ft IP67 Waterproof for Mechanics & Plumbers, Borescope with Articulating Head for iPhone & Android","ZZQIN","FBA","Industrial & Scientific",106754,717203057990,"N/A",0717203057990,"N/A","Borescopes",269,56.9,-33,64,64,,3596.24,3596.11,2,4.5,"ziqinmaoyi","N/A",1,0,"N/A","Large Standard-Size",1.93,6.38,12.76,1.08,79.11,218.22,"01/31/2026",3,10,0,32.16
"https://amazon.com/dp/B0FQPK66F7","https://m.media-amazon.com/images/I/7186TNp6btL._SX450_.jpg","B0FQPK66F7","3.9mm Small Hole Borescope, Aperture Endoscope Camera - Suitable for. 20 Caliber and Larger Pipes, Gun Barrel Inspection Tool, Suitable for Android and iOS Smartphones iPhone, iPad, Samsung","StrongTools","FBA","Industrial & Scientific",107068,"N/A","N/A","N/A","N/A","Borescopes",271,35.99,-23,21,21,64,737.61,737.46,25,3.7,"StrongTools","China",1,0,"N/A","Large Standard-Size",2.2,4.69,5.16,0.31,26.82,73.99,"11/30/2025",5,8,0,0.85
"https://amazon.com/dp/B0BMVC1CCJ","https://m.media-amazon.com/images/I/61uiakNV5wL._SX450_.jpg","B0BMVC1CCJ","3 in 1 Endoscope Inspection Camera Borescope HD Camera Waterproof Snake Pipe Drain with 6 Adjustable Led Light Snake Cable USB Adapter for Android Phone Tablet Device(Size:2 M)","Pilarmuture","FBA","Industrial & Scientific",107120,"N/A","N/A","N/A","N/A","Borescopes",272,8.59,46,93,93,4010,839.04,837.96,53,3.5,"henyihaida","China",2,361,306,"Small Standard-Size",0.71,5.59,7.32,0.11,14.61,40.29,"12/31/2025",39,9,0,1.76
"https://amazon.com/dp/B0BXSQX9FQ","https://m.media-amazon.com/images/I/61AiAbqmjCL._SX450_.jpg","B0BXSQX9FQ","Endoscope, 3-in-1 Type-C USB Inspection Camera, 6 Adjustable Led Light,Inspection Camera Borescope,for Android Mobile Phone Tablet PC Desktop Computer, Waterproof (Size:2m)","BNYTXV","FBA","Industrial & Scientific",107520,"N/A","N/A","N/A","N/A","Borescopes",264,9.99,83,27,27,955,267.05,266.64,47,3.4,"nianjiekou","China",1,198,196,"Large Standard-Size",0.94,5.28,5.43,0.11,13.57,37.43,"12/31/2025",35,9,0,0.57
"https://amazon.com/dp/B0CZDGRGNZ","https://m.media-amazon.com/images/I/51JUZ+EWUbL._SX450_.jpg","B0CZDGRGNZ","Sanyipace Sewer Camera Probe with Self-Leveling, 512Hz Sone, 1080P FHD Borescope, 12 PCS LED Lights, Plumbing Accessories, IP68 Waterproof (ONLY for Sanyipace Sewer Camera, Model: S610ASMKTCP)","Sanyipace","FBA","Industrial & Scientific",107892,"N/A","N/A","N/A","N/A","Borescopes",274,289.99,-23,13,2,,2470.73,488.26,1,5,"Yans Minie","China",1,0,"N/A","Large Standard-Size",7.1,4,1.6,0.6,22.88,63.11,"12/31/2025",23,7,8,12.64
"https://amazon.com/dp/B0CST61RTM","https://m.media-amazon.com/images/I/51IbiqCsEfL._SX450_.jpg","B0CST61RTM","Sanyipace Sewer Inspection Camera Probe, 0.67in/17mm Camera Lens, 8pcs LED Lights, 1000TVL, IP68 Waterproof (ONLY for Sanyipace Sewer Camera, Model: S8417D)","Sanyipace","FBA","Industrial & Scientific",107893,"N/A","N/A","N/A","N/A","Borescopes",274,139.99,-32,13,8,,2470.73,1061.33,1,5,"Yans Minie","China",1,0,"N/A","Large Standard-Size",4.7,1.2,1.2,0.2,3.41,9.4,"12/31/2025",25,4,8,12.64
"https://amazon.com/dp/B0BCK4ZV3G","https://m.media-amazon.com/images/I/51ZPRVdSJBL._SX450_.jpg","B0BCK4ZV3G","Sanyipace Sewer Camera Probe with 512Hz Transmitter & Self-Leveling Function, 12 LED Lights, 1080P FHD, IP68 Waterproof (ONLY for Sanyipace Model Number: F5800ADJKABTX, F5100DJKABTX)","Sanyipace","FBA","Industrial & Scientific",109968,"N/A","N/A","N/A","N/A","Borescopes",275,299.99,-22,9,4,-59,2044.45,1137.65,3,4.7,"SanyipaceDirect Store","China",1,220,"N/A","Large Standard-Size",1.54,3.94,7.13,0.44,21.78,60.09,"05/31/2025",42,5,5,3.04
"https://amazon.com/dp/B0CRRMLGDP","https://m.media-amazon.com/images/I/31pYZZ6gyLL._SX450_.jpg","B0CRRMLGDP","Endoscope Camera with 8 Adjustable LED Lights, Visual Endoscope Camera Compatible with Android and iPhone,for Individuals and Pet","prabensei","FBA","Industrial & Scientific",110270,786402609026,"N/A",0786402609026,"N/A","Borescopes",266,49.99,"N/A",105,105,,4902.11,4901.93,44,4.5,"HEIYAO Direct Store","China",1,665,"N/A","Large Standard-Size",1.73,3.5,11.5,0.6,35.06,96.71,"03/31/2024",25,5,0,2.38
"https://amazon.com/dp/B0D9K3BNRY","https://m.media-amazon.com/images/I/51vKDFGTpYL._SX450_.jpg","B0D9K3BNRY","Endoscope Camera with Light, Borescope with Adjustable LED Light,Endoscope Camera,Waterproof Inspection Camera","MEIBAOGE","FBA","Industrial & Scientific",110292,"N/A","N/A",7645120370454,"N/A","Borescopes",276,12.99,-2,34,10,-82,406.94,123.62,17,3.5,"YinQiBeauty","China",1,340,"N/A","Large Standard-Size",1.3,5.2,5.24,0.17,17.8,49.1,"11/30/2025",19,8,4,2.02
"https://amazon.com/dp/B0D9JZP3YH","https://m.media-amazon.com/images/I/51vKDFGTpYL._SX450_.jpg","B0D9JZP3YH","Endoscope Camera with Light, Borescope with Adjustable LED Light,Endoscope Camera,Waterproof Inspection Camera","MEIBAOGE","FBA","Industrial & Scientific",110297,"N/A","N/A",7645120370461,"N/A","Borescopes",276,12.99,-22,34,6,-82,406.94,72.79,17,3.5,"YinQiBeauty","China",1,340,"N/A","Large Standard-Size",1.1,5.2,5.51,0.2,15.9,43.86,"11/30/2025",19,8,4,2.02
"https://amazon.com/dp/B0D9K3J5W8","https://m.media-amazon.com/images/I/51vKDFGTpYL._SX450_.jpg","B0D9K3J5W8","MEIBAOGE Endoscope Camera With Adjustable LED Light, Waterproof Inspection Borescope, 1 Meter Soft Cord","MEIBAOGE","FBA","Industrial & Scientific",110298,"N/A","N/A",7645120370430,"N/A","Borescopes",276,10.99,-2,34,19,-82,406.94,209.75,17,3.5,"YisiyuanTc","China",1,340,"N/A","Large Standard-Size",1.26,5.12,5.16,0.13,16.76,46.23,"11/30/2025",19,8,4,2.02
"https://amazon.com/dp/B0FR9KWW83","https://m.media-amazon.com/images/I/71cQEGntOyL._SX450_.jpg","B0FR9KWW83","Endoscope Camera with Light, 4.3"" HD Display, 5.5mm Waterproof Borescope, 6.6ft Semi-Rigid Cable, 6 LED Plumbing Camera for Pipe, Car Engine, and Drain Inspection","JYTONE","FBA","Industrial & Scientific",110806,"N/A","N/A","N/A","N/A","Borescopes",261,28.99,-20,28,28,-47,819.5,819.1,27,4.8,"ERYUHAIAN","China",1,0,"N/A","Large Standard-Size",3.23,6.06,11.02,1.01,108.6,299.59,"11/30/2025",5,7,0,1.05
"https://amazon.com/dp/B085L57J5W","https://m.media-amazon.com/images/I/71sBhHVrnBL._SX450_.jpg","B085L57J5W","Autel MaxiVideo MV480 Inspection Camera, 1080P HD Industrial Endoscope with Light, Dual Cameras, 10-Level Adjustable LED, 7X Zoom, Snake Borescope with Audio Annotation, 360°Rotation, Up of MV460","Autel","FBA","Industrial & Scientific",111056,706597653284,"N/A",0706597653284,"N/A","Borescopes",277,249,-16,12,12,-46,2912.44,2912.28,43,4.5,"Autelonline","China",1,283,5,"Large Standard-Size",5.87,12.01,15.2,5.62,539.51,1488.31,"04/30/2025",71,9,0,0.27
"https://amazon.com/dp/B0DMVH4B71","https://m.media-amazon.com/images/I/71lVYza5INL._SX450_.jpg","B0DMVH4B71","Endoscope Camera with Light, Anhendeler 1080P HD Borescope 4.3"" IPS Screen, IP67 Waterproof Snake Camera， for Automotive, Pipe, Wall Inspection","Anhendeler","FBA","Industrial & Scientific",111462,"N/A","N/A","N/A","N/A","Borescopes",263,29.99,-8,33,12,31,866.22,354.97,1075,4.3,"Anhendeler","China",1,242,-86,"Large Standard-Size",2.91,5.24,6.69,0.97,51.36,141.68,"05/31/2024",15,6,5,0.03
"https://amazon.com/dp/B08R9VC1RB","https://m.media-amazon.com/images/I/71SzBw5Q9zL._SX450_.jpg","B08R9VC1RB","Wireless Rifle Borescope NIDAGE 0.2inch Rifle Bore Scope Gun Cleaning Camera Fits .20 Caliber and Larger, Visual Barrel Gun Endoscope with 3.28FT Cable, Side View Mirror for Bore Cleaning Inspection","NIDAGE","FBA","Industrial & Scientific",112693,791727101292,"N/A",0791727101292,"N/A","Borescopes",263,52.99,-18,18,18,-63,933.47,933.32,72,4.2,"TELESION","China",1,213,-35,"Large Standard-Size",1.89,7.32,7.48,0.68,52.1,143.73,"02/29/2024",62,7,0,0.24
"https://amazon.com/dp/B09YGNWL44","https://m.media-amazon.com/images/I/81kjPZcxXCL._SX450_.jpg","B09YGNWL44","Dual Lens Endoscope Camera with Light, Teslong 4.5"" HD Snake Borescope Inspection Camera, 0.2inch Automotive Scope Camera with Flexible Cable, Industrial Fiber Optic for Engine Mechanic(5FT)","Teslong","FBA","Industrial & Scientific",113299,"N/A","N/A","N/A","N/A","Borescopes",279,89.99,-7,39,39,-16,3545.46,3544.93,172,4.3,"Teslong","China",1,748,"N/A","Large Standard-Size",2.91,6.73,8.07,1.26,79.57,219.51,"11/30/2024",46,9,0,0.23
"https://amazon.com/dp/B0DR8W47C6","https://m.media-amazon.com/images/I/81pq7SNgG0L._SX450_.jpg","B0DR8W47C6","[Triple-Lens] Endoscope Camera with Light, 1080P Borescope with 32GB Card - IP68 & 4.5"" Sewer Inspection Camera with 16.5FT Semi-Rigid Cable, Mens Gifts for Fathers, Dad, Tools for Men, Husbands","ADvancore","FBA","Industrial & Scientific",113960,"N/A","N/A","N/A","N/A","Borescopes",266,61.99,-14,55,15,-103,3209.35,907.23,220,4.4,"ADvancore","China",1,0,"N/A","Large Standard-Size",3.23,5.51,9.06,1.26,81.18,223.95,"11/30/2025",12,6,8,0.25
"https://amazon.com/dp/B0FKGVXXJB","https://m.media-amazon.com/images/I/71f9Mem98SL._SX450_.jpg","B0FKGVXXJB","Sanyipace Self-Leveling Sewer Camera 165FT/50M with Wheels and Retractable Handle, Drain Camera with 512Hz Probe, Meter Counter, Video & Audio Record Speaker, Keyboard Input, 5X Zoom, 10"" HD Screen","Sanyipace","FBA","Industrial & Scientific",114357,"N/A","N/A","N/A","N/A","Borescopes",267,1249.88,72,31,4,,32033.65,5586.77,64,4.1,"Urselection","China",1,0,"N/A","Large bulky",14,17.1,20,33.3,2410.62,6650,"01/31/2026",7,9,9,0.49
"https://amazon.com/dp/B07PBF6DX5","https://m.media-amazon.com/images/I/71dixVdUUML._SX450_.jpg","B07PBF6DX5","T TAKMLY 5.5mm Endoscope Borescope Inspection Camera with Light for iPhone, OTG Android Phone, Snake Drain Scope Cameras Bore Scope Borescopes, IP67 Waterproof 16.4FT Semi-Rigid Cable","T TAKMLY","FBA","Industrial & Scientific",114938,713869882136,"N/A",0713869882136,"N/A","Borescopes",275,20.99,-20,49,49,-119,1036.27,1035.65,10369,4,"T TAKMLY STORE","China",1,0,"N/A","Large Standard-Size",2.05,4.25,4.88,0.4,21.41,59.05,"10/31/2025",83,6,2,0
"https://amazon.com/dp/B0FXXGFLTL","https://m.media-amazon.com/images/I/71tl9ajHo3L._SX450_.jpg","B0FXXGFLTL","Anysun Self-Leveling Sewer Camera with 512Hz Transmitter, Meter Marking, 9'' IPS Screen, HD 1080P Resolution, 5100mAh Battery, 165ft 5mm Cable Sewer Drain Video Inspection Camera with DVR-32GB","anysun","FBA","Industrial & Scientific",115006,717839120006,"N/A",0717839120006,"N/A","Borescopes",276,699.99,"N/A",30,4,-40,14398.51,2727.68,5,4.8,"HZDZ_Shop","Hong Kong",1,0,"N/A","Large bulky",15.35,14.96,6.69,16.09,774.05,2135.32,"10/31/2025",3,7,9,5.99
"https://amazon.com/dp/B0FLVB6GYH","https://m.media-amazon.com/images/I/51ilLTm3HrL._SX450_.jpg","B0FLVB6GYH","Sanyipace Sewer Camera with 512Hz Transmitter,10"" Plumbing Camera with Distance Counter, IP68 Camera with 12 Adjustable LEDs,32GB DVR for Sewer Line,Home,Duct Drain Pipe Plumbing（100ft/30m,7mm Cable","Sanyipace","FBA","Industrial & Scientific",115717,"N/A","N/A","N/A","N/A","Borescopes",271,999.88,-27,31,16,,32033.65,16029.56,64,4.1,"Urselection","China",1,0,"N/A","Large bulky",13.11,15.55,18.54,24.93,1902.91,5249.41,"01/31/2026",6,9,9,0.49
"https://amazon.com/dp/B0FGH475P3","https://m.media-amazon.com/images/I/61nIQruLQGL._SX450_.jpg","B0FGH475P3","Milwaukee Electric - M12. AUTO Technician BORESCOPE","Milwaukee","FBM","Industrial & Scientific",115947,045242821525,00045242821525,0045242821525,"N/A","Borescopes",281,429,-27,15,15,373,6547.01,6546.9,"N/A","N/A","Trusted Supply Source","USA",6,0,"N/A","Large Standard-Size",7,5,2,1,"N/A","N/A","08/31/2025",6,3,0,"N/A"
"https://amazon.com/dp/B0D14P2NKP","https://m.media-amazon.com/images/I/610MBkedNML._SX450_.jpg","B0D14P2NKP","Endoscope Borescope Camera with Light, 4.3"" IPS HD Garage Inspection Camera Tools, IP67 Waterproof Drain Pipe Borescope, 8 LEDs, 16.5FT Semi-Rigid Cable for Sewer, Automotive Engine, HVAC, Pipe","Binazon","FBA","Industrial & Scientific",116586,"N/A","N/A","N/A","N/A","Borescopes",276,27.99,1,8,8,-128,226.07,225.9,62,4.1,"Binazon","China",1,231,"N/A","Large Standard-Size",3.03,4.8,7.28,1.08,53.31,147.06,"11/30/2024",22,7,0,0.13
"https://amazon.com/dp/B0FXXFZBB6","https://m.media-amazon.com/images/I/51JcLIWxaeL._SX450_.jpg","B0FXXFZBB6","Anysun Self-Leveling Sewer Camera with 512Hz Transmitter, Meter Marking, 9'' IPS Screen, 165ft 7mm Cable, HD 1080P Sewer Drain Video Inspection Camera with DVR 32GB, 5100mAh Battery","anysun","FBA","Industrial & Scientific",116714,717839120037,"N/A",0717839120037,"N/A","Borescopes",282,629.99,"N/A",30,1,-40,14398.51,928.58,5,4.8,"HZDZ_Shop","Hong Kong",1,0,"N/A","Large bulky",15.35,14.96,6.69,16.09,774.05,2135.32,"10/31/2025",3,8,9,"N/A"
"https://amazon.com/dp/B0DLF296HZ","https://m.media-amazon.com/images/I/51NkeXGaE0L._SX450_.jpg","B0DLF296HZ","Klein Tools 69473 Borescope, 9 mm 10-Foot Armored Waterproof Gooseneck Snake, LED Lights, Endoscope Digital Inspection Camera for Android Phones","KLEIN TOOLS","FBM","Industrial & Scientific",117618,092644694738,"N/A",0092644694738,"N/A","Borescopes",283,91.81,-26,24,3,374,1587.13,317.75,7,3.8,"KART IT","USA",3,0,"N/A","Large Standard-Size",0.87,6.77,7.99,0.66,"N/A","N/A","12/31/2025",16,13,3,3.44
"https://amazon.com/dp/B0DCGT58W8","https://m.media-amazon.com/images/I/51P2GXMXyDL._SX450_.jpg","B0DCGT58W8","Klein Tools 69464 Replacement 5.5 mm 4.9-Foot Armored Waterproof Snake, LEDs, Inspection Camera for Klein Plumber's Borescope Cat. No. ET18","KLEIN TOOLS","FBM","Industrial & Scientific",117618,092644694646,"N/A",0092644694646,"N/A","Borescopes",283,87.25,-4,24,7,374,1587.13,603.74,7,3.8,"Gott Electronics","USA",1,0,"N/A","Small Standard-Size",7,7,0.75,0.37,"N/A","N/A","12/31/2025",18,10,3,3.44
"https://amazon.com/dp/B0G48WTXYF","https://m.media-amazon.com/images/I/71a1WQf+vbL._SX450_.jpg","B0G48WTXYF","Ralcam Dual Lens 360° Articulating Borescope 5 Inch, 4-Way 180° Endoscope Camera with Light, 6.5mm Slim Probe, 5FT Semi-Rigid Snake Camera for Automotive HVAC Pipe Inspection","Ralcam","FBA","Industrial & Scientific",118039,"N/A","N/A","N/A","N/A","Borescopes",278,429.99,"N/A",57,21,,20965.93,9244.52,38,4.5,"Ralcam","China",1,0,"N/A","Large Standard-Size",3.66,12.44,14.09,3.44,322.99,891,"01/31/2026",3,7,3,1.51
"https://amazon.com/dp/B0G43L1BD9","https://m.media-amazon.com/images/I/71lLMjTYBEL._SX450_.jpg","B0G43L1BD9","2-Way 180° Articulating Borescope Camera with Light, 6.2mm Ultra-Slim Probe, 4.3"" HD Inspection Camera, 6.6FT Flexible Snake Industrial Endoscope for Automotive Engine Wall","Ralcam","FBA","Industrial & Scientific",118699,"N/A","N/A","N/A","N/A","Borescopes",282,129.99,"N/A",74,39,133,21954.86,5025.87,55,4.4,"AijR","China",1,0,"N/A","Large Standard-Size",3.5,9.25,16.65,2.78,271.39,748.67,"01/31/2026",3,9,5,1.35
"https://amazon.com/dp/B0CMTX8ZM6","https://m.media-amazon.com/images/I/71XLL7Il9PL._SX450_.jpg","B0CMTX8ZM6","DEPSTECH Upgraded 5'' IPS Endoscope Camera with Light, 1080P HD Borescope for Sewer Inspection, Waterproof Drain Pipe Plumbing Camera, Cool Tech Gadgets for Men","DEPSTECH","FBA","Industrial & Scientific",119523,"N/A","N/A","N/A","N/A","Borescopes",286,85.99,-55,30,30,-72,2684.95,2684.52,697,4.5,"DEPSTECH Authorized Store","China",1,0,"N/A","Large Standard-Size",2.8,11.5,14.33,4.45,232.32,640.87,"08/31/2025",26,9,2,0.04
"https://amazon.com/dp/B0DTDY464M","https://m.media-amazon.com/images/I/61EIK+QLciL._SX450_.jpg","B0DTDY464M","Gzpce Two-Way Articulating Endoscope with Light, Industrial Endoscopic with 5"" IPS Screen,6.4mm IP67 Waterproof Borescope,Snake Camera with 3.28FT Semi-Rigid Cable,32GB SD Card","gzpce","FBA","Industrial & Scientific",120838,"N/A","N/A","N/A","N/A","Borescopes",278,49.95,-26,5,5,-117,309.18,309.12,2,5,"gzpce","China",1,0,"N/A","Large Standard-Size",2.91,8.39,17.09,2.58,210.07,579.51,"10/31/2025",18,8,0,2.65
"https://amazon.com/dp/B0CP86DPTW","https://m.media-amazon.com/images/I/71G1OkA08qL._SX450_.jpg","B0CP86DPTW","Endoscope Camera with Light for iPhone Android – 1920P Snake Borescope with 8 LED, IP67 Waterproof Inspection Tool for Drain Pipe Engine Plumbing (16.4FT Semi-Rigid Cable)","iiazimps","FBA","Industrial & Scientific",120993,796826352651,"N/A",0796826352651,"N/A","Borescopes",282,16.96,-12,27,27,-1,473.72,473.31,113,4.2,"IIAZIMPS","China",1,496,-62,"Large Standard-Size",1.5,4.84,4.88,0.37,17.81,49.12,"11/30/2024",27,6,0,0.24
"https://amazon.com/dp/B0F5PNMVD9","https://m.media-amazon.com/images/I/61RolBu+zPL._SX450_.jpg","B0F5PNMVD9","Zealtron Two-Way Articulating Borescope with Light, 5 Inch IPS Screen Industrial Endoscope with 0.24in/6.2mm Articulated Probe, 5ft Highly Resilient Snake Cable Inspection Camera for Wall Automotive","zealtron","FBA","Industrial & Scientific",121182,"N/A","N/A","N/A","N/A","Borescopes",290,89.99,-12,49,49,-118,4382.66,4382.03,217,4.4,"Zealtron","China",1,0,"N/A","Large Standard-Size",2.24,9.72,16.97,1.46,186.43,514.3,"07/31/2025",10,8,0,0.23
"https://amazon.com/dp/B07Z8YD7SH","https://m.media-amazon.com/images/I/417e+Puj1UL._SX450_.jpg","B07Z8YD7SH","3 in 1 Endoscope Borescope Snake Camera Type C USB Endoscope for Android Mobile Phone 3.9mm Lens Borescope Inspection, 1280x720 Video Inspection Camera (5M)","Walfront","FBA","Industrial & Scientific",121553,"N/A","N/A","N/A","N/A","Borescopes",289,25.57,-15,11,11,-79,273.15,272.93,9,4.4,"nineone","China",2,103,296,"Large Standard-Size",1.38,5,5.2,0.4,18.06,49.83,"10/31/2025",76,9,0,1.22
"https://amazon.com/dp/B0DNMGM6MH","https://m.media-amazon.com/images/I/71DURb8Ep3L._SX450_.jpg","B0DNMGM6MH","VEVOR Sewer Camera, 165 ft/50m, Self-Leveling Drain Camera with 512Hz Transmitter, Distance Counter, 9"" Screen 1080P HD Snake Plumbing Cameras with Lights-12 LED & 32GB Card for Duct Pipe","VEVOR","FBM","Industrial & Scientific",121744,197988808756,"N/A",0197988808756,"N/A","Borescopes",289,749.9,"N/A",38,38,17,27500.94,27500.68,6,3.3,"Supdear","China",1,237,"N/A","Large bulky",17.72,17.32,14.76,31.09,"N/A","N/A","10/31/2025",15,12,0,6.29
"https://amazon.com/dp/B0FFMFVCWX","https://m.media-amazon.com/images/I/51T6O533iwL._SX450_.jpg","B0FFMFVCWX","Anysun Self Leveling Sewer Camera 512Hz with Distance Counter, MIC, 7MM Thicker Cable, 300Ft Pipe Inspection Cameras with 9'' 1080P Screen, Video Drain Cam IP68 Industrial Borescope Snake, 32GB Card","anysun","FBA","Industrial & Scientific",121850,717661515162,"N/A",0717661515162,"N/A","Borescopes",291,1199.99,-8,27,1,-64,21739,1557.43,29,4.3,"Yongchangsheng tech","China",1,503,"N/A","Large bulky",4,13.6,20.7,28.85,566.95,1564,"03/31/2025",7,8,9,0.94
"https://amazon.com/dp/B0D5M8F5Z3","https://m.media-amazon.com/images/I/71Wc4xa-bPL._SX450_.jpg","B0D5M8F5Z3","Anysun Sewer Camera Self Leveling with Distance Counter, 7MM Thicker Cable, 165Ft/50M Pipe Inspection Camera with 9'' 1080P IPS Screen, Video Drain Camera IP68 Industrial Borescope Snake, 32GB Card","anysun","FBA","Industrial & Scientific",121850,"N/A","N/A","N/A","N/A","Borescopes",291,799.99,-13,27,4,-64,21739,3098.63,29,4.3,"Yongchangsheng tech","China",1,503,"N/A","Large bulky",11,15.05,19,20.85,1583.65,4368.68,"03/31/2025",19,7,9,0.94
"https://amazon.com/dp/B0D5M8FK1L","https://m.media-amazon.com/images/I/71Wc4xa-bPL._SX450_.jpg","B0D5M8FK1L","Anysun Sewer Camera Self Leveling with Distance Counter, 7MM Thicker Cable, 300Ft/91.5M Pipe Inspection Cameras with 9'' 1080P Screen, IP68 Waterproof Sewer Drain Cam with DVR Recorder & 32GB Card","anysun","FBA","Industrial & Scientific",121855,"N/A","N/A","N/A","N/A","Borescopes",291,1099.99,5,27,2,-64,21739,1926.19,29,4.3,"Yongchangsheng tech","China",1,503,"N/A","Large bulky",13,19,22.5,29.5,2798.05,7718.75,"03/31/2025",19,7,9,0.94
"https://amazon.com/dp/B0FFMQ54P9","https://m.media-amazon.com/images/I/71qN-gNQnGL._SX450_.jpg","B0FFMQ54P9","Anysun Self Leveling Sewer Camera 512Hz with Distance Counter, MIC, 7MM Thicker Cable, 100Ft Pipe Inspection Cameras with 9'' 1080P Screen, Video Drain Cam IP68 Industrial Borescope Snake, 32GB Card","anysun","FBA","Industrial & Scientific",121856,717661515186,"N/A",0717661515186,"N/A","Borescopes",291,799.99,-12,27,4,-64,21739,3415.68,29,4.3,"Yongchangsheng tech","China",1,503,"N/A","Large bulky",11.8,17.2,19.7,16.85,2013.04,5553.21,"03/31/2025",7,8,9,0.94
"https://amazon.com/dp/B0FFML9DVK","https://m.media-amazon.com/images/I/71qN-gNQnGL._SX450_.jpg","B0FFML9DVK","Anysun Self Leveling Sewer Camera 512Hz with Distance Counter, MIC, 7MM Thicker Cable, 165Ft Pipe Inspection Cameras with 9'' 1080P Screen, Video Drain Cam IP68 Industrial Borescope Snake, 32GB Card","anysun","FBA","Industrial & Scientific",121856,717661515179,"N/A",0717661515179,"N/A","Borescopes",291,959.99,-14,27,2,-64,21739,2257.17,29,4.3,"Yongchangsheng tech","China",1,503,"N/A","Large bulky",11.9,17.4,19.5,19.25,2032.85,5607.87,"03/31/2025",7,8,9,0.94
"https://amazon.com/dp/B0D8FVZ6Z5","https://m.media-amazon.com/images/I/61MREBaQcYL._SX450_.jpg","B0D8FVZ6Z5","Sewer Camera Cable with Distance Counter,Replacement 5mm Rigid Cable 32.8FT for JQKJCAM Sewer Inspection Camera,Pipe Drain Camera Accessory（32.8FT/10M for 17mm)","JQKJCAM","FBA","Industrial & Scientific",122626,"N/A","N/A","N/A","N/A","Borescopes",292,131.5,-16,35,10,162,6456.73,1291.78,13,4.2,"JJKJ Cam","China",1,343,"N/A","Large Standard-Size",13,5,14,1.65,458.16,1263.89,"12/31/2025",20,3,22,2.67
"https://amazon.com/dp/B0D75VF79S","https://m.media-amazon.com/images/I/61MREBaQcYL._SX450_.jpg","B0D75VF79S","Sewer Camera Cable Wire with Distance Counter,Replacement 5mm Rigid Cable 164FT for JQKJCAM Sewer Inspection Camera,Pipe Drain Camera Accessory（164FT/50M for 23mm)","JQKJCAM","FBA","Industrial & Scientific",122631,"N/A","N/A","N/A","N/A","Borescopes",292,265,-27,35,2,162,6456.73,638.22,13,4.2,"JJKJ Cam","China",1,343,"N/A","Large Standard-Size",13.39,5.12,13.5,5.7,465.97,1285.44,"12/31/2025",20,9,22,2.67
"https://amazon.com/dp/B0DDXDMTPR","https://m.media-amazon.com/images/I/713wfsTzFUL._SX450_.jpg","B0DDXDMTPR","Sewer Camera Self Leveling, Anysun Sewer Inspection Camera 150ft with 9'' Monitor and DVR Recorder with 32GB Card, Meter Marker, 12 Adjustable Lights","anysun","FBA","Industrial & Scientific",123840,717331218638,"N/A",0717331218638,"N/A","Borescopes",281,639.99,-6,21,5,43,13256.96,3122.2,30,4.5,"Nedive","China",1,283,"N/A","Large bulky",12.25,17.25,19.25,18.3,2048.01,5649.67,"03/31/2024",18,7,5,0.69
"https://amazon.com/dp/B0FHH9FMXD","https://m.media-amazon.com/images/I/81C8u584GvL._SX450_.jpg","B0FHH9FMXD","Hialemi Portable 9'' Sewer Camera with Locator - 7MM/300Ft/91.5M Self Leveling Drain Camera & 512Hz Sonde & Meter Counter & 5X Zoom - 145° Plumbing Pipe Inspection Cam - 1080P IPS Screen & DVR 32GB","Hialemi","FBA","Industrial & Scientific",124198,"N/A","N/A","N/A","N/A","Borescopes",294,1549.99,-26,21,2,,18332.28,2448.57,7,4.7,"Hialemi-US Direct","China",1,0,"N/A","Large bulky",24.8,18.9,14.17,32.5,3344.71,9226.79,"11/30/2025",7,9,6,3.05
"https://amazon.com/dp/B0FQ5FBYPW","https://m.media-amazon.com/images/I/816Bi2J4UlL._SX450_.jpg","B0FQ5FBYPW","Hialemi Portable 9'' Sewer Camera Pipe Inspector 100Ft/30M - Self Leveling & Meter Counter 145° & 5X Zoom Drain Plumbing Camera with 12 Adjustable Lights - 1080P IPS HD Screen with DVR 32GB","Hialemi","FBA","Industrial & Scientific",124203,"N/A","N/A","N/A","N/A","Borescopes",294,649.99,-11,21,8,,18332.28,5424.91,7,4.7,"Hialemi-US Direct","China",1,0,"N/A","Large bulky",13.11,15.94,21.57,22.22,2269.43,6260.49,"11/30/2025",5,8,6,3.05
"https://amazon.com/dp/B0FHHHT9RV","https://m.media-amazon.com/images/I/819kFsOWuML._SX450_.jpg","B0FHHHT9RV","Hialemi Portable 9'' Sewer Camera with 512Hz Transmitter - 7MM/ 300Ft/ 91.5M Self Leveling Drain Camera & Meter Counter & 5X Zoom - 145° Plumbing Pipe Inspection Cam - 1080P IPS Screen & DVR 32GB","Hialemi","FBA","Industrial & Scientific",124204,"N/A","N/A","N/A","N/A","Borescopes",294,1299.99,-27,21,2,,18332.28,3075.76,7,4.7,"Hialemi-US Direct","China",1,0,"N/A","Large bulky",14.5,18.75,24.75,36.15,3387.82,9345.7,"11/30/2025",7,9,6,3.05
"https://amazon.com/dp/B0FHHKPFVH","https://m.media-amazon.com/images/I/81be30oGylL._SX450_.jpg","B0FHHKPFVH","Hialemi Portable 9'' Sewer Camera with 512Hz Transmitter - 100Ft/30M Self Leveling Drain Camera & Meter Counter & 5X Zoom - 145° Plumbing Pipe Inspection Cam with Lights - 1080P IPS Screen & DVR 32GB","Hialemi","FBA","Industrial & Scientific",124204,"N/A","N/A","N/A","N/A","Borescopes",294,699.99,-11,21,6,,18332.28,3862.21,7,4.7,"Hialemi-US Direct","China",1,0,"N/A","Large bulky",12.5,16,21,22.55,2114.58,5833.33,"11/30/2025",7,9,6,3.05
"https://amazon.com/dp/B0FJXR9R62","https://m.media-amazon.com/images/I/71x-f1lZOdL._SX450_.jpg","B0FJXR9R62","Sewer Camera,100FT/30M 4.3"" Pipe Drain Inspection with DVR Function and LED Lights,18mm Borescopes Plumbing 8500Mah Battery Waterproof IP68 Endoscope HD 1000TVL 32GB Card (18mm Camera)","JINXINEBAY","FBA","Industrial & Scientific",124585,"N/A","N/A","N/A","N/A","Borescopes",295,279.99,-29,23,13,-17,5847.22,3249.16,5,3.7,"31yoosee","China",1,0,"N/A","Large Standard-Size",7.83,12.64,15.55,8.05,774.84,2137.5,"12/31/2025",7,7,2,4.64
"https://amazon.com/dp/B0F4QQLWK5","https://m.media-amazon.com/images/I/61N8y7s2VML._SX450_.jpg","B0F4QQLWK5","1920P HD Dual Lens Endoscope Camera Semi-Rigid Snake Cable IP67 Waterproof 8LED Lights Dimmable HD Industrial Pipeline Inspection Probe Compatible with Smartphones Endoscope Camera (9.9ft)","LAUREII","FBA","Industrial & Scientific",124594,"N/A","N/A","N/A","N/A","Borescopes",297,18.76,-51,12,5,-93,247.46,98.31,37,4,"Laureii Direct","China",1,0,"N/A","Large Standard-Size",1.46,5.08,5.16,0.29,19.27,53.15,"06/30/2025",10,8,3,0.32
