"https://amazon.com/dp/B0D73FFM5L","https://m.media-amazon.com/images/I/71RyPH-6BGL._SX450_.jpg","B0D73FFM5L","Anysun All-in-1 Sewer Camera 512Hz, Self-Leveling, Distance Counter, 7MM/0.28'' Thicker Cable, Keyboard, 1-Touch Video/Audio, 131Ft Pipe Inspection Cameras with 9"" 1080P Screen Drain Cam IP68, 16GB","anysun","FBA","Industrial & Scientific",162856,"N/A","N/A","N/A","N/A","Borescopes",420,1299.99,-22,9,3,35,11665.87,3813.7,58,3.7,"Yongchangsheng tech","China",1,241,-29,"Large bulky",15.8,17,21,31.22,2839.89,7834.17,"02/29/2024",18,8,9,0.15
"https://amazon.com/dp/B0CNLH8RZF","https://m.media-amazon.com/images/I/81OsRwrvuZL._SX450_.jpg","B0CNLH8RZF","Anysun Sewer Camera with 512Hz Sonde, Self-Leveling, Distance Counter, Keyboard, 1-Touch Video/Audio, 7mm Thicker Cable, 330Ft Sewer Inspection Camera with 10"" IPS Adjustable Monitor, IP68 Waterproof","anysun","FBA","Industrial & Scientific",162857,"N/A","N/A","N/A","N/A","Borescopes",420,1699.99,-9,9,1,35,11665.87,1330.3,36,3.8,"Yongchangsheng tech","China",1,241,-29,"Extra-large 50+ to 70 lb",12.25,22.5,26.5,43.5,3677.39,10144.53,"02/29/2024",26,8,9,0.24
"https://amazon.com/dp/B0BRYYQ9TV","https://m.media-amazon.com/images/I/51uW4rjZoUL._SX450_.jpg","B0BRYYQ9TV","Anysun All-in-1 Sewer Camera - 512Hz, Distance Counter, Self-Leveling, 1-Touch Video/Audio, 100Ft Pipe Inspection Camera with 9"" 1080P Screen, IP68 Industrial Borescope, 16GB","anysun","FBA","Industrial & Scientific",162858,772168843231,"N/A",0772168843231,"N/A","Borescopes",420,999.99,"N/A",9,1,35,11665.87,946.89,59,3.7,"Yongchangsheng tech","China",1,241,-29,"Large bulky",15.3,17,21,28.55,2750.02,7586.25,"02/29/2024",36,7,9,0.15
"https://amazon.com/dp/B0DCFMGJM4","https://m.media-amazon.com/images/I/81OsRwrvuZL._SX450_.jpg","B0DCFMGJM4","Anysun Sewer Camera 512Hz, Self-Leveling & Distance Counter, 7mm Thicker Cable, Keyboard, 10"" IPS Adjustable Monitor,1-Touch Video/Audio, Drain Pipe Inspection Camera IP68 with DVR & 16GB Card - 165Ft","anysun","FBA","Industrial & Scientific",163005,"N/A","N/A","N/A","N/A","Borescopes",421,1580,-25,9,1,35,11665.87,1697.48,58,3.7,"Yongchangsheng tech","China",1,241,-29,"Large bulky",11.5,22.5,26.5,22.5,3452.25,9523.44,"02/29/2024",16,8,9,0.15
"https://amazon.com/dp/B0CVZS9V8V","https://m.media-amazon.com/images/I/61QXinI7dVL._SX450_.jpg","B0CVZS9V8V","23MM Sewer Camera Roller Guide Wheels,90mm/3.5'' Skid Protective Cover with Pulleys for 0.9'' Pipe Drain Duct Inspection Camera,JQKJCAM Plumbing Borescope Camera Accessories/Parts","JQKJCAM","FBA","Industrial & Scientific",163999,"N/A","N/A","N/A","N/A","Borescopes",366,22.5,-9,18,18,-38,401.46,401.32,11,4.4,"JJKJ Cam","China",1,0,"N/A","Large Standard-Size",1.5,4,5.9,0.3,17.82,49.17,"09/30/2025",24,7,0,1.62
"https://amazon.com/dp/B0CM62H19J","https://m.media-amazon.com/images/I/717cF89wDiL._SX450_.jpg","B0CM62H19J","210°Two-Way Articulating Borescope - BELEY 5inch 1080P Industrial Endoscope with 1080P Snake Camera & LED Light (1m Cable 3000mAh Rechargeable Battery)","BELEY","FBA","Industrial & Scientific",166336,"N/A","N/A","N/A","N/A","Borescopes",369,119,-10,5,1,350,402.28,159.36,17,4.4,"BELEY DIRECT","China",1,0,"N/A","Large Standard-Size",4.5,1.5,9,1.9,30.59,84.38,"10/31/2025",28,6,2,0.3
"https://amazon.com/dp/B0FB97HY5R","https://m.media-amazon.com/images/I/71mIfO6YNeL._SX450_.jpg","B0FB97HY5R","Two-Way Articulating Borescope with 0.24in/6.25mm Camera & Light, IP67 Waterproof Industrial Endoscope, Flexible Snake Tube for Automotive/Aircraft Engine Inspection","BELEY","FBA","Industrial & Scientific",166343,"N/A","N/A","N/A","N/A","Borescopes",369,49.99,-24,5,4,350,402.28,242.72,17,4.4,"BELEY DIRECT","China",1,0,"N/A","Large Standard-Size",2.99,8.31,12.13,1.65,151.75,418.61,"10/31/2025",9,8,2,0.3
"https://amazon.com/dp/B0C68MK5J8","https://m.media-amazon.com/images/I/61rkkvV4EML._SX450_.jpg","B0C68MK5J8","DEPSTECH DS520 Triple Lens Sewer Camera Cable, 7.9mm Dia Probe, IP67 Waterproof Inspection Camera Lens with Adjustable LED Lights, 50ft Semi-Rigid Cable Replacement, EVA Carrying Case","DEPSTECH","FBA","Industrial & Scientific",167415,"N/A","N/A","N/A","N/A","Borescopes",371,59.98,95,5,5,108,315.29,315.19,4,4.7,"Depstech","China",1,40,-67,"Large Standard-Size",7.28,7.28,3.54,2.43,94.64,261.07,"07/31/2024",31,5,2,1.31
"https://amazon.com/dp/B0DLW66T4W","https://m.media-amazon.com/images/I/71qG0Erf4-L._SX450_.jpg","B0DLW66T4W","Anysun Sewer Camera with Locator, Self Leveling Sewer Camera 100ft with Distance Counter, 10.1"" HD Monitor with Keypad and 7MM Cable, 5X Zoom(16GB Card)","anysun","FBA","Industrial & Scientific",168388,717813335990,"N/A",0717813335990,"N/A","Borescopes",364,999.99,17,11,8,67,11058.26,7795.36,3,3.2,"Nedive","China",1,0,"N/A","Large bulky",15.5,17.4,24.8,30.25,3367.5,9289.67,"09/30/2025",15,7,2,3.5
"https://amazon.com/dp/B0DXPBQBHG","https://m.media-amazon.com/images/I/71qG0Erf4-L._SX450_.jpg","B0DXPBQBHG","Anysun Sewer Camera with Locator, Self Leveling Sewer Camera 165ft with Distance Counter, 10.1"" HD Monitor with Keypad and 7MM Cable, 5X Zoom(16GB Card)","anysun","FBA","Industrial & Scientific",168421,717690769659,"N/A",0717690769659,"N/A","Borescopes",364,1199.99,-16,11,3,67,11058.26,3262.53,3,3.2,"Nedive","China",1,0,"N/A","Large bulky",15.7,17.4,24.6,33,3383.45,9333.65,"09/30/2025",12,7,2,3.5
"https://amazon.com/dp/B0FLPYF6SV","https://m.media-amazon.com/images/I/71xnFN931wL._SX450_.jpg","B0FLPYF6SV","Anysun Sewer Camera Self Leveling 100ft, Sewer Inspection Camera with Meter Marker, HD Screen, DVR, 12 Adjustable LED Lights, 7mm Cable, 5100mAh Rechargeable Battery, 32GB Card","anysun","FBA","Industrial & Scientific",168960,769016774021,"N/A",0769016774021,"N/A","Borescopes",354,369.99,95,4,4,,1479.96,1479.91,"N/A","N/A","Nedive","China",1,0,"N/A","Large bulky",12.5,18.75,21.5,16.85,2537.03,6998.7,"01/31/2026",6,7,2,"N/A"
"https://amazon.com/dp/B0F2HSPM63","https://m.media-amazon.com/images/I/71-NrGRCqIL._SX450_.jpg","B0F2HSPM63","Okk Sewer Camera, Drain Camera with Meter Counter, Pipe Inspection with Self-Leveling, Industrial Endoscope with DVR, 7"" LCD Plumbing Snake Endoscope 165ft Cable, IP68 Waterproof, 12 LEDs, 16GB Card","okk","FBA","Industrial & Scientific",171386,"N/A","N/A","N/A","N/A","Borescopes",364,499.99,-10,4,1,,2304.82,546.47,5,4.7,"ZOZUS-DIRECT","China",1,0,"N/A","Large bulky",7.75,16.25,17,15.9,1077.9,2973.52,"12/31/2025",11,8,8,0.87
"https://amazon.com/dp/B082PG2GT6","https://m.media-amazon.com/images/I/61FY-07wr1L._SX450_.jpg","B082PG2GT6","Forbest Sewer Drain Inspection Camera, 130ft Fiberglass Cable, 7"" LCD Monitor, DVR Recorder & Battery, 512Hz Sonde Transmitter, Borescope Snake Camera, IP68 Waterproof Lens with Lights, Plumbing Tool","Forbest","FBM","Industrial & Scientific",171791,"N/A","N/A","N/A","N/A","Borescopes",355,949,"N/A",2,1,-111,1622.37,1377.2,23,2.9,"Forbest Products Co.","USA",1,111,17,"Large bulky",12.5,14,14,15.7,"N/A","N/A","12/31/2024",74,7,4,0.08
"https://amazon.com/dp/B0DBHXHWVG","https://m.media-amazon.com/images/I/61Ohm3MgqeL._SX450_.jpg","B0DBHXHWVG","10FT Dual Lens Probe, 8mm/0.31inch Diameter Semi-Rigid Cable Compatible with MS450 Inspection Camera","Teslong","FBA","Industrial & Scientific",171828,"N/A","N/A","N/A","N/A","Borescopes",374,54.99,"N/A",8,8,,442.8,442.69,1,5,"Teslong","China",1,64,"N/A","Large Standard-Size",1.81,5.63,6.57,0.42,33.71,92.99,"07/31/2025",19,7,0,8.05
"https://amazon.com/dp/B0FX4FQC6Y","https://m.media-amazon.com/images/I/71aspBzG38L._SX450_.jpg","B0FX4FQC6Y","Ralcam Articulating Borescope Endoscope Camera with Light, 210° Dual-Direction Snake Camera for Automotive Inspection, 6.2mm Probe, 4.3"" HD Screen, 6 Adjustable LEDs, IP67 Waterproof Semi-Rigid Cable","Ralcam","FBA","Industrial & Scientific",172032,"N/A","N/A","N/A","N/A","Borescopes",375,108.99,3,32,32,-79,3596.8,3596.34,89,4.6,"Ralcam","China",1,0,"N/A","Large Standard-Size",3.03,8.66,12.44,2.23,164.34,453.37,"11/30/2025",4,9,3,0.36
"https://amazon.com/dp/B0CLLJSCJ9","https://m.media-amazon.com/images/I/51vNXhIv7IL._SX450_.jpg","B0CLLJSCJ9","Sewer Camera Self Leveling, Anysun Sewer Inspection Camera 100ft with 9'' Monitor and DVR Recorder with 32GB Card, Meter Marker, 12 Adjustable Lights","anysun","FBA","Industrial & Scientific",172603,774182346200,"N/A",0774182346200,"N/A","Borescopes",376,599.99,-20,21,7,43,13256.96,4324.38,30,4.5,"Nedive","China",1,283,"N/A","Large bulky",11.5,17.5,19.5,16.65,1975.81,5450.52,"03/31/2024",41,7,5,0.69
"https://amazon.com/dp/B0DD781TXP","https://m.media-amazon.com/images/I/713wfsTzFUL._SX450_.jpg","B0DD781TXP","Sewer Camera Self Leveling, Anysun Sewer Inspection Camera 300ft with 9'' Monitor and DVR Recorder with 32GB Card, Meter Marker, 12 Adjustable Lights","anysun","FBA","Industrial & Scientific",172605,717331217716,"N/A",0717331217716,"N/A","Borescopes",376,799.99,-10,21,1,43,13256.96,1141.62,30,4.5,"Nedive","China",1,283,"N/A","Large bulky",13.2,19,20.5,24.6,2588.55,7140.83,"03/31/2024",40,7,5,0.69
"https://amazon.com/dp/B0FLV8WV88","https://m.media-amazon.com/images/I/71U2KkMnQRL._SX450_.jpg","B0FLV8WV88","Sanyipace Sewer Camera 165FT/50M with 512Hz Transmitter,10"" HD Screen,Self-Leveling,Distance Counter,Inspection Camera with [Mic+Speaker+Audio Video] Record,32GB,Ideal for Plumbers and Home(7mm Cable)","Sanyipace","FBA","Industrial & Scientific",172802,"N/A","N/A","N/A","N/A","Borescopes",356,1099.88,-33,31,9,,32033.65,9397.54,64,4.1,"Urselection","China",1,0,"N/A","Large bulky",12.8,15.59,18.31,27.09,1839.59,5074.72,"01/31/2026",6,9,9,0.49
"https://amazon.com/dp/B0DQBN6SNW","https://m.media-amazon.com/images/I/71c0OFqpoOL._SX450_.jpg","B0DQBN6SNW","Two-Way Articulating Borescope Camera with Light, Industrial Endoscope Featuring a 3.9mm Articulated Snake Camera, 4.3"" Endoscope Camera with 3.2FT Semi-Rigid Inspection Camera with Light","PUSILIN","FBM","Industrial & Scientific",173095,"N/A","N/A","N/A","N/A","Borescopes",358,179.99,-14,0,0,-132,"-","-",15,4.4,"Pusilin","China",1,0,"N/A","Large Standard-Size",12.4,8.46,2.95,2.09,"N/A","N/A","10/31/2025",14,8,3,0.01
"https://amazon.com/dp/B0D9WVH12B","https://m.media-amazon.com/images/I/71TJ84VXVTL._SX450_.jpg","B0D9WVH12B","Triplett BR330CAM-10M Replacement Borescope Camera Probe for BR330, 10M Cable","Triplett","Amazon","Industrial & Scientific",173376,614395005214,"N/A",0614395005214,"N/A","Borescopes",382,109.72,-25,15,1,56,2456.66,100.73,5,4.2,"Amazon","N/A",1,204,"N/A","Large Standard-Size",6,6,2,0.95,"N/A","N/A","09/30/2025",19,1,17,3.02
"https://amazon.com/dp/B0FQNT3LPQ","https://m.media-amazon.com/images/I/61Hu6L-Pq2L._SX450_.jpg","B0FQNT3LPQ","Endoscope Camera with Screen,Inspection Camera with Claw and Magnetic Suction,6 Adjustable LED Lights,23.6in IP67,borescope for Inspection,Maintenance,Retrieval,Pipe Cleaning","KeFvoer","FBA","Industrial & Scientific",175009,"N/A","N/A","N/A","N/A","Borescopes",380,39.9,-28,12,12,-41,492.28,492.17,3,3.3,"keshiduo","China",1,0,"N/A","Large Standard-Size",4.53,10.2,13.46,1.37,313.13,863.8,"11/30/2025",5,9,0,6.17
"https://amazon.com/dp/B0C4K1RRPP","https://m.media-amazon.com/images/I/4149fW+iMiL._SX450_.jpg","B0C4K1RRPP","THE PERFECT PART HD LED Ear Endoscope Otoscope Camera Wax Pick Cleaning Tool Cleaner Removal Kit","THE PERFECT PART","FBM","Industrial & Scientific",177730,647168708579,"N/A",0647168708579,"N/A","Borescopes",370,12.59,"N/A",1,1,,12.69,12.63,3,3.3,"The Perfect Part Inc.","USA",1,17,-51,"Large Standard-Size",7,2.5,1,0.85,"N/A","N/A","12/31/2024",33,8,0,0.34
"https://amazon.com/dp/B0DQB3TC3C","https://m.media-amazon.com/images/I/714nvoIzFBL._SX450_.jpg","B0DQB3TC3C","Dual Lens Articulating Borescope Camera with Light,6.2mm Industrial Endoscope Inspection Camera with Articulated Snake Cameras，HD Video Scope for Automotive Engine HVAC Inspection - 3.28FT","PUSILIN","FBA","Industrial & Scientific",179222,"N/A","N/A","N/A","N/A","Borescopes",382,158,-6,0,0,-132,"-","-",15,4.4,"Pusilin","China",1,0,"N/A","Large Standard-Size",12.4,8.46,2.95,0.95,156.06,430.5,"10/31/2025",14,9,3,0.01
"https://amazon.com/dp/B0DWDK327H","https://m.media-amazon.com/images/I/7159zp8MiIL._SX450_.jpg","B0DWDK327H","Sewer Camera w/DVR Function, 4.3"" HD 1080P Screen Pipeline Inspection Camera, IP68 Waterproof Pipe Plumbing Snake Cam with 32GB Card, for Sewer Line, Home, Duct Drain Pipe Plumbing (30M/100FT)","Liwogi","FBA","Industrial & Scientific",179450,"N/A","N/A","N/A","N/A","Borescopes",390,242.99,-27,18,13,843,4595.78,3223.73,4,4,"Hot car parts","China",1,0,"N/A","Large Standard-Size",7.32,13.86,15.86,7.43,810.13,2234.83,"07/31/2025",12,9,2,4.49
"https://amazon.com/dp/B0C715S6M8","https://m.media-amazon.com/images/I/317xsMX+ErL._SX450_.jpg","B0C715S6M8","EUSONYSU 45mm /50mm Dental Chair Unit LCD Monitor Holder Arm Metal For Camera Endoscope Bracket (50MM)","EUSONYSU","FBA","Industrial & Scientific",179901,758358759964,"N/A",0758358759964,"N/A","Borescopes",383,29.9,-24,2,2,50,46.63,46.54,"N/A","N/A","DenFactory","China",2,21,"N/A","Large Standard-Size",14.9,5.5,3.5,2.42,144.41,398.37,"05/31/2025",32,9,2,"N/A"
"https://amazon.com/dp/B0G34PXC7N","https://m.media-amazon.com/images/I/71z6GZ6FEJL._SX450_.jpg","B0G34PXC7N","4-Way 360° Articulating Borescope with 6 Light, Endoscope Camera with 6.2mm Probe, 8X Zoom 5.0FT Semi-Rigid Cable Inspection Camera for Automotive Engine Pipe HVAC","Mrcartool","FBA","Industrial & Scientific",180372,"N/A","N/A","N/A","N/A","Borescopes",393,228,500,31,31,,6717.42,6717.31,1,5,"MR CARTOOL DIRECT","China",1,0,"N/A","Large Standard-Size",11.81,9.84,2.36,2.2,138.26,381.4,"01/31/2026",3,9,0,31.11
"https://amazon.com/dp/B07PBZZKJD","https://m.media-amazon.com/images/I/71-VLmkuBGL._SX450_.jpg","B07PBZZKJD","Sewer Camera, Can Connect External Monitor, Zoom in and Out, IP68 Waterproof, 12 pcs Adjustable Light, Plumbing Snake Cam with DVR Pipe Video Inspection, for Sewer Line, Drain, Duct, Plumbing(165FT)","anysun","FBA","Industrial & Scientific",183300,"N/A","N/A","N/A","N/A","Borescopes",376,439.99,-30,20,2,-85,8443.1,1045.04,520,4.3,"ToBestGift","China",1,763,"N/A","Large bulky",8.18,17,18.81,18.3,1316.94,3632.94,"04/30/2025",84,8,9,0.04
"https://amazon.com/dp/B07RGV67HY","https://m.media-amazon.com/images/I/71V+CEuJ6EL._SX450_.jpg","B07RGV67HY","Anysun Sewer Camera 100ft Snake Cam with Distance Counter DVR Video Sewer Pipe Inspection Equipment 7 inch LCD Monitor Duct HVAC 1000TVL Endoscope Waterproof IP68 Camera (8GB SD Card)","anysun","FBA","Industrial & Scientific",183302,699996266981,"N/A",0699996266981,"N/A","Borescopes",376,459.99,-13,20,2,-85,8443.1,832.49,520,4.3,"ToBestGift","China",1,763,"N/A","Large bulky",8.2,17.2,19,17.1,1349.18,3721.89,"04/30/2025",81,8,9,0.04
"https://amazon.com/dp/B0B4SDBMPX","https://m.media-amazon.com/images/I/71-VLmkuBGL._SX450_.jpg","B0B4SDBMPX","Sewer Camera 65FT, Can Connect External Monitor, Zoom in and Out, IP68 Waterproof, 12 pcs Adjustable Light, Plumbing Snake Cam with DVR Pipe Video Inspection, for Sewer Line, Drain, Duct, Plumbing","anysun","FBA","Industrial & Scientific",183302,774829649299,"N/A",0774829649299,"N/A","Borescopes",376,329.99,-38,20,5,-85,8443.1,1655.94,520,4.3,"ToBestGift","China",1,763,"N/A","Large bulky",9,14,17,15.85,1078.44,2975,"04/30/2025",44,8,9,0.04
"https://amazon.com/dp/B0FF3619XZ","https://m.media-amazon.com/images/I/71sG08sCPUL._SX450_.jpg","B0FF3619XZ","FDGSAB Sewer Camera with 512Hz Locator, 20/30/50m, 7"" Pipeline Inspection kit with DVR Function, IP68, 12 Adjustable LEDs, A 32GB Card for Sewer Line, Home, Duct Drain Pipe Plumbing (9618FTR-30)","FDGSAB","FBA","Industrial & Scientific",184415,"N/A","N/A","N/A","N/A","Borescopes",397,649.99,16,20,5,,12416.14,3420.96,1,5,"sijifeng","China",1,0,"N/A","Large bulky",15.2,14,10.6,13.9,1135.67,3132.89,"11/30/2025",8,7,3,20.25
"https://amazon.com/dp/B0BHKH6JFR","https://m.media-amazon.com/images/I/713wfsTzFUL._SX450_.jpg","B0BHKH6JFR","Sewer Camera Self Leveling, Anysun Sewer Inspection Camera 200ft with 9'' Monitor and DVR Recorder with 32GB Card, Meter Marker, 12 Adjustable Lights","anysun","FBA","Industrial & Scientific",185209,774829651384,"N/A",0774829651384,"N/A","Borescopes",380,699.99,-15,21,2,43,13256.96,1498.07,30,4.5,"Nedive","China",1,283,"N/A","Large bulky",11.5,17.25,19.7,20,1967.56,5427.76,"03/31/2024",40,7,5,0.69
"https://amazon.com/dp/B0D9WVDZ6F","https://m.media-amazon.com/images/I/71vYXbdWEEL._SX450_.jpg","B0D9WVDZ6F","Triplett BR300CAM-10M-5.5mm Replacement Borescope 5.5mm Camera Probe for BR300, 10M Cable","Triplett","Amazon","Industrial & Scientific",186580,614395005511,"N/A",0614395005511,"N/A","Borescopes",391,100,-52,0,0,-150,"-","-",3,4.4,"Amazon","N/A",1,0,"N/A","Large Standard-Size",6,6,2,0.55,"N/A","N/A","10/31/2025",19,1,0,0
"https://amazon.com/dp/B0DTRS2K13","https://m.media-amazon.com/images/I/71JTkKugFwL._SX450_.jpg","B0DTRS2K13","BoxWave Screen Protector Compatible with Depstech Triple Lens borescope (7 in) - ClearTouch ImpactShield (2-Pack), Impenetrable Screen Protector Flexible Film","BoxWave","FBM","Industrial & Scientific",187693,"N/A","N/A","N/A","N/A","Borescopes",392,31.95,-11,0,0,,"-","-","N/A","N/A","BoxWave Corporation","USA",1,3,"N/A","N/A","N/A","N/A","N/A","N/A","N/A","N/A","01/31/2025",23,9,0,"N/A"
"https://amazon.com/dp/B0DLNRQN9J","https://m.media-amazon.com/images/I/61tgcsP6MfL._SX450_.jpg","B0DLNRQN9J","Gzpce Borescope,Dual Lens Endoscope Camera with Light,Scope Sewer,Snake Inspection Endoscope,Articulating Industrial Endoscope","gzpce","FBA","Industrial & Scientific",188421,"N/A","N/A","N/A","N/A","Borescopes",398,29.99,-47,69,45,236,1726.47,1356.15,13,4.8,"gzpce","China",1,393,"N/A","Large Standard-Size",1.14,5.31,5.47,0.4,16.67,45.99,"12/31/2025",15,6,3,5.27
"https://amazon.com/dp/B0C2Z5XR8S","https://m.media-amazon.com/images/I/61Hphsvh9qL._SX450_.jpg","B0C2Z5XR8S","HBUDS Sewer Camera, Self-Leveling Drain Pipe Cameras with Meter Counter, 12V 4500mAh Battery Plumbing Snake Camera Light, 7'' Color HD Duct Chimney Inspection DVR Recorder 16GB 7D3A,165ft","HBUDS","FBA","Industrial & Scientific",189410,774196180968,"N/A",0774196180968,"N/A","Borescopes",399,499.99,-23,19,3,-76,9476.32,1539.52,223,4.1,"Hanxuan tech","China",1,1281,"N/A","Large bulky",7.75,16.25,17,16.3,1077.9,2973.52,"02/28/2025",42,7,6,0.09
"https://amazon.com/dp/B0DXF586FS","https://m.media-amazon.com/images/I/41I6qrdF+dL._SX450_.jpg","B0DXF586FS","Sewer Camera Head Accessories 6LED Waterproof IP68 for Pipe Drain Endoscope Camera Replacement with Wheel and Protective Cover (0.7inch/17mm)","SYANSPAN","FBA","Industrial & Scientific",192996,"N/A","N/A","N/A","N/A","Borescopes",401,129.99,-19,35,20,15,4585.5,2613.08,51,3.5,"pipe camera","China",1,560,"N/A","Large Standard-Size",2.68,3.98,6.69,0.66,35.87,98.96,"02/28/2025",12,7,2,0.69
"https://amazon.com/dp/B0G48DS4ZD","https://m.media-amazon.com/images/I/61uLV2NPSJL._SX450_.jpg","B0G48DS4ZD","Industrial Endoscope Camera, 2MP HD 1080P Borescope with 8 LED Lights, IP67 Waterproof Hard Wire, 6 Accessories for Car Repair/Pipe Inspection/Home Appliance Maintenance (Type-C Compatible)","Bifrgmy","FBA","Industrial & Scientific",193035,"N/A","N/A","N/A","N/A","Borescopes",391,30.97,52,31,28,,956.8,862.42,15,4.4,"Bifrostore","N/A",1,0,"N/A","Large Standard-Size",4.1,4.7,1.5,1,14.55,40.15,"01/31/2026",3,8,2,2.04
"https://amazon.com/dp/B0CQYR4PX4","https://m.media-amazon.com/images/I/71LCg8UNbZL._SX450_.jpg","B0CQYR4PX4","Anysun Sewer Camera with Locator Set 300ft, Self-Leveling, 7mm Cable with Meter Marking, IP68 Waterproof Plumbing Endoscope Drain Snake Camera with 9'' Color Screen, 12pcs Light, Recorder with 32GB","anysun","FBA","Industrial & Scientific",193596,774049901818,"N/A",0774049901818,"N/A","Borescopes",403,1259.99,-60,11,1,,12028.09,1074.46,8,4.8,"ToBestGift","China",1,0,"N/A","Large bulky",14.5,19.7,21.4,30.15,3077.68,8490.15,"01/31/2026",26,8,10,1.41
"https://amazon.com/dp/B0CQYQY1CC","https://m.media-amazon.com/images/I/71LCg8UNbZL._SX450_.jpg","B0CQYQY1CC","Anysun Sewer Camera with Locator Set, Self-Leveling, 7mm Cable with Depth Marking, IP68 Waterproof Plumbing Endoscope Drain Snake Camera with 9'' Color Screen, 12pcs Light, Recorder with 32GB(250FT)","anysun","FBA","Industrial & Scientific",193597,774049901849,"N/A",0774049901849,"N/A","Borescopes",403,1199.99,-60,11,1,,12028.09,1744.52,8,4.8,"ToBestGift","China",1,0,"N/A","Large bulky",15,19.9,21.3,25.85,3201.1,8830.62,"01/31/2026",26,8,10,1.41
"https://amazon.com/dp/B0FF365GVM","https://m.media-amazon.com/images/I/71sG08sCPUL._SX450_.jpg","B0FF365GVM","FDGSAB Sewer Camera with 512Hz Locator, 20/30/50m, 7"" Pipeline Inspection kit with DVR Function, IP68, 12 Adjustable LEDs, A 32GB Card for Sewer Line, Home, Duct Drain Pipe Plumbing (9618FTR-20)","FDGSAB","FBA","Industrial & Scientific",194821,"N/A","N/A","N/A","N/A","Borescopes",405,599.99,16,20,15,,12416.14,8994.73,1,5,"sijifeng","China",1,0,"N/A","Large bulky",15.2,14,10.6,13.9,1135.67,3132.89,"11/30/2025",8,7,3,20.25
"https://amazon.com/dp/B0F2MLQ4F3","https://m.media-amazon.com/images/I/71wL6DCJetL._SX450_.jpg","B0F2MLQ4F3","Danculpe Sewer Camera Distance Counter, 360° Rotating Dual-Camera Inspection Camera with DVR, 7"" High Definition High Bnightness, Portable Endoscope with Light-12 LED for Duct Pipe, 66FT/20M","Danculpe","FBA","Industrial & Scientific",195381,"N/A","N/A","N/A","N/A","Borescopes",397,429.99,-11,14,4,,6125.54,1684.08,13,4,"hainanshengtianaikejiyouxiangongsi","China",1,0,"N/A","Large bulky",17,8,17,13,1164.03,3211.11,"12/31/2025",11,7,4,1.08
"https://amazon.com/dp/B0D97DVVN3","https://m.media-amazon.com/images/I/71od6mmLLQL._SX450_.jpg","B0D97DVVN3","Teslong Autofocus Articulating Borescope, 5-inch IPS Endoscope Inspection Camera with Two-Way Articulation Auto Focus Probe, Industrial Fiber Optic Scope for Automotive Mechanics (0.24inch-5FT)","Teslong","FBA","Industrial & Scientific",195547,"N/A","N/A","N/A","N/A","Borescopes",406,309.99,-18,12,12,-91,3804.69,3804.44,45,4.2,"Teslong","China",1,196,"N/A","Large Standard-Size",3.5,8.66,16.65,3.22,254.08,700.92,"06/30/2025",19,9,0,0.27
"https://amazon.com/dp/B0DJ7N2XDC","https://m.media-amazon.com/images/I/81G8Ga784KL._SX450_.jpg","B0DJ7N2XDC","Sewer Camera Self-Leveling, 9'' HD Plumbing Pipe Camera with Depth Marking, Zoom, and Adjustable Brightness LED Lights, Ideal for Drain, Pipes, Wells, Machinery, and Industrial Applications.","PeachLeaf","FBA","Industrial & Scientific",196172,717331238940,"N/A",0717331238940,"N/A","Borescopes",397,369.99,-52,30,11,,16248.38,4468.4,1,5,"YoJo-Tech","China",1,0,"N/A","Large bulky",11.97,17.32,19.92,16.38,2079.25,5735.86,"12/31/2025",17,7,13,29.56
"https://amazon.com/dp/B0F64LBZW5","https://m.media-amazon.com/images/I/81Zzff2aTlL._SX450_.jpg","B0F64LBZW5","GearView 210°Articulating Borescope Camera - Inspection Camera 6 Light, Endoscope with 6.2mm IP67 Waterproof Probe, 3X Zoom 2-Way Borescope with Flexible Cablegabg","GearView","FBA","Industrial & Scientific",196784,762849245232,"N/A",0762849245232,"N/A","Borescopes",408,69.99,-8,20,16,-72,1570.99,1129.35,22,3.4,"GearView","China",1,0,"N/A","Large Standard-Size",3.54,11.14,12.64,2.23,250.96,692.31,"09/30/2025",10,7,2,0.89
"https://amazon.com/dp/B0DG92JLVS","https://m.media-amazon.com/images/I/71LCg8UNbZL._SX450_.jpg","B0DG92JLVS","Anysun Sewer Camera with Locator Set, Self-Leveling, 7mm Cable with Depth Marking, IP68 Waterproof Plumbing Endoscope Drain Snake Camera with 9'' Color Screen, 12pcs Light, Recorder with 32GB(150FT)","anysun","FBA","Industrial & Scientific",196907,717331218843,"N/A",0717331218843,"N/A","Borescopes",393,1059.99,-40,11,3,,12028.09,3353.01,8,4.8,"ToBestGift","China",1,0,"N/A","Large bulky",13.6,19.7,21.1,23.7,2846.18,7851.54,"01/31/2026",17,8,10,1.41
"https://amazon.com/dp/B0FN38759M","https://m.media-amazon.com/images/I/71Y4Y6wr-xL._SX450_.jpg","B0FN38759M","Ralcam Two-Way 210° Articulating Borescope, 6.2mm Slim Probe USB-C Flexible Endoscope Inspection Camera Compatible with iPhone & Android for Engine, Pipe & HVAC Inspection","Ralcam","FBA","Industrial & Scientific",197781,"N/A","N/A","N/A","N/A","Borescopes",410,69.99,"N/A",41,41,-52,2906.65,2906.11,60,4.2,"AijR","China",1,0,"N/A","Large Standard-Size",2.83,7.13,12.05,1.17,122.42,337.7,"10/31/2025",6,9,4,0.69
"https://amazon.com/dp/B0D72YBNYG","https://m.media-amazon.com/images/I/71QsCH6WdWL._SX450_.jpg","B0D72YBNYG","Anysun Sewer Camera Self-Leveling, 512Hz Transmitter, Distance Counter, 7MM Diameter Cable, Microphone/DVR, 300FT/91.5M Pipe Inspection Camera, 9'' HD 1080P IPS Screen Plumbing Camera IP68-32GB","anysun","FBA","Industrial & Scientific",200137,"N/A","N/A","N/A","N/A","Borescopes",417,999.99,-33,16,1,-56,12924.87,1060.18,11,4.1,"HZDZ_Shop","Hong Kong",2,339,"N/A","Large bulky",12.5,19,23,29.55,2750.22,7586.81,"06/30/2025",20,7,6,1.45
"https://amazon.com/dp/B0DPG3263Z","https://m.media-amazon.com/images/I/718zf-Q4jTL._SX450_.jpg","B0DPG3263Z","Sewer Camera Self Leveling,9"" HD 16GB Screen JQKJCAM Drain Pipe Plumbing Camera Snake with 12 LED Light Meter Counter for Home Industrial Pipe Inspection (10M/32.8FT)","JQKJCAM","FBA","Industrial & Scientific",201520,"N/A","N/A","N/A","N/A","Borescopes",412,559,73,10,4,-59,5698.21,2016.73,23,3.9,"JJKJ Cam","China",1,212,"N/A","Large bulky",11,11.8,12.2,10.85,797.28,2199.39,"08/31/2024",14,8,7,0.41
"https://amazon.com/dp/B0CY7SW9GD","https://m.media-amazon.com/images/I/71RmAuv--RL._SX450_.jpg","B0CY7SW9GD","Sewer Camera with Locator Self Leveling 100FT,9'' HD 32GB Screen,JQKJCAM Plumbing Drain Camera and Locator,23MM Pipe Camera Snake with 12 Light Meter Counter for Precise Sewer Inspection (30M)","JQKJCAM","FBA","Industrial & Scientific",201520,"N/A","N/A","N/A","N/A","Borescopes",412,699.99,-3,10,1,-59,5698.21,967.73,23,3.9,"JJKJ Cam","China",1,212,"N/A","Large bulky",11.2,15.5,17.9,16.8,1564.51,4315.89,"08/31/2024",23,9,7,0.41
