"https://amazon.com/dp/B0DTPVML4K","https://m.media-amazon.com/images/I/718zf-Q4jTL._SX450_.jpg","B0DTPVML4K","JQKJCAM Sewer Camera Self Leveling 100FT,w/ 9"" HD 16GB Monitor,Waterproof 23MM Plumbing Drain Camera Snake with 12 Light Meter Counter for Pipes Inspection (30M)","JQKJCAM","FBA","Industrial & Scientific",201526,"N/A","N/A","N/A","N/A","Borescopes",412,532.94,-17,10,3,-59,5698.21,1905.76,23,3.9,"JJKJ Cam","China",1,212,"N/A","Large bulky",10.75,11.75,12,12.15,763.14,2105.21,"08/31/2024",13,8,7,0.41
"https://amazon.com/dp/B0CY83QTD4","https://m.media-amazon.com/images/I/71RmAuv--RL._SX450_.jpg","B0CY83QTD4","Self Leveling Sewer Camera with Locator 150FT,9"" 16GB HD Screen,JQKJCAM Drain Pipe Plumbing Sewer Scope Camera Snake with 12 Light Meter Counter for Precise Home Industrial Pipe Inspection (50M/165FT)","JQKJCAM","FBA","Industrial & Scientific",201530,"N/A","N/A","N/A","N/A","Borescopes",412,735,-29,10,1,-59,5698.21,807.49,23,3.9,"JJKJ Cam","China",1,212,"N/A","Large bulky",11.14,15.98,17.87,19.09,1601.63,4418.29,"08/31/2024",23,9,7,0.41
"https://amazon.com/dp/B0D2VSZZXD","https://m.media-amazon.com/images/I/61FCckyWYdL._SX450_.jpg","B0D2VSZZXD","Endoscope Camera for iPhone 15/14/13/12/11 Pro Max & iPad, USB-C Direct Plug Borescope Camera Compatible with Samsung Galaxy S24/S23/S22/S21 Ultra, 33FT/10M Long Flexible Soft Inspection Snake Cam","LUKZATEN","FBA","Industrial & Scientific",201620,"N/A","N/A","N/A","N/A","Borescopes",421,24.95,-19,5,5,-69,121.67,121.54,15,3.6,"Lukzaten US","China",1,220,"N/A","Large Standard-Size",2.45,6.1,6.1,0.5,45.9,126.62,"05/31/2025",22,9,0,0.35
"https://amazon.com/dp/B0D2ZPKZ3G","https://m.media-amazon.com/images/I/51qnZGdl23L._SX450_.jpg","B0D2ZPKZ3G","Anysun Black Camera Cover Protective Cover for 22mm & 23mm Sewer Camera Pipe Inspection Camera, 2pcs","anysun","FBA","Industrial & Scientific",201665,774049595765,"N/A",0774049595765,"N/A","Borescopes",413,23.99,-15,7,7,-42,157.49,157.34,1,5,"Yongchangsheng tech","China",1,50,"N/A","Small Standard-Size",0.59,0.59,0.39,0.4,0.07,0.19,"06/30/2024",22,2,0,6.56
"https://amazon.com/dp/B0F2LLZDKS","https://m.media-amazon.com/images/I/61dNhLmMEPL._SX450_.jpg","B0F2LLZDKS","Two-Way Articulating Borescope with Light for iPhone and Andriod Users, Inspection Camera Industrial Endoscope with 8.5mm Articulated Probe Waterproof Lens, 3.3ft Semi-Rigid Gooseneck Tube","zealtron","FBA","Industrial & Scientific",203201,"N/A","N/A","N/A","N/A","Borescopes",409,49.99,-20,22,22,-29,1074.29,1074.13,230,3.8,"Zealtron","China",1,0,"N/A","Large Standard-Size",2.28,9.72,16.97,1.41,189.7,523.32,"05/31/2025",11,9,0,0.09
"https://amazon.com/dp/B0D2Z14P81","https://m.media-amazon.com/images/I/71mdLVIBjIL._SX450_.jpg","B0D2Z14P81","JINMEI Hard EVA Carrying Case Compatible with MugEasy/Daxiongmao/DEPSTECH Borescope Inspection Camera,Lens Industrial Endoscope storage case (5M-10M line can also be accommodated)","JINMEI","FBA","Industrial & Scientific",203272,"N/A","N/A","N/A","N/A","Borescopes",416,19.99,-14,28,28,111,552.07,551.64,30,4.4,"JINMEI STORE","China",1,269,"N/A","Large Standard-Size",3.5,7.83,8.31,0.44,114.66,316.3,"11/30/2024",22,8,0,0.92
"https://amazon.com/dp/B0F26K9HW6","https://m.media-amazon.com/images/I/71XOJ2dF21L._SX450_.jpg","B0F26K9HW6","Endoscope Camera with Light, Single-Lens 1920P HD Borescope with 8 Adjustable LED Lights, Endoscopic Visualizer for iPhone & Android, 16.4ft Semi-Rigid Boroscope Inspection Tool","medetayi","FBA","Industrial & Scientific",204339,"N/A","N/A","N/A","N/A","Borescopes",405,14.99,-30,29,29,-95,440.03,439.63,58,4.3,"Xunshiwenhua Shop","China",2,0,"N/A","Large Standard-Size",1.69,5.16,5.35,0.42,23.49,64.8,"07/31/2025",11,7,2,0.51
"https://amazon.com/dp/B0FLQ9SYGS","https://m.media-amazon.com/images/I/71nE2g929SL._SX450_.jpg","B0FLQ9SYGS","Sewer Camera Self Leveling, Drain Camera 100ft with Meter Counter, 9"" HD 1080p Plumbing Cameras with 12 LED Lights, Waterproof IP68 & 32GB DVR, Industrial Endoscope for Duct Sewer Line Pipe Inspection","OnBeam","FBA","Industrial & Scientific",204699,769016776766,"N/A",0769016776766,"N/A","Borescopes",425,499.99,158,9,5,-23,5663.51,2633.49,3,5,"weigangus","China",1,0,"N/A","Large bulky",12.12,13.25,14.01,14.3,1132.74,3124.81,"10/31/2025",6,7,7,2.99
"https://amazon.com/dp/B0D8119TJ5","https://m.media-amazon.com/images/I/71DZJ1LECYL._SX450_.jpg","B0D8119TJ5","Sewer Camera with Locator, 9"" IPS 1080P Drain Camera with Self Leveling, Distance Counter, DVR Function, 7mm Cable, 100 ft Sewer Scope with 512Hz Sonde, IP68 Waterproof, 32GB Card for Pipe Plumbing","OnBeam","FBA","Industrial & Scientific",204875,762736109388,"N/A",0762736109388,"N/A","Borescopes",425,1299.99,-6,9,1,-23,5663.51,1913.84,3,5,"weigangus","China",1,0,"N/A","Large bulky",15.5,15.5,19,21.45,2298.22,6339.93,"10/31/2025",20,7,7,2.99
"https://amazon.com/dp/B0G19BQFW7","https://m.media-amazon.com/images/I/71uxoAcIFkL._SX450_.jpg","B0G19BQFW7","Anysun All in 1 Sewer Camera with Locator & Wheels & Pull Handle, 7MM Cable, Self Leveling, Distance Counter, 32GB Card, 9'' HD Monitor, Pipe Drain Inspection Camera IP68 Borescope (200FT/60M)","anysun","FBA","Industrial & Scientific",205736,717639146169,"N/A",0717639146169,"N/A","Borescopes",409,2099.99,"N/A",10,1,,18863.67,2774.68,1,5,"Yongchangsheng tech","China",1,0,"N/A","Large bulky",20,20,16,28,3222.22,8888.89,"12/31/2025",3,8,3,9.59
"https://amazon.com/dp/B0FY4YCYG7","https://m.media-amazon.com/images/I/71IYOR5S8vL._SX450_.jpg","B0FY4YCYG7","Anysun 9"" Replacement Screen for Sewer Camera Mode 9DX7, High-Resolution LCD Screen, Compatible with Anysun HBUDS Pipe Inspection Cameras System-CR110-9DX7","anysun","FBA","Industrial & Scientific",206770,717839120334,"N/A",0717839120334,"N/A","Borescopes",416,129.99,-19,20,10,59,2676.16,1274.28,"N/A","N/A","HZDZ_Shop","Hong Kong",1,0,"N/A","Large Standard-Size",8,5,2,10,40.28,111.11,"11/30/2025",4,2,2,"N/A"
"https://amazon.com/dp/B0F1Y5TN2Q","https://m.media-amazon.com/images/I/71mn7lAcF0L._SX450_.jpg","B0F1Y5TN2Q","Anysun 9"" Replacement Screen for Sewer Camera Mode 9DX23, High-Resolution LCD Screen, Compatible with Anysun HBUDS Pipe Inspection Cameras System-CR110-9DX23","anysun","FBM","Industrial & Scientific",206779,717382442068,"N/A",0717382442068,"N/A","Borescopes",416,129.99,-7,20,11,59,2676.16,1429.5,"N/A","N/A","HZDZ_Shop","Hong Kong",1,0,"N/A","N/A","N/A","N/A","N/A","N/A","N/A","N/A","11/30/2025",11,2,2,"N/A"
"https://amazon.com/dp/B0CWN8HV4Q","https://m.media-amazon.com/images/I/71BjUWFhgBL._SX450_.jpg","B0CWN8HV4Q","Anysun Self-Leveling Sewer Inspection Camera with 512Hz Transmitter, Distance Counter, 7MM Thicker Cable, 330FT/100M Pipe Cam, 10"" IPS 1080P Screen and DVR/Audio Recording - 16GB","anysun","FBA","Industrial & Scientific",207087,"N/A","N/A","N/A","N/A","Borescopes",417,1699.99,-21,7,1,,7231.15,965.74,24,4.1,"HZDZ_Shop","Hong Kong",1,71,"N/A","Large bulky",11.7,22.1,25.9,41,3371.73,9301.34,"11/30/2024",25,7,4,0.28
"https://amazon.com/dp/B07KM4J3DL","https://m.media-amazon.com/images/I/61imEYJCDgL._SX450_.jpg","B07KM4J3DL","BlueFire Upgraded Super Long 1080P Semi-Rigid Wireless Endoscope, 2 MP HD WiFi Borescope Inspection Camera, Zoomable Focus 1800mA Battery Snake Camera for Android & iOS Smartphone Tablet (15M)","BlueFire","FBA","Industrial & Scientific",209168,"N/A","N/A","N/A","N/A","Borescopes",412,45.99,-7,4,4,-83,203.69,203.58,203,3.8,"BlueFire Tech","China",1,111,-53,"Large Standard-Size",2.44,5.87,6.5,1.63,46.87,129.3,"01/31/2024",87,6,0,0.02
"https://amazon.com/dp/B0CP3Y7Y2B","https://m.media-amazon.com/images/I/71BjUWFhgBL._SX450_.jpg","B0CP3Y7Y2B","Anysun Self-Leveling Sewer Camera with 512Hz Transmitter, Distance Counter, 7MM Thicker Cable, 165FT/50M Pipe Camera, 10'' IPS 1080P Screen Sewer Inspection Camera with DVR/Audio Recording-16GB","anysun","FBA","Industrial & Scientific",209170,"N/A","N/A","N/A","N/A","Borescopes",421,1299.99,-37,7,2,,7231.15,2539.24,24,4.1,"HZDZ_Shop","Hong Kong",1,71,"N/A","Large bulky",11.8,22.1,26,35.3,3413.68,9417.06,"11/30/2024",26,7,4,0.28
"https://amazon.com/dp/B0CR4CKCQ3","https://m.media-amazon.com/images/I/719l1AuHPFL._SX450_.jpg","B0CR4CKCQ3","Dual Lens Endoscope Camera with Light，16.5FT Anhendeler Borescope Inspection Camera, IP67 Waterproof Borescope, 4.3"" IPS Screen, for Automotive, Pipe, Wall, Gadgets for Men","Anhendeler","FBA","Industrial & Scientific",209193,"N/A","N/A","N/A","N/A","Borescopes",413,29.99,-12,44,44,-26,1259.04,1258.46,196,4.4,"Anhendeler","China",2,733,"N/A","Large Standard-Size",2.64,5.83,9.92,1.04,76.87,212.06,"11/30/2024",26,7,3,0.22
"https://amazon.com/dp/B0FNJXTJTN","https://m.media-amazon.com/images/I/61xOUOzTTwL._SX450_.jpg","B0FNJXTJTN","Borescope, Endoscope 3-in-1 USB HD Inspection Camera with 16.5FT Semi-Rigid Snake Cable, 8mm Waterproof IP67 Industrial Endoscope for Android, iOS and PC","HOERCAAL","FBA","Industrial & Scientific",209237,"N/A","N/A","N/A","N/A","Borescopes",414,27.98,-68,12,12,114,171.7,171.49,8,3.2,"Mei Wang Mei","China",1,0,"N/A","Large Standard-Size",1.1,6.5,6.57,0.49,23.65,65.24,"12/31/2025",6,6,0,1.49
"https://amazon.com/dp/B0FQJP4QXD","https://m.media-amazon.com/images/I/71uxoAcIFkL._SX450_.jpg","B0FQJP4QXD","Anysun All in 1 Sewer Camera with Locator & Wheels & Pull Handle, 7MM Cable, Self Leveling, Distance Counter, 32GB Card, 9'' HD Monitor, Pipe Drain Inspection Camera IP68 Borescope (300FT/91.5M)","anysun","FBA","Industrial & Scientific",209363,717931041766,"N/A",0717931041766,"N/A","Borescopes",423,2099.99,-15,10,2,,18863.67,4747.48,1,5,"Yongchangsheng tech","China",1,0,"N/A","Extra-large 50+ to 70 lb",18.25,21.25,23.5,47.7,4588.44,12657.77,"12/31/2025",5,8,3,9.59
"https://amazon.com/dp/B098XFG46Y","https://m.media-amazon.com/images/I/71WuOq3YeQL._SX450_.jpg","B098XFG46Y","VEVOR Sewer Camera, 164ft/50M 4.3"" Pipe Drain Inspection Camera with DVR Function & Snake Cable, Waterproof IP68 Borescope w/LED Lights, Industrial Endoscope for Home Wall Duct Drain Pipe Plumbing","VEVOR","FBM","Industrial & Scientific",209370,768558017610,00768558017610,0768558017610,"N/A","Borescopes",432,285.99,47,17,17,-83,4625.29,4624.97,107,3.9,"Suplander","China",1,723,-50,"Large Standard-Size",6.42,12.13,13.86,9.19,"N/A","N/A","08/31/2024",54,9,1,0.16
"https://amazon.com/dp/B09GCMF723","https://m.media-amazon.com/images/I/71zOR5g06ML._SX450_.jpg","B09GCMF723","Triplett BR750 High Definition Articulating Videoscope with Waterproof 6mm Camera, Joystick Controller, and 5"" Color TFT LCD Display","Triplett","FBM","Industrial & Scientific",209516,614395003777,"N/A",0614395003777,"N/A","Borescopes",422,1450,-31,15,0,56,2456.66,"-",5,4.2,"ZRM Industries","USA",2,204,"N/A","Large bulky",17.5,6.9,15.75,12,"N/A","N/A","09/30/2025",51,3,17,3.02
"https://amazon.com/dp/B0B47ZH5C1","https://m.media-amazon.com/images/I/71JOc3rUQyL._SX450_.jpg","B0B47ZH5C1","Triplett BR260CAM-2M Replacement Camera for BR260 Videoscope with 2M Cable","Triplett","Amazon","Industrial & Scientific",209516,614395004385,"N/A",0614395004385,"N/A","Borescopes",422,50,8,15,2,56,2456.66,92.93,5,4.2,"Amazon","N/A",2,204,"N/A","Large Standard-Size",6,6,2,0.57,"N/A","N/A","09/30/2025",44,1,17,3.02
"https://amazon.com/dp/B0C2ZBWZSK","https://m.media-amazon.com/images/I/61Hphsvh9qL._SX450_.jpg","B0C2ZBWZSK","HBUDS Sewer Camera Self Leveling, 65ft Drain Pipe Inspection Camera with 7"" Color HD Display, 12V 4500mAh Battery, DVR 16GB","HBUDS","FBA","Industrial & Scientific",209704,774196179764,"N/A",0774196179764,"N/A","Borescopes",415,379.99,12,19,6,-76,9476.32,2295.94,223,4.1,"Hanxuan tech","China",1,1281,"N/A","Large bulky",8.3,14,16.1,13.1,941.91,2598.36,"02/28/2025",42,7,6,0.09
"https://amazon.com/dp/B07RRNCV3G","https://m.media-amazon.com/images/I/61mpDGKmelL._SX450_.jpg","B07RRNCV3G","HBUDS Self Leveling Sewer Inspection Camera with Locator 100ft, 9"" Color Monitor Drain Pipe Cameras with 512Hz Sonde and Receiver, 12V 4500mAh Rechargeable Battery Plumbing Camera Snake with DVR 16GB","HBUDS","FBA","Industrial & Scientific",209704,699938561143,"N/A",0699938561143,"N/A","Borescopes",415,899.99,-18,19,2,-76,9476.32,1410.41,223,4.1,"Hanxuan tech","China",1,1281,"N/A","Large bulky",8.75,16.5,21.5,20.5,1562.81,4311.2,"02/28/2025",84,8,6,0.09
"https://amazon.com/dp/B07SR2LHBT","https://m.media-amazon.com/images/I/71DAtpJx1lL._SX450_.jpg","B07SR2LHBT","HBUDS Pipe Camera, 50M/165ft Cable, 7 Inch LCD, Black, Wired, IP68 Waterproof","HBUDS","FBM","Industrial & Scientific",209712,699930210209,"N/A",0699930210209,"N/A","Borescopes",415,499.99,-49,19,3,-76,9476.32,1406.46,223,4.1,"Hanxuan tech","China",1,1281,"N/A","Large bulky",8.6,17.2,18.8,17.9,"N/A","N/A","02/28/2025",80,7,6,0.09
"https://amazon.com/dp/B09LYXMSPK","https://m.media-amazon.com/images/I/71StDV4rO9L._SX450_.jpg","B09LYXMSPK","Autel MaxiVideo MV105 Inspection Camera, USB Digital Waterproof Borescope, 39.37 '' Flexible Cable Industrial Endoscope, Compatible with PC MK808/MS906S/MK906/MS908/MK908/MS909/MS919/Ultra/UltraLite","Autel","FBA","Industrial & Scientific",210122,792499541590,"N/A",0792499541590,"N/A","Borescopes",417,44.99,"N/A",2,2,,105.11,105.06,10,4.5,"Autel Tools","China",1,5,-90,"Large Standard-Size",2.56,5.2,9.21,0.86,61.73,170.28,"02/29/2024",51,9,0,0.23
"https://amazon.com/dp/B0DJSSV6X9","https://m.media-amazon.com/images/I/61d8+8-DywL._SX450_.jpg","B0DJSSV6X9","Dearsee ZX2-D1 Two-Way Articulating Borescope with Light, 0.25in Industrial Endoscope Inspection Camera, 5-inch IPS Articulated Snake Camera, 8X Zoom Video Inspection Scope - 10FT","Dearsee","FBA","Industrial & Scientific",210708,729162039696,"N/A",0729162039696,"N/A","Borescopes",421,79.95,-33,5,5,-68,474.56,474.41,7,4.2,"Dearsee","China",1,59,"N/A","Large Standard-Size",2.99,10.24,16.26,1.87,250.65,691.45,"01/31/2025",16,7,0,0.69
"https://amazon.com/dp/B0BTDDX3LD","https://m.media-amazon.com/images/I/71PDwWogfXL._SX450_.jpg","B0BTDDX3LD","Anysun Self-Leveling Sewer Camera with Locator, Drain Camera with 9'' IPS Monitor and 165ft Cable, IP68 Waterproof Pipe Inspection Camera with DVR Recording Funcation and 16GB Memory Card","anysun","FBA","Industrial & Scientific",210718,"N/A","N/A","N/A","N/A","Borescopes",418,999.99,-32,5,1,,4497.69,1089.9,20,4.3,"HZDZ_Shop","Hong Kong",1,0,"N/A","Large bulky",11.75,15.25,17.25,16.4,1556.22,4293.03,"12/31/2025",37,7,2,0.24
"https://amazon.com/dp/B09B716SK3","https://m.media-amazon.com/images/I/51fNVCbvmrL._SX450_.jpg","B09B716SK3","Raguso USB Endoscope 3 in 1 Borescope USB/Type-C Inspection Snake Camera with 6 LED Lights 3.9mm Lens for Laptop (5 Meter Cork)","Raguso","FBA","Industrial & Scientific",210844,"N/A","N/A","N/A","N/A","Borescopes",424,32.89,"N/A",0,0,,"-","-",1,4,"Chihzhen","China",2,10,"N/A","Large Standard-Size",6.3,6.3,1.57,6,31.46,86.79,"03/31/2025",55,9,0,0
"https://amazon.com/dp/B0DG8V6BSC","https://m.media-amazon.com/images/I/81JgT5MWQvL._SX450_.jpg","B0DG8V6BSC","Sewer Camera 100FT with 512HZ Sonde, Anysun 9"" HD Screen Pipe Drain Inspection with 12pcs Light, DVR Recorder with 32GB Card, IP68 Waterproof Plumbing Cam, 7mm Cable with Depth Marker","anysun","FBM","Industrial & Scientific",211514,717331218737,"N/A",0717331218737,"N/A","Borescopes",425,599.99,-14,1,0,-118,350.59,"-",22,3.4,"ToBestGift","China",1,0,"N/A","Large bulky",19,16,10,9,"N/A","N/A","02/28/2025",36,7,5,0.03
"https://amazon.com/dp/B0G6XZS5YP","https://m.media-amazon.com/images/I/817aNJJSKiL._SX450_.jpg","B0G6XZS5YP","Dual-Lens Endoscope Camera with Light, 1080P Borescope Inspection Camera, 4.3"" IPS Screen, 16.5FT Semi-Rigid Cable, 8 LEDs, IP67 Waterproof Inspection Tool for Automotive & Plumbing– Gadgets for Men","EASTBEAR","FBA","Industrial & Scientific",212191,726870777780,"N/A",0726870777780,"N/A","Borescopes",424,49.99,"N/A",0,0,,"-","-",1,4,"EASTBEAR Store","N/A",1,0,"N/A","Large Standard-Size",2.8,5.55,7.28,1,56.9,156.97,"-",2,8,2,"N/A"
"https://amazon.com/dp/B0G6XZF1YN","https://m.media-amazon.com/images/I/81+RzBCFitL._SX450_.jpg","B0G6XZF1YN","Single-Lens Endoscope Camera with Light, 1080P Borescope Inspection Camera, 4.3"" IPS Screen, 16.5FT Semi-Rigid Cable, 8 LEDs, IP67 Waterproof Inspection Tool for Automotive & Plumbing– Gadgets for Men","EASTBEAR","FBA","Industrial & Scientific",212399,726870777766,"N/A",0726870777766,"N/A","Borescopes",425,39.99,"N/A",0,0,,"-","-","N/A","N/A","EASTBEAR Store","N/A",1,0,"N/A","Large Standard-Size",3.11,5.94,7.2,1.01,67.07,185.02,"-",2,8,2,"N/A"
"https://amazon.com/dp/B0DK91NK8Q","https://m.media-amazon.com/images/I/51LFxZwALEL._SX450_.jpg","B0DK91NK8Q","4.5 Inch Dual-Lens Industrial Endoscope, 1080P Photo Video Borescope Inspection Camera, 5.5mm IP67 Waterproof Snake Camera, 8+1 LED Lights, 16.5FT Cable, 32GB","AukonVee","FBA","Industrial & Scientific",212401,"N/A","N/A","N/A","N/A","Borescopes",434,49.99,-4,18,5,,634.93,190.56,47,4.4,"Shenzhen Qiuchen Electronics Co., LTD","China",1,0,"N/A","Large Standard-Size",2.91,5.55,8.19,1.06,66.6,183.71,"12/31/2025",16,8,3,0.39
"https://amazon.com/dp/B0BWVD4WJP","https://m.media-amazon.com/images/I/51cKvt29OeL._SX450_.jpg","B0BWVD4WJP","3 in 1 High Definition Endoscope Pipe Inspection Borescope TypeC USB Mobile Phone 3.9mm for Borescopes and Fiberscopes (1 Meter Flexible Cord)","Walfront","FBA","Industrial & Scientific",213770,"N/A","N/A","N/A","N/A","Borescopes",425,18.06,-17,5,5,-62,82.72,82.56,13,3.1,"Luoyuu","China",2,0,"N/A","Large Standard-Size",1.42,4.76,4.92,0.13,16.73,46.15,"10/31/2025",36,9,0,0.35
"https://amazon.com/dp/B089Q4DBPT","https://m.media-amazon.com/images/I/51yfhnkG8LL._SX450_.jpg","B089Q4DBPT","Autel MaxiVideo MV108S Inspection Camera, Waterproof Endoscope Video Scope for Autel MX900 / TS900 / MK808 S / MK906 / MS909 / Ultra","Autel","FBA","Industrial & Scientific",214125,791319285553,"N/A",0791319285553,"N/A","Borescopes",426,49,1,3,3,-79,133.75,133.67,57,4.6,"Autel Tools","China",1,39,5,"Large Standard-Size",2.05,6.61,12.56,0.86,85.69,236.38,"01/31/2025",68,9,0,0.05
"https://amazon.com/dp/B087RC1Z7P","https://m.media-amazon.com/images/I/71ad-eDVD3L._SX450_.jpg","B087RC1Z7P","Sewer Camera Pipe Inspection Anysun Waterproof IP68 Plumbing Camera with DVR Recorder (Red-30M)","anysun","FBA","Industrial & Scientific",214460,192408495844,"N/A",0192408495844,"N/A","Borescopes",919,500,15,4,2,-81,3939.55,1032.54,169,3.9,"Yongchangsheng tech","China",1,140,-45,"Large bulky",8,17.1,18.75,16.8,1291.41,3562.5,"03/31/2024",70,8,8,0.02
"https://amazon.com/dp/B0DSZR774M","https://m.media-amazon.com/images/I/71PDwWogfXL._SX450_.jpg","B0DSZR774M","Anysun Self-Leveling Sewer Camera with Locator, Drain Camera 100ft Cable 9'' IPS Monitor, IP68 Waterproof Pipe Inspection Camera with DVR Recording Funcation and 16GB Memory Card","anysun","FBA","Industrial & Scientific",214791,717504242637,"N/A",0717504242637,"N/A","Borescopes",429,899.99,-14,5,4,,4497.69,3407.57,20,4.3,"HZDZ_Shop","Hong Kong",1,0,"N/A","Large bulky",11.5,15.5,16.5,14.75,1480.77,4084.9,"12/31/2025",13,7,2,0.24
"https://amazon.com/dp/B0CWLW1VPT","https://m.media-amazon.com/images/I/61I155JhY0L._SX450_.jpg","B0CWLW1VPT","Endoscope, Borescope, Borescope Endoscope Camera 3 in 1 for Android TypeC Mobile Phone 3.9mm Lens Endoscope Camera High Definition Endoscope (3.5 Meters Soft Cord)","Naroote","FBA","Industrial & Scientific",217582,"N/A","N/A","N/A","N/A","Borescopes",436,18.03,-27,1,1,350,20.76,14.74,1,1,"Dushiw","China",2,26,"N/A","Large Standard-Size",4.72,4.72,1.57,0.26,17.7,48.82,"01/31/2025",24,9,2,1.07
"https://amazon.com/dp/B0D9GC35PW","https://m.media-amazon.com/images/I/81M1qpgy1zL._SX450_.jpg","B0D9GC35PW","Turn Raise Original Endoscope Camera Carrying Case, Wireless Borescope Storage Bag for WiFi & USB Scope Camera, Large-Capacity Hardshell Organizer for 5"" Screen Inspection Camera Cable Less Than 15m","TURN RAISE","FBA","Industrial & Scientific",217677,"N/A","N/A","N/A","N/A","Borescopes",431,29.99,15,5,5,-55,138.82,138.61,8,5,"TurnRaiseDirect","China",1,137,"N/A","Large Standard-Size",4.06,7.64,8.98,0.79,140.24,386.87,"11/30/2025",19,7,0,0.58
"https://amazon.com/dp/B0DWDXPYQ1","https://m.media-amazon.com/images/I/71prh2CfSNL._SX450_.jpg","B0DWDXPYQ1","Sewer Camera w/DVR Function, 4.3"" HD 1080P Screen Pipeline Inspection Camera, IP68 Waterproof Pipe Plumbing Snake Cam with 32GB Card, for Sewer Line, Home, Duct Drain Pipe Plumbing (50M/165FT)","Liwogi","FBA","Industrial & Scientific",218481,"N/A","N/A","N/A","N/A","Borescopes",438,289.99,-9,18,5,843,4595.78,1371.77,2,5,"Hot car parts","China",1,0,"N/A","Large Standard-Size",13.7,6.7,16,9.15,739.42,2039.78,"07/31/2025",12,9,2,8.99
"https://amazon.com/dp/B0CNWGW5JH","https://m.media-amazon.com/images/I/615LqqlLiHL._SX450_.jpg","B0CNWGW5JH","Perfect Part Endoscope - 3-in-1 Micro USB, Type C & USB Borescope Inspection Camera for Android Smartphones, Tablets & Laptops, HD Waterproof Camera with 6 LEDs","THE PERFECT PART","FBM","Industrial & Scientific",218814,647168703192,"N/A",0647168703192,"N/A","Borescopes",440,9.44,-14,4,2,1000,37.13,20.62,15,3,"The Perfect Part Inc.","USA",1,73,-47,"N/A","N/A","N/A","N/A","N/A","N/A","N/A","02/28/2025",27,8,3,0.24
"https://amazon.com/dp/B0CW67ZYP1","https://m.media-amazon.com/images/I/71Y+KgLtvmL._SX450_.jpg","B0CW67ZYP1","Daxiongmao Borescope Camera with Lights, Industrial Endoscope Inspection Camera with Articulated Probe, Flexible Mechanic Fiber Optic Snake Scope Cam for Wall Automotive Engine Inspect-5.0 FT","Daxiongmao","FBA","Industrial & Scientific",219378,739944333614,"N/A",0739944333614,"N/A","Borescopes",439,109.99,"N/A",9,9,-76,949.89,949.71,91,4.4,"leersi_jet","China",1,617,"N/A","Large Standard-Size",3.31,9.41,16.93,3,265.49,732.39,"02/28/2025",23,8,0,0.1
"https://amazon.com/dp/B0C762VM9D","https://m.media-amazon.com/images/I/61hoaPC+0qL._SX450_.jpg","B0C762VM9D","Vividia CX-60150i Joystick Articulating 1280x720 Inspection Camera Borescope with 6mm (0.236"") Diameter for Apple iOS Phones Tablets and for Android Devices (Semi-Rigid Long Probe)","VIVIDIA","-","Industrial & Scientific",220614,"N/A","N/A","N/A","N/A","Borescopes",444,899.98,-19,3,0,-30,1975.62,"-",1,5,,"N/A",1,34,143,"N/A","N/A","N/A","N/A","N/A","N/A","N/A","09/30/2025",32,3,3,3.08
"https://amazon.com/dp/B0F2DXHV3Q","https://m.media-amazon.com/images/I/61Sq2+01KsL._SX450_.jpg","B0F2DXHV3Q","Orange A-600 Handheld 400x Fiber Optic end face Detector Magnifier Fiber Optic Microscope 5-inch high-Definition Touch Screen for SC/FC/ST/LC UPC Male/Female Head Interface Fiber Inspector (A-600U)","SAIVXIAN","FBA","Industrial & Scientific",220653,"N/A","N/A","N/A","N/A","Borescopes",437,478,-16,4,4,750,2040.84,2040.71,1,2,"cheukcen","China",1,0,"N/A","Large Standard-Size",10.43,3.39,5.98,1.72,106.45,293.67,"08/31/2025",11,9,0,4.25
"https://amazon.com/dp/B08P4D75VT","https://m.media-amazon.com/images/I/51SHGMJvSFL._SX450_.jpg","B08P4D75VT","Oumefar USB Endoscope 3 in 1 Borescope 5.5mm Lens 6LED 5M Megapixels HD Endoscope Cable IP67 Inspection Camera for Plumbing Wall Vent Sewer Inspections","Oumefar","FBA","Industrial & Scientific",221067,"N/A","N/A",9588081357653,"N/A","Borescopes",439,11.29,-19,4,4,,53.79,53.61,3,2.9,"Lanxued","China",2,9,350,"Large Standard-Size",1.3,4.88,5,0.32,15.97,44.05,"12/31/2025",63,8,0,1.45
"https://amazon.com/dp/B0C7631F4R","https://m.media-amazon.com/images/I/61wegKyS0WL._SX450_.jpg","B0C7631F4R","Vividia CX-6010i Joystick Articulating 1280x720 Inspection Camera Borescope with 6mm (0.236"") Diameter for Apple iOS Phones Tablets and Android Devices (Flexible Probe)","VIVIDIA","FBM","Industrial & Scientific",222264,"N/A","N/A","N/A","N/A","Borescopes",448,599.98,-23,3,2,-30,1975.62,1059.86,1,5,"Oasis Scientific Inc.","USA",1,34,143,"N/A","N/A","N/A","N/A","N/A","N/A","N/A","09/30/2025",32,9,3,3.08
"https://amazon.com/dp/B0DQY8P187","https://m.media-amazon.com/images/I/71iWD1+iRFL._SX450_.jpg","B0DQY8P187","Endoscope Camera with Light, 4.3"" Inspection Camera, 1920P HD Borescope Camera with 8 LED Lights, IP67 Waterproof Snake Sewer Camera, 32.8FT Semi-Rigid Cord Drain Pipe Camera Cool Gadgets Tool","Jebousike","FBA","Industrial & Scientific",223465,"N/A","N/A","N/A","N/A","Borescopes",436,52.99,-22,0,0,-123,"-","-","N/A","N/A","Jebousike","China",1,71,"N/A","Large Standard-Size",1.38,3.39,4.06,0.26,9.53,26.28,"05/31/2025",14,7,6,"N/A"
"https://amazon.com/dp/B0DQY9BM4H","https://m.media-amazon.com/images/I/71LRZvpCcHL._SX450_.jpg","B0DQY9BM4H","Dual Lens Borescope, Endoscope Camera with Light, IP67 Waterproof Endoscope, 1080P HD Inspection Camera, Borescope Camera with Light, Snake Camera, 32.8ft Endoscope Camera, Gadgets for Men (4.3”)","Jebousike","FBA","Industrial & Scientific",223470,"N/A","N/A","N/A","N/A","Borescopes",436,53.99,-14,0,0,-123,"-","-","N/A","N/A","Jebousike","China",1,71,"N/A","Large Standard-Size",3.11,5.35,7.83,1.44,65.69,181.21,"05/31/2025",14,7,6,"N/A"
"https://amazon.com/dp/B0DQYBZDX5","https://m.media-amazon.com/images/I/71rfZw4NMRL._SX450_.jpg","B0DQYBZDX5","Dual Lens Industrial Endoscope, 1080P Digital Borescope Inspection Camera, 7.9mm IP67 Waterproof Camera, Sewer Camera with 4.3"" LCD Screen, 8 LED Lights, 16.5FT Semi-Rigid Cable","Jebousike","FBA","Industrial & Scientific",223470,"N/A","N/A","N/A","N/A","Borescopes",436,46.99,-23,0,0,-123,"-","-",16,4.6,"Jebousike","China",1,71,"N/A","Large Standard-Size",8.07,5.3,3.15,1.1,67.83,187.12,"05/31/2025",14,7,6,0.03
"https://amazon.com/dp/B0DQY8XVZT","https://m.media-amazon.com/images/I/71buxscaTkL._SX450_.jpg","B0DQY8XVZT","Industrial Endoscope Inspection Camera, 4.3"" IPS Borescope Sewer Camera with IP67 Waterproof Snake Camera with 8 LED Lights, 1080P Digital Borescope Inspection Camera 65.6FT Semi-Rigid Cable","Jebousike","FBA","Industrial & Scientific",223470,"N/A","N/A","N/A","N/A","Borescopes",436,55.99,-13,0,0,-123,"-","-","N/A","N/A","Jebousike","China",1,71,"N/A","Large Standard-Size",3.86,8.19,11.14,2.46,177.24,488.92,"05/31/2025",14,7,6,"N/A"
