"https://amazon.com/dp/B0DQYBRYMF","https://m.media-amazon.com/images/I/71B-79RH4bL._SX450_.jpg","B0DQYBRYMF","Endoscope Camera with Light, Jebousike 1080P HD Borescope Inspection Camera with 4.3"" IPS Screen, 98.4FT Flexible Sewer Camera, IP67 Waterproof Plumbing Snake Camera, Cool Gadgets for Men, Women","Jebousike","FBA","Industrial & Scientific",223470,"N/A","N/A","N/A","N/A","Borescopes",436,60.99,-12,0,0,-123,"-","-","N/A","N/A","Jebousike","China",1,71,"N/A","Large Standard-Size",11,8.07,3.93,3.4,175.64,484.54,"05/31/2025",14,7,6,"N/A"
"https://amazon.com/dp/B0F2HQK5HL","https://m.media-amazon.com/images/I/71-NrGRCqIL._SX450_.jpg","B0F2HQK5HL","Okk Sewer Camera, Drain Camera with Meter Counter, Pipe Inspection with Self-Leveling, Industrial Endoscope with DVR, 7"" LCD Plumbing Snake Endoscope 100ft Cable, IP68 Waterproof, 12 LEDs, 16GB Card","okk","FBA","Industrial & Scientific",223621,"N/A","N/A","N/A","N/A","Borescopes",441,439.99,-22,4,2,,2304.82,757.71,5,4.7,"ZOZUS-DIRECT","China",1,0,"N/A","Large bulky",8.5,14.68,16.5,14.1,1036.58,2859.54,"12/31/2025",11,8,8,0.87
"https://amazon.com/dp/B0D2H2C95S","https://m.media-amazon.com/images/I/81vTITE492L._SX450_.jpg","B0D2H2C95S","Articulating Borescope 2-Way 210° - JESERAL 6.2mm Len Endoscope camera with 6 light, HD1080P Inspection Camera with Steering Probe, Compatible with Android&iOS Phone, scope with 3.3FT Semi-Rigid Cable","Jeseral","FBA","Industrial & Scientific",223622,"N/A","N/A","N/A","N/A","Borescopes",437,69.96,-44,21,13,-61,1636,978.02,118,4.4,"JESERAL","China",1,1538,"N/A","Large Standard-Size",3.23,7.48,15.07,2.34,183.31,505.69,"06/30/2025",22,7,3,0.18
"https://amazon.com/dp/B0DJ7JR4G4","https://m.media-amazon.com/images/I/81ma3YQa5FL._SX450_.jpg","B0DJ7JR4G4","Anysun Sewer Camera with Locator, Self Leveling Sewer Inspection Camera 300ft with Distance Counter, 9'' 1080P IPS Monitor and Video Recorder with MIC, 7MM Cable with 12 Lights(32GB Card)","anysun","FBA","Industrial & Scientific",223794,717813048746,"N/A",0717813048746,"N/A","Borescopes",438,1299.99,-25,2,0,,2105.92,"-",1,5,"Nedive","China",1,0,"N/A","Large bulky",12.91,19.17,28.23,32.47,3517.51,9703.46,"11/30/2025",17,8,4,2.13
"https://amazon.com/dp/B0DL5LQ7RQ","https://m.media-amazon.com/images/I/81lyDIFaKtL._SX450_.jpg","B0DL5LQ7RQ","Okk Sewer Camera, Drain Camera with 512Hz Sonde, Pipe Inspection with Self-Leveling, Industrial Endoscope with DVR, 7"" LCD Plumbing Snake Endoscope 165ft Cable, IP68 Waterproof, 12 LEDs, 16GB Card","okk","FBA","Industrial & Scientific",223813,"N/A","N/A","N/A","N/A","Borescopes",442,599.99,-12,4,0,,2304.82,"-",5,4.7,"ZOZUS-DIRECT","China",1,0,"N/A","Large bulky",8.9,17,19,17.85,1447.33,3992.64,"12/31/2025",16,9,8,0.87
"https://amazon.com/dp/B0F2HS29VB","https://m.media-amazon.com/images/I/71+AZV+HFoL._SX450_.jpg","B0F2HS29VB","Okk Sewer Camera with Locator, Drain Camera 100ft with 512Hz Sonde, Pipe Inspection with Self-Leveling, Industrial Endoscope with DVR, 9"" LCD, Meter Counter, IP68 Waterproof, 12 LEDs, 16GB Card","okk","FBA","Industrial & Scientific",223816,"N/A","N/A","N/A","N/A","Borescopes",442,879.99,-7,4,0,,2304.82,"-",5,4.7,"ZOZUS-DIRECT","China",1,0,"N/A","Large bulky",9,16.5,21.38,20.8,1598.49,4409.63,"12/31/2025",11,7,8,0.87
"https://amazon.com/dp/B0DKNMQQF9","https://m.media-amazon.com/images/I/81lyDIFaKtL._SX450_.jpg","B0DKNMQQF9","Okk Sewer Camera, Drain Camera with 512Hz Sonde, Pipe Inspection with Self-Leveling, Industrial Endoscope with DVR, 7"" LCD Plumbing Snake Endoscope 100ft Cable, IP68 Waterproof, 12 LEDs, 16GB Card","okk","FBA","Industrial & Scientific",223822,"N/A","N/A","N/A","N/A","Borescopes",442,559.99,-12,4,1,,2304.82,418.22,5,4.7,"ZOZUS-DIRECT","China",1,0,"N/A","Large Standard-Size",16,7,14,15,789.44,2177.78,"12/31/2025",16,9,8,0.87
"https://amazon.com/dp/B0C5F2VF9C","https://m.media-amazon.com/images/I/618I0bzDskL._SX450_.jpg","B0C5F2VF9C","Zooke Drain Pipeline Inspection Replacement, 0.9inch/23mm Sewer Camera Accessories 12LED Waterproof IP68 for Pipe Drain, Professional Waterproof Endoscope Camera Replacement","Zooke","FBA","Industrial & Scientific",225683,"N/A","N/A",7679546282183,"N/A","Borescopes",443,155.81,-21,2,2,,315.2,315.11,1,1,"Yixvtn-US","China",2,9,"N/A","Large Standard-Size",2.99,4.09,7.05,0.44,43.47,119.91,"12/31/2024",20,9,0,2.44
"https://amazon.com/dp/B0D72K42F5","https://m.media-amazon.com/images/I/71e59boqEGL._SX450_.jpg","B0D72K42F5","Anysun Sewer Camera with Locator, Distance Counter, Self-Leveling & 7mm Push Cable, 165FT Pipe Inspection Camera with 512Hz Transmitter, 9” 1080P IPS Screen, DVR 32GB – for Plumbers & Inspectors","anysun","FBA","Industrial & Scientific",226316,"N/A","N/A","N/A","N/A","Borescopes",444,1499.99,-15,15,9,81,22964.78,13109.16,14,4.3,"HZDZ_Shop","Hong Kong",1,0,"N/A","Large bulky",15.5,15.5,19,20,2298.22,6339.93,"05/31/2025",20,8,4,1.06
"https://amazon.com/dp/B0FB3HPFB2","https://m.media-amazon.com/images/I/71XOE2WnqGL._SX450_.jpg","B0FB3HPFB2","Anysun Sewer Camera with Locator, Distance Counter, Self-Leveling & 7mm Push Cable, 100FT Pipe Inspection Camera with 512Hz Transmitter, 9” 1080P IPS Screen, DVR 32GB – for Plumbers & Inspectors","anysun","FBA","Industrial & Scientific",226327,750880022523,"N/A",0750880022523,"N/A","Borescopes",444,1399.99,"N/A",15,3,81,22964.78,4000.32,14,4.3,"HZDZ_Shop","Hong Kong",2,0,"N/A","Large bulky",15,10,15,15,1132.81,3125,"05/31/2025",9,11,4,1.06
"https://amazon.com/dp/B0FSS5Q37H","https://m.media-amazon.com/images/I/71EXeW4bJvL._SX450_.jpg","B0FSS5Q37H","AUTOOL Dual Lens Borescope, 4.3” IPS Screen HD Inspection Camera, 0.25inch Endoscope 3FT Semi-Rigid Cable, 210° Articulation, 6 LED Lights, IP67 Waterproof, 32GB SD Card","AUTOOL","FBA","Industrial & Scientific",228856,"N/A","N/A",6970039380043,"N/A","Borescopes",455,169.99,"N/A",23,3,-40,3061.17,559.85,18,4.5,"AUTOOL-DIRECT","China",1,197,"N/A","Large Standard-Size",9.6,9.6,5.1,2.3,236.64,652.8,"10/31/2025",5,9,4,1.26
"https://amazon.com/dp/B0D2R7WWXG","https://m.media-amazon.com/images/I/71WPwUpV9iL._SX450_.jpg","B0D2R7WWXG","Borescope Camera with Light, 1080P HD Industrial Endoscope with 4.3"" Screen, Semi-Rigid Cable, IP67 Waterproof Scope Camera for Pipe, Plumbing, Engine Inspection","EFUTONPRO","FBA","Industrial & Scientific",230105,628822354257,"N/A",0628822354257,"N/A","Borescopes",456,25.99,"N/A",12,7,-88,323.17,192.1,92,4.5,"Supermarket2010","China",1,1090,"N/A","Large Standard-Size",1.89,6.34,10.91,0.84,65.82,181.57,"06/30/2025",22,8,3,0.13
"https://amazon.com/dp/B0DQYBYJ4F","https://m.media-amazon.com/images/I/71cyHXEUZcL._SX450_.jpg","B0DQYBYJ4F","Dual Lens Endoscope Camera with Light - Inspection Borescope Camera with 4.3"" IPS Screen, 1920P HD Snake Camera with 8 LED Lights, 3.3FT Semi-Rigid Cord Bore Scope, IP67 Waterproof Endoscope for Sewer","Jebousike","FBA","Industrial & Scientific",231220,"N/A","N/A","N/A","N/A","Borescopes",449,44.99,-12,0,0,-123,"-","-","N/A","N/A","Jebousike","China",1,71,"N/A","Large Standard-Size",3.11,5.43,7.83,0.78,66.66,183.88,"05/31/2025",14,8,6,"N/A"
"https://amazon.com/dp/B0D4PP5W9S","https://m.media-amazon.com/images/I/7106wYloq9L._SX450_.jpg","B0D4PP5W9S","Triple Lens 1080P Borescope with 50FT Semi-Rigid Cable, 5"" IPS Screen Endoscope Camera with Lights, 1080P Industrial Borescope with 32G Storage Card,IP67 Waterproof Drain Camera","ALIESTFDNO","FBA","Industrial & Scientific",231560,"N/A","N/A",6977772634860,"N/A","Borescopes",451,64.99,-19,8,8,-87,516.88,516.7,51,3.8,"Lingborx","China",1,482,"N/A","Large Standard-Size",3.43,6.5,8.27,2.2,92.83,256.08,"07/31/2025",21,8,0,0.16
"https://amazon.com/dp/B0FLPWZMNV","https://m.media-amazon.com/images/I/719L+bFbuSL._SX450_.jpg","B0FLPWZMNV","Anysun Sewer Camera with Locator, Self Leveling Sewer Inspection Camera 200ft with Distance Counter, 9'' 1080P IPS Monitor and Video Recorder with MIC, 7MM Cable with 12 Lights(32GB Card)","anysun","FBM","Industrial & Scientific",231879,769016774069,"N/A",0769016774069,"N/A","Borescopes",453,999.99,-45,2,1,,2105.92,612.33,1,5,"Nedive","China",1,0,"N/A","Large bulky",15,16,19,24,"N/A","N/A","11/30/2025",6,8,4,2.13
"https://amazon.com/dp/B0G394XQCT","https://m.media-amazon.com/images/I/719L+bFbuSL._SX450_.jpg","B0G394XQCT","Anysun Sewer Camera with Locator, Self Leveling Sewer Inspection Camera 100ft with Distance Counter, 9'' 1080P IPS Monitor and Video Recorder with MIC, 7MM Cable with 12 Lights(32GB Card)","anysun","FBM","Industrial & Scientific",231881,717639701238,"N/A",0717639701238,"N/A","Borescopes",453,899.99,9,2,1,,2105.92,1097.86,1,5,"Nedive","China",1,0,"N/A","Large bulky",15,16,19,20,"N/A","N/A","11/30/2025",3,8,4,2.13
"https://amazon.com/dp/B0B5ZS5R25","https://m.media-amazon.com/images/I/71YJ0PCXhQL._SX450_.jpg","B0B5ZS5R25","EIXAUP Self Leveling Sewer Camera 165 ft/ 50 m, Built-in 512Hz Transmitter, 10.1"" 1080P HD Monitor, IP68 Waterproof, 7mm Thicker Cable, Audio/DVR Recorder, 12 Pcs LED Lights, 16GB Card","EIXAUP","FBA","Industrial & Scientific",232239,726679815690,"N/A",0726679815690,"N/A","Borescopes",453,589.99,-30,0,0,,"-","-",12,3.2,"SYST","China",1,22,38,"Large bulky",13,17.5,23.5,21.55,2691.69,7425.35,"03/31/2025",43,7,0,0
"https://amazon.com/dp/B0G8HPL9XB","https://m.media-amazon.com/images/I/71Xc7tnnBJL._SX450_.jpg","B0G8HPL9XB","5"" IPS Dual Lens Endoscope Camera with Lights, 1080P Photo Video Inspection Borescope, IP67 Waterproof Endoscope 16.5FT Industrial Snake Camera with 32GB Card","AukonVee","FBA","Industrial & Scientific",232565,"N/A","N/A","N/A","N/A","Borescopes",458,49.99,241,18,3,,634.93,131.07,47,4.4,"Shenzhen Qiuchen Electronics Co., LTD","China",1,0,"N/A","Large Standard-Size",2.83,5.59,8.15,1.1,64.91,179.07,"12/31/2025",2,8,3,0.39
"https://amazon.com/dp/B0GDFG41PS","https://m.media-amazon.com/images/I/71G5QVgb7hL._SX450_.jpg","B0GDFG41PS","FOXWELL Y406D-Elite Dual Lens 220° Articulating Borescope, 0.25in Ultra-Slim Probe, HD IPS Display, IP67 Waterproof, Flexible Camera for Automotive, HVAC, Plumbing & Industrial Inspections – 5.3FT","FOXWELL","FBA","Industrial & Scientific",233892,"N/A","N/A","N/A","N/A","Borescopes",448,219.99,-25,23,23,,4980.4,4980.31,4,4.7,"Foxwell US","China",1,0,"N/A","Large Standard-Size",12.4,8.46,2.95,2.09,155.81,429.81,"01/31/2026",2,9,0,5.66
"https://amazon.com/dp/B076CNDVFL","https://m.media-amazon.com/images/I/61g8NdfCXFL._SX450_.jpg","B076CNDVFL","Jonard Tools FIM-400 Fiber Optic Inspection Microscope 400x with FC/SC/ST and LC Adapters","Jonard Tools","Amazon","Industrial & Scientific",234041,811490019072,00811490019072,6018008378384,"N/A","Borescopes",449,223.12,-17,7,5,-65,1600.94,1129.95,50,4.2,"Amazon","N/A",9,166,"N/A","Large Standard-Size",3,3.4,10.8,1.7,"N/A","N/A","05/31/2024",100,7,3,0.14
"https://amazon.com/dp/B076CH47TD","https://m.media-amazon.com/images/I/61EeLBzRZgL._SX450_.jpg","B076CH47TD","Jonard Tools FIM-200 Fiber Optic Inspection Microscope 200x with FC/SC/ST and LC Adapters","Jonard Tools","FBM","Industrial & Scientific",234042,811490019065,00811490019065,0811490019065,"N/A","Borescopes",449,237.95,-5,7,2,-65,1600.94,470.68,50,4.2,"RedBarn Warehouse","USA",4,166,"N/A","Large Standard-Size",2.83,3.46,10.87,1.67,"N/A","N/A","05/31/2024",100,7,3,0.14
"https://amazon.com/dp/B0D72WK614","https://m.media-amazon.com/images/I/71XOE2WnqGL._SX450_.jpg","B0D72WK614","Anysun Sewer Camera with Locator, Distance Counter, Self-Leveling & 7mm Push Cable, 300FT Pipe Inspection Camera with 512Hz Transmitter, 9” 1080P IPS Screen, DVR 32GB – for Plumbers & Inspectors","anysun","FBA","Industrial & Scientific",234327,"N/A","N/A","N/A","N/A","Borescopes",450,1899.99,-20,15,3,81,22964.78,5854.81,14,4.3,"HZDZ_Shop","Hong Kong",1,0,"N/A","Extra-large 50+ to 70 lb",12.2,22.4,27,37.55,3714.9,10248,"05/31/2025",20,7,4,1.06
"https://amazon.com/dp/B0CW53H8RH","https://m.media-amazon.com/images/I/61aTSJ5FH0L._SX450_.jpg","B0CW53H8RH","23MM Sewer Camera Head Replacement,with Guide Wheel Protective Cover,Accessories Parts of JQKJCAM 9622A 9616A 9604A WP90A 9600A Pipe Drain Camera Plumbing Bore Scope Snake with 12PCS Lights","JQKJCAM","FBA","Industrial & Scientific",240583,"N/A","N/A","N/A","N/A","Borescopes",480,119,-23,18,18,-46,2129.01,2128.88,6,2.9,"JJKJ Cam","China",1,0,"N/A","Large Standard-Size",2.64,4.02,6.73,0.64,35.96,99.2,"10/31/2025",24,9,0,2.98
"https://amazon.com/dp/B09SGGK7D4","https://m.media-amazon.com/images/I/61AjIYxgXxS._SX450_.jpg","B09SGGK7D4","Maoershan Hard EVA Travel Case fits SKYBASIC Industrial Endoscope Digital Borescope Snake Sewer IP67 Waterproof Screen HD Inspection Camera (Case Only)","Maoershan","FBA","Industrial & Scientific",242586,"N/A","N/A",6044208492414,"N/A","Borescopes",484,15.99,-31,9,9,-27,147.02,146.79,16,4.8,"Maoershan","China",1,146,1,"Large Standard-Size",2.09,6.93,7.56,0.42,55.13,152.08,"12/31/2024",48,4,0,0.58
"https://amazon.com/dp/B0DY7MRGJS","https://m.media-amazon.com/images/I/71PANvOw1-L._SX450_.jpg","B0DY7MRGJS","BORESOEIL 360° Articulating Borescope with Light - 3.3FT Automotive Endoscope Camera, 0.25in HD 1080P Waterproof Snake Inspection Camera with 5"" IPS Screen for Engine & Pipe Inspection","Boresoeil","FBA","Industrial & Scientific",242864,732468389488,"N/A",0732468389488,"N/A","Borescopes",467,239.99,"N/A",17,5,100,4634.86,1303.86,18,4.5,"jeetscope","China",1,0,"N/A","Large Standard-Size",15.74,8.46,4.53,3.09,303.7,837.8,"06/30/2025",11,8,2,0.94
"https://amazon.com/dp/B0DZFTBJXN","https://m.media-amazon.com/images/I/71PANvOw1-L._SX450_.jpg","B0DZFTBJXN","BORESOEIL 360° Articulating Borescope, 5.0FT 0.25in HD 1080P Flexible Snake Camera with Light, 5"" IPS Screen for Plumbing & Machinery Inspection, Waterproof Endoscope","Boresoeil","FBA","Industrial & Scientific",242875,732468183048,"N/A",0732468183048,"N/A","Borescopes",467,289.99,-8,17,11,100,4634.86,3330.69,18,4.5,"jeetscope","China",1,0,"N/A","Large Standard-Size",4.61,8.82,15.86,3.57,324.67,895.65,"06/30/2025",11,8,2,0.94
"https://amazon.com/dp/B0FK26RNRZ","https://m.media-amazon.com/images/I/81DDddwWxAL._SX450_.jpg","B0FK26RNRZ","Anysun 9'' Sewer Camera Self Leveling, 7MM Fiberglass Cable, Length Marker, 5100mAh, IPS Screen, HD 1080P with DVR - 32GB, IP68 Sewer Scope Pipe Drain Plumbing Inspection Cameras Borescope Snake-165Ft","anysun","FBA","Industrial & Scientific",244054,"N/A","N/A","N/A","N/A","Borescopes",482,499.99,"N/A",5,1,,2499.22,511.17,1,5,"Yongchangsheng tech","China",1,0,"N/A","Large bulky",18,18,10,16,1631.25,4500,"11/30/2025",3,7,2,5.31
"https://amazon.com/dp/B0DKHMFTVN","https://m.media-amazon.com/images/I/81frA27mhEL._SX450_.jpg","B0DKHMFTVN","Endoscope Camera with Light & 32GB Card, 1080P HD Borescope Inspection Camera 4.3"" IPS Screen, 5.5mm IP67 Waterproof Probe with 6 Adjustable LEDs,16.4FT Semi-Rigid Cable, Tools, Gadgets for Men","AukonVee","FBA","Industrial & Scientific",244838,"N/A","N/A","N/A","N/A","Borescopes",471,27.99,-13,18,10,,634.93,312.78,47,4.4,"Shenzhen Qiuchen Electronics Co., LTD","China",1,0,"N/A","Large Standard-Size",2.87,5.51,8.23,1.04,65.53,180.76,"12/31/2025",16,9,3,0.39
"https://amazon.com/dp/B0C9L5V3J9","https://m.media-amazon.com/images/I/71qY2x+S9-L._SX450_.jpg","B0C9L5V3J9","Anykit Dual Lens Borescope,1080P Industrial Endoscope with Light, IP67 Waterproof Inspection Cam, Sewer Camera with 4.0"" IPS Screen, Waterproof 16.5ft Snake Camera, 32GB Card","Anykit","FBA","Industrial & Scientific",245124,"N/A","N/A","N/A","N/A","Borescopes",472,79.99,-15,15,15,-124,1175.72,1175.43,144,4.5,"AnyKit","China",1,794,44,"Large Standard-Size",3.31,7.48,8.39,1.21,104.58,288.51,"10/31/2025",32,7,2,0.1
"https://amazon.com/dp/B0B316VKXM","https://m.media-amazon.com/images/I/71STE+DmMbL._SX450_.jpg","B0B316VKXM","Autel MaxiVideo MV108S Digital Inspection Camera, 2026 8.5mm 1080P HD Semi-Rigid Snake Camera, IP67 Waterproof USB Borescope Industrial Endoscope w/LED Light, Upgrade of MV108 MV105S MV105","Autel","FBA","Industrial & Scientific",245527,762917121833,"N/A",0762917121833,"N/A","Borescopes",473,49,-10,9,9,120,426.27,426.18,21,4.3,"Autel Official","Hong Kong",1,42,-66,"Large Standard-Size",2.05,6.85,12.83,0.9,90.71,250.23,"02/29/2024",44,7,0,0.41
"https://amazon.com/dp/B0D2WGHKZQ","https://m.media-amazon.com/images/I/71ch1D3vkqL._SX450_.jpg","B0D2WGHKZQ","HD Endoscope Camera with Light,Type C and Lighting Borescope for Android and iPhone iOS,16.4 Ft,1920P","hyxghBU","FBA","Industrial & Scientific",245934,797430904632,"N/A",0797430904632,"N/A","Borescopes",468,45.99,7,8,8,-20,371.2,371.06,18,4,"hyxghBU Store","China",1,148,"N/A","Large Standard-Size",1.14,6.5,6.54,0.46,24.4,67.31,"08/31/2024",22,9,0,0.43
"https://amazon.com/dp/B0F6C2CN27","https://m.media-amazon.com/images/I/714U1yh4ZYL._SX450_.jpg","B0F6C2CN27","1920P Dual-Lens Lighting HD Endoscope, 8+1 Adjustable LED Light, IP67 Waterproof 3FT Round Wire. Available for Android and iOS Smartphones, iPhone, iPad, Samsung (3FT/1M)","BYDGUMEI","FBA","Industrial & Scientific",246216,722302380382,"N/A",0722302380382,"N/A","Borescopes",475,9.99,"N/A",0,0,,"-","-",1,1,"Baowengu","China",1,0,"N/A","Large Standard-Size",1.61,5.04,5.12,0.18,20.92,57.7,"-",10,9,2,"N/A"
"https://amazon.com/dp/B0CP3YJHPP","https://m.media-amazon.com/images/I/71BjUWFhgBL._SX450_.jpg","B0CP3YJHPP","Anysun Self-Leveling Sewer Camera with 512Hz Transmitter, Distance Counter, 7MM Thicker Cable, 265FT/80M Pipe Camera, 10'' IPS 1080P Screen Sewer Inspection Camera with DVR/Audio Recording-16GB","anysun","FBA","Industrial & Scientific",246361,"N/A","N/A","N/A","N/A","Borescopes",469,1399.99,-24,7,1,,7231.15,1510.79,24,4.1,"HZDZ_Shop","Hong Kong",1,71,"N/A","Extra-large 50+ to 70 lb",12,22.25,26.35,38.5,3542.15,9771.46,"11/30/2024",26,7,4,0.28
"https://amazon.com/dp/B0FB8Z249H","https://m.media-amazon.com/images/I/710q7gBLnlL._SX450_.jpg","B0FB8Z249H","2-Way Articulating Borescope Camera with Light, 0.24 in Endoscope, 1080P HD Snake Inspection Camera, 4.3"" Screen, 5FT Flexible Cable for Sewer Pipe Plumbing HVAC Automotive Wall, Video & Photo, DEERFO","DEERFO","FBA","Industrial & Scientific",246794,"N/A","N/A","N/A","N/A","Borescopes",475,69.99,"N/A",9,9,,608.47,608.28,63,4.5,"YEZHU","China",1,0,"N/A","Large Standard-Size",3.23,9.37,16.93,2.73,257.97,711.65,"09/30/2025",9,9,0,0.14
"https://amazon.com/dp/B0FQ4ZS2ZK","https://m.media-amazon.com/images/I/71GaX44AOPL._SX450_.jpg","B0FQ4ZS2ZK","Two-Way 210° Articulating Borescope, Steering Snake Inspection Endoscope with 4.3in HD IPS Screen,6 LED Lights, IP67 Waterproof Endoscope for Mechanics A/C Wall Pipe Inspection - 3.28FT","Generic","FBA","Industrial & Scientific",247211,"N/A","N/A","N/A","N/A","Borescopes",477,84.99,-17,6,6,243,513.15,512.96,"N/A","N/A","Masai One-Stop Automotive Repair Tools","China",1,0,"N/A","Large Standard-Size",16.15,8.66,2.76,2.43,194.35,536.13,"11/30/2025",5,9,0,"N/A"
"https://amazon.com/dp/B0DGMZ92CH","https://m.media-amazon.com/images/I/51s2Jjh2OXL._SX450_.jpg","B0DGMZ92CH","Pipe Sewer Inspection Camera Protective Cover, Plastic Sewer Camera Guide Wheel, Easy to Install Pipe Inspection Camera Accessories for 17 to 18mm Endoscope Part Accessory","Asixxsix","FBA","Industrial & Scientific",247471,"N/A","N/A","N/A","N/A","Borescopes",477,16.66,-34,14,14,-47,232.93,232.68,3,4.3,"Guoenir","China",2,0,"N/A","Large Standard-Size",0.94,3.35,3.46,0.04,5.52,15.22,"10/31/2025",17,9,0,4.64
"https://amazon.com/dp/B0F2HP61PW","https://m.media-amazon.com/images/I/71wTDW5euXL._SX450_.jpg","B0F2HP61PW","Okk Sewer Camera with Locator, Drain Camera 100ft, Pipe Inspection with 512Hz Sonde, Self-Leveling, Industrial Endoscope with DVR, 9"" LCD, Meter Counter, 7mm Cable, IP68 Waterproof, 12 LEDs, 32GB Card","okk","FBA","Industrial & Scientific",249304,"N/A","N/A","N/A","N/A","Borescopes",490,1199.99,-1,25,4,1071,23814.15,5036.81,10,4.4,"ZOZUS-DIRECT","China",1,0,"N/A","Large bulky",13,19,20.5,22.15,2549.33,7032.64,"12/31/2025",11,8,11,2.52
"https://amazon.com/dp/B0FC2JNN33","https://m.media-amazon.com/images/I/71r-+F80NNL._SX450_.jpg","B0FC2JNN33","Sewer Camera with Locator, Drain Camera 200ft, Pipe Inspection with 512Hz Sonde, Self-Leveling, Industrial Endoscope with DVR, 9"" LCD, Meter Counter, 7mm Cable, IP68 Waterproof, 12 LEDs, 32GB Card","okk","FBA","Industrial & Scientific",249772,"N/A","N/A","N/A","N/A","Borescopes",490,1599.99,-2,25,2,1071,23814.15,3360.37,10,4.4,"ZOZUS-DIRECT","China",1,0,"N/A","Large bulky",17,12,18,23,1848.75,5100,"12/31/2025",5,8,11,2.52
"https://amazon.com/dp/B0F23DYJPT","https://m.media-amazon.com/images/I/7116UZ66R3L._SX450_.jpg","B0F23DYJPT","EIXAUP Sewer Camera 100 ft, 23 MM Pipe Inspection Camera with 12pcs LED Lights, 7"" 1080P HD Monitor with DVR Function, IP68 Waterproof, Meter Marker, Included 32GB Card(30 m)","EIXAUP","FBA","Industrial & Scientific",250317,"N/A","N/A","N/A","N/A","Borescopes",483,263.99,-18,6,6,-52,1685.81,1685.61,7,3.6,"SYST","China",1,0,"N/A","Large bulky",11.14,13.3,15.39,10.67,1148.02,3166.96,"05/31/2025",11,6,0,0.91
"https://amazon.com/dp/B0D2R7QG47","https://m.media-amazon.com/images/I/719-w+QCPhL._SX450_.jpg","B0D2R7QG47","Two-Way Articulating Borescope with Light, GODIAG Industrial Endoscope with Snake Scope Camera, Borescope Inspection Camera with Light for Automotive & Aircraft Mechanics (3.3FT Cord)","GODIAG","FBA","Industrial & Scientific",250833,889327074273,"N/A",0889327074273,"N/A","Borescopes",483,72.19,-34,6,4,-80,431.01,305.8,61,4.4,"GODIAG SHOP","N/A",1,289,"N/A","Large Standard-Size",3.23,9.45,17.01,2.58,261.41,721.12,"02/28/2025",20,7,2,0.09
"https://amazon.com/dp/B0DYNS468T","https://m.media-amazon.com/images/I/51WTr4Twz3L._SX450_.jpg","B0DYNS468T","Dual-Lens Endoscope Camera with Light - 2.4"" LCD Screen Inspection Cameras,IP67 Waterproof Borescope,HD 1080P Endoscope Camera 16.5ft Semi-Rigid Cord for Sewer,Gifts for Men Tools and Gadgets","WINWEND","FBA","Industrial & Scientific",251050,"N/A","N/A","N/A","N/A","Borescopes",484,29.99,-13,3,3,-40,92.42,92.31,26,4.4,"POWEHIGH","China",1,0,"N/A","Large Standard-Size",3.27,4.96,9.61,0.99,78.47,216.48,"11/30/2025",12,7,0,0.13
"https://amazon.com/dp/B0CP638V8G","https://m.media-amazon.com/images/I/51HxylvRPCL._SX450_.jpg","B0CP638V8G","Replacement Screen for Anysun 9DX Series Sewer Inspection Camera","anysun","FBM","Industrial & Scientific",251158,774049912852,"N/A",0774049912852,"N/A","Borescopes",476,129.99,"N/A",6,6,,760.5,760.39,"N/A","N/A","Nedive","China",1,73,"N/A","N/A","N/A","N/A","N/A","N/A","N/A","N/A","03/31/2025",27,1,0,"N/A"
"https://amazon.com/dp/B08QC2X5VL","https://m.media-amazon.com/images/I/71ZM7MeD1rL._SX450_.jpg","B08QC2X5VL","Teslong Endoscope Replacement Cable with Light, Dual Lens Inspection Camera 8mm/0.31inch Waterproof Probe Compatible with NTS500, NTS300(10FT)","Teslong","FBA","Industrial & Scientific",251441,"N/A","N/A","N/A","N/A","Borescopes",485,79.99,126,9,9,800,702.32,702.07,5,4.2,"Teslong","China",1,110,"N/A","Large Standard-Size",2,5.3,6.3,1,33.62,92.75,"09/30/2025",62,6,0,1.76
"https://amazon.com/dp/B0DLGVF1ZQ","https://m.media-amazon.com/images/I/71WVzoN7pOL._SX450_.jpg","B0DLGVF1ZQ","KUUAUX Endoscope Camera with Light, 1920P HD Endoscope with 8 Adjustable LED Lights, 16.4Ft Semi-Rigid Cable, 8mm Probe IP67 Waterproof Inspection Camera for Android & iOS Devices","KUUAUX","FBA","Industrial & Scientific",252872,"N/A","N/A","N/A","N/A","Borescopes",479,14.99,-41,4,4,120,63.03,62.91,33,4.2,"KUUAUX","China",1,33,"N/A","Large Standard-Size",4.72,4.72,1.4,0.44,15.7,43.32,"03/31/2025",16,6,0,0.13
"https://amazon.com/dp/B0DL9J7SQ5","https://m.media-amazon.com/images/I/61uIRTgLriL._SX450_.jpg","B0DL9J7SQ5","Anysun 5860 Model Sewer Camear Monitor Replacement, Only for Anysun 5860 Serie Sewer Camera System","anysun","FBM","Industrial & Scientific",252939,"N/A","N/A","N/A","N/A","Borescopes",499,199.99,-3,1,1,400,172.34,172.32,1,5,"Yongchangsheng tech","China",1,36,"N/A","N/A","N/A","N/A","N/A","N/A","N/A","N/A","05/31/2025",16,2,0,0.87
"https://amazon.com/dp/B0B2JT9WQD","https://m.media-amazon.com/images/I/81NdNQ2Q4KL._SX450_.jpg","B0B2JT9WQD","Anysun Sewer Inspection Camera - 100ft with 512Hz Transmitter, Receiver & 7"" LCD Monitor - IP68 Waterproof Pipe Camera DVR Recorder (8GB SD Card)","anysun","FBA","Industrial & Scientific",253206,774980345238,"N/A",0774980345238,"N/A","Borescopes",486,699.99,-23,7,3,,7231.15,2214.93,24,4.1,"HZDZ_Shop","Hong Kong",1,71,"N/A","Large bulky",8,17,21.25,19.75,1455.03,4013.89,"11/30/2024",47,7,4,0.28
"https://amazon.com/dp/B0DHRQ9KM1","https://m.media-amazon.com/images/I/71TMrzDaETL._SX450_.jpg","B0DHRQ9KM1","Sewer Camera 100FT/30M, Wohuole Pipe Inspection Camera with 6pcs LEDs Light, 5"" 1080P HD Screen, Plumbing Snake Borescope with 5000mAh Battery DVR Recorder, Included 32GB Card","wohuole","FBA","Industrial & Scientific",254118,"N/A","N/A","N/A","N/A","Borescopes",500,205,-17,11,11,-17,2205.53,2205.42,18,3.6,"QX Direct US","China",2,0,"N/A","Large Standard-Size",16.02,13.66,6.69,7.36,737.64,2034.88,"08/31/2025",8,6,2,0.59
"https://amazon.com/dp/B0CNWHTXFT","https://m.media-amazon.com/images/I/615LqqlLiHL._SX450_.jpg","B0CNWHTXFT","Perfect Part Endoscope - 3-in-1 Micro USB, Type C & USB Borescope Inspection Camera for Android Smartphones, Tablets & Laptops, HD Waterproof Camera with 6 LEDs","THE PERFECT PART","FBM","Industrial & Scientific",254381,647168703208,"N/A",0647168703208,"N/A","Borescopes",483,15.39,"N/A",4,0,1000,37.13,"-",15,3,"The Perfect Part Inc.","USA",1,73,-47,"N/A","N/A","N/A","N/A","N/A","N/A","N/A","02/28/2025",27,8,3,0.24
"https://amazon.com/dp/B0DWS2LD48","https://m.media-amazon.com/images/I/71thH0MISlL._SX450_.jpg","B0DWS2LD48","Anysun Self-Leveling Sewer Camera with Distance Counter, 0.28in/7mm Diameter 165ft Cable, 9'' 1080P IPS Screen, Pipe Inspection Camera with DVR Recording-32GB","anysun","FBA","Industrial & Scientific",254600,717690767655,"N/A",0717690767655,"N/A","Borescopes",488,799.99,13,16,4,-56,12924.87,3054.02,11,4.1,"HZDZ_Shop","Hong Kong",1,339,"N/A","Large bulky",15,12,9,17,815.63,2250,"06/30/2025",12,8,6,1.45
