"https://amazon.com/dp/B0CTQJKT5S","https://m.media-amazon.com/images/I/61X6wJuS+sL._SX450_.jpg","B0CTQJKT5S","Thermal Imager Camera, 8Hz 320 X 240 IR Infrared Thermal Imager Sensor with 2.8in LCD Screen, -40 ℃ - 300 ℃Lithium Ion Battery USB C Charging, Multifunctional nfrared Thermal Imager","Wokyo","FBM","Industrial & Scientific",1436599,"N/A","N/A","N/A","N/A","Thermal Imagers",663,106.64,170,0,0,,"-","-","N/A","N/A","Rayone","China",1,0,"N/A","N/A","N/A","N/A","N/A","N/A","N/A","N/A","02/28/2025",25,9,0,"N/A"
"https://amazon.com/dp/B09G6J5GV6","https://m.media-amazon.com/images/I/31UE8SX03rS._SX450_.jpg","B09G6J5GV6","BestCH AC/DC Adapter For Fluke Ti10 Ti25 IR Fusion Technology Thermal Imager Camera Imaging System Ti-Series Power Supply Cord Cable Battery Charger Input: 100-240 VAC Worldwide Use Mains PSU","BestCH","FBM","Industrial & Scientific",1439240,"N/A","N/A",5747432089269,"N/A","Thermal Imagers",664,16.46,-15,0,0,,"-","-","N/A","N/A","Best Charger","China",1,0,"N/A","N/A","N/A","N/A","N/A","N/A","N/A","N/A","01/31/2025",54,7,0,"N/A"
"https://amazon.com/dp/B0FDGMQLN1","https://m.media-amazon.com/images/I/81O-j71mXwL._SX450_.jpg","B0FDGMQLN1","BSIDE Thermal Imaging Camera multimeter 428×320 Resolution with 20000 Words Multimeter 3.98'' Touchscreen 25Hz Infrared Thermal Camera Dual-Light Fusion 15 Thermal Palettes TRMS Multimeter for PCB","MAXRIENY","FBA","Industrial & Scientific",1439681,"N/A","N/A",6933540318158,"N/A","Thermal Imagers",665,369.99,-15,0,0,,"-","-","N/A","N/A","MAXRIENY","China",1,0,"N/A","Large Standard-Size",4.88,1.89,8.58,1.06,39.87,109.97,"10/31/2025",9,9,0,"N/A"
"https://amazon.com/dp/B0FKBNRQLV","https://m.media-amazon.com/images/I/61kAhXnMrvL._SX450_.jpg","B0FKBNRQLV","Mobile Phone Thermal Imaging Camera 32x32 Temperature Measurement Device With Type-C Interface For Android 8-12 Smartphone -20 to 1000°C Detection Range","XNManaWork","FBM","Industrial & Scientific",1441490,"N/A","N/A","N/A","N/A","Thermal Imagers",667,60,-34,0,0,,"-","-","N/A","N/A","sweetjing","China",1,0,"N/A","N/A","N/A","N/A","N/A","N/A","N/A","N/A","10/31/2025",8,9,0,"N/A"
"https://amazon.com/dp/B0FMDP29YB","https://m.media-amazon.com/images/I/619r3iuJFiL._SX450_.jpg","B0FMDP29YB","Vmohuyktx Thermal Imaging Device With 20°C To 550°C Ranges For Building Maintenance And Electrical Thermal Imager","Vmohuyktx","FBM","Industrial & Scientific",1446407,"N/A","N/A",7693590192915,"N/A","Thermal Imagers",668,169.29,-15,0,0,,"-","-","N/A","N/A","qinzhimeizhuangyouxiangongsi","China",1,0,"N/A","N/A","N/A","N/A","N/A","N/A","N/A","N/A","10/31/2025",7,9,0,"N/A"
"https://amazon.com/dp/B0C96ZZLXT","https://m.media-amazon.com/images/I/51vV+b3pgdL._SX450_.jpg","B0C96ZZLXT","J-ZMQER USB Power Charger Cable Cord Compatible with FLIR i3 i5 i7 Thermal Imaging Infrared Camera","J-ZMQER","FBM","Industrial & Scientific",1446841,"N/A","N/A","N/A","N/A","Thermal Imagers",669,8.98,-12,0,0,,"-","-","N/A","N/A","J-ZMQER","China",1,0,"N/A","N/A","N/A","N/A","N/A","N/A","N/A","N/A","10/31/2025",33,4,0,"N/A"
"https://amazon.com/dp/B0B1LVY4D6","https://m.media-amazon.com/images/I/61IVa+VapVL._SX450_.jpg","B0B1LVY4D6","Testo 868s Thermal Imager – High-Resolution Thermal Camera with 160 x 120 px - Integrated 5 MP Camera and App-Operation – Thermal Images with Automatic Hot and Cold Spot Detection","Testo","Amazon","Industrial & Scientific",1451538,"N/A","N/A",4029547024788,"N/A","Thermal Imagers",671,2413.88,-11,1,1,,1151.06,1151.03,2,4.2,"Amazon","N/A",1,0,"N/A","Large Standard-Size",18,12.6,7.5,4.5,"N/A","N/A","12/31/2025",42,6,0,0.25
"https://amazon.com/dp/B0FT6Q9TTJ","https://m.media-amazon.com/images/I/61g0tIqRNzL._SX450_.jpg","B0FT6Q9TTJ","Whltzf Thermal Imaging Camera for Water Pipe Leak and Power Electrical 96x96 Infrareds Imager Camera Imager","Whltzf","FBM","Industrial & Scientific",1465910,"N/A","N/A",7755813775821,"N/A","Thermal Imagers",672,165.09,-47,0,0,,"-","-","N/A","N/A","HHH+H","China",1,0,"N/A","N/A","N/A","N/A","N/A","N/A","N/A","N/A","09/30/2025",6,9,0,"N/A"
"https://amazon.com/dp/B0C8CR85RK","https://m.media-amazon.com/images/I/51+ieOQHM8L._SX450_.jpg","B0C8CR85RK","UNI-T UTi720E Infrared Thermal Imager High Resolution Handheld Thermal Camera PCB Circuit Floor Heating Detection,IR Resolution: 256x192 Frequency Frame: 25Hz","UNI-T","FBM","Industrial & Scientific",1483377,"N/A","N/A","N/A","N/A","Thermal Imagers",678,1077.04,9,0,0,,"-","-","N/A","N/A","SIMPLE Y DIRECTO","Mexico",1,0,"N/A","Large Standard-Size",13.78,7.87,9.84,6.61,"N/A","N/A","-",33,6,2,"N/A"
"https://amazon.com/dp/B0C8CMTXVG","https://m.media-amazon.com/images/I/51+ieOQHM8L._SX450_.jpg","B0C8CMTXVG","UNI-T UTi260E Infrared Thermal Imager High Resolution Handheld Thermal Camera PCB Circuit Floor Heating Detection,IR Resolution: 256x192 Frequency Frame: 25Hz","UNI-T","FBM","Industrial & Scientific",1483669,"N/A","N/A","N/A","N/A","Thermal Imagers",678,812.49,-14,0,0,,"-","-","N/A","N/A","Qiudantimes","United Kingdom of Great Britain and Northern Ireland",1,0,"N/A","Large Standard-Size",13.78,7.87,9.84,6.61,"N/A","N/A","-",33,6,2,"N/A"
"https://amazon.com/dp/B0BYKBBRGX","https://m.media-amazon.com/images/I/51YapHvfCsL._SX450_.jpg","B0BYKBBRGX","UNI-T Macro Lens UT-Z003 for UNI-T Thermal Imaging UTi260V/UTi260E/UTi320E/UTi320v+/UTi720E/UTi730E/UTi720V/UTi730VThermal Imaging Camera","UNI-T","FBM","Industrial & Scientific",1485483,"N/A",06935750500361,6935750500361,"N/A","Thermal Imagers",679,55.99,-13,0,0,,"-","-",1,5,"J&Y Instrumentation Tools Store","China",1,0,"N/A","Large Standard-Size",1.97,1.57,1.57,0.44,"N/A","N/A","09/30/2025",32,9,0,0
"https://amazon.com/dp/B0CG553XSN","https://m.media-amazon.com/images/I/51RIoO0s2uL._SX450_.jpg","B0CG553XSN","Marg USB Data Cable Cord for FLIR Systems B40 B50 B60 Thermal Imaging Infrared Camera","Marg","FBM","Industrial & Scientific",1488445,"N/A","N/A",8361360308826,"N/A","Thermal Imagers",680,6.01,-35,0,0,,"-","-","N/A","N/A","Marg Direct","China",1,2,"N/A","N/A","N/A","N/A","N/A","N/A","N/A","N/A","09/30/2025",31,5,0,"N/A"
"https://amazon.com/dp/B01N4NCIGB","https://m.media-amazon.com/images/I/71vjLpoYOQL._SX450_.jpg","B01N4NCIGB","Seek Thermal RevealPRO Handheld Infrared Imaging Camera - RQ-AAAX","Seek Thermal","FBM","Industrial & Scientific",1488805,855753005655,00855753005655,0855753005655,"N/A","Thermal Imagers",681,860.11,"N/A",0,0,,"-","-",63,3.9,"Neobits_","USA",1,5,"N/A","Large Standard-Size",1.89,3.78,7.13,0.88,"N/A","N/A","09/30/2025",111,4,0,0
"https://amazon.com/dp/B09G6HM1MZ","https://m.media-amazon.com/images/I/31UE8SX03rS._SX450_.jpg","B09G6HM1MZ","BestCH AC Adapter for Fluke Ti105 Ti110 Ti125 TiS50 TiS55 TiS60 TiS65 Ti 105 Ti 110 Ti 125 TiS 50 TiS 55 TiS 60 TiS 65 Industrial Infrared Thermal Imagers Imaging Camera IR Imager Power Supply","BestCH","FBM","Industrial & Scientific",1494243,"N/A","N/A",5747432088224,"N/A","Thermal Imagers",683,7.33,-13,0,0,,"-","-","N/A","N/A","Best Charger","China",2,0,"N/A","N/A","N/A","N/A","N/A","N/A","N/A","N/A","09/30/2025",54,7,0,"N/A"
"https://amazon.com/dp/B0D47G21MT","https://m.media-amazon.com/images/I/51T2vX2VFXL._SX450_.jpg","B0D47G21MT","NGCG Thermal Camera AMG8833 8x8 Thermal Imager Array Temperature Sensor 7M Farthest Detection Distance Thermal Imager","NGCG","FBM","Industrial & Scientific",1497287,"N/A","N/A",7627331220247,"N/A","Thermal Imagers",683,63.99,-56,0,0,,"-","-","N/A","N/A","Shunzhongyong","China",1,0,"N/A","N/A","N/A","N/A","N/A","N/A","N/A","N/A","09/30/2025",22,9,0,"N/A"
"https://amazon.com/dp/B0BN5LRGLY","https://m.media-amazon.com/images/I/41Ansj40NaL._SX450_.jpg","B0BN5LRGLY","UNI-T IPS Touch Screen Handheld UTi384G Adjustable Focus 384 * 288 IR -20~550C Thermal Imaging Camera Thermal Imager","UNI-T","FBM","Industrial & Scientific",1508400,"N/A","N/A",6935750538470,"N/A","Thermal Imagers",689,2999,6,0,0,,"-","-","N/A","N/A","UNI-T US","USA",1,1,"N/A","Large Standard-Size",15.75,7.28,13.58,9,"N/A","N/A","08/31/2025",40,9,0,"N/A"
"https://amazon.com/dp/B0CDRVBQMD","https://m.media-amazon.com/images/I/41fp0ZdTzaL._SX450_.jpg","B0CDRVBQMD","UNI-T Uni-Trend IR Camera UTi720E Infrared Thermal Imager High Resolution Handheld Thermal Imager PCB Circuit Floor Heating Detection,IR Resolution: 256x192 Frequency Frame: 25Hz(UTi720E)","UNI-T","FBM","Industrial & Scientific",1523589,"N/A","N/A","N/A","N/A","Thermal Imagers",693,754.95,-22,0,0,,"-","-","N/A","N/A","Yuqiao--Store","Hong Kong",1,2,"N/A","Large Standard-Size",7.87,4.72,5.12,2.2,"N/A","N/A","08/31/2025",31,8,0,"N/A"
"https://amazon.com/dp/B0FMY7ZKBN","https://m.media-amazon.com/images/I/518P2fc2p8L._SX450_.jpg","B0FMY7ZKBN","MLX90640 Portable Thermal Imager Camera 3.2 Inch TFT Screen Infrared Sensor Thermometer with USB-C Charging for Temperature Detection Temperature Range -40°C to 300°C","Generic","FBM","Industrial & Scientific",1524939,"N/A","N/A","N/A","N/A","Thermal Imagers",692,71.88,-13,0,0,,"-","-","N/A","N/A","JShomeDZ","China",1,0,"N/A","N/A","N/A","N/A","N/A","N/A","N/A","N/A","08/31/2025",7,9,0,"N/A"
"https://amazon.com/dp/B0C3ZZVGGY","https://m.media-amazon.com/images/I/51NDPh4ALQL._SX450_.jpg","B0C3ZZVGGY","J-ZMQER AC Adapter Charger Compatible with EXTECH FLIR i3 i5 i7 Thermal Imaging Infrared Camera PSU","J-ZMQER","FBM","Industrial & Scientific",1526347,"N/A","N/A","N/A","N/A","Thermal Imagers",694,13.95,-11,0,0,,"-","-","N/A","N/A","J-ZMQER","China",1,0,"N/A","N/A","N/A","N/A","N/A","N/A","N/A","N/A","-",34,5,0,"N/A"
"https://amazon.com/dp/B0DS8VCL58","https://m.media-amazon.com/images/I/518P2fc2p8L._SX450_.jpg","B0DS8VCL58","Handheld Thermal Imager, 3.2 Inch LCD Display Screen Portable Digital Infrared Thermal Imaging Camera, Infrared Thermal Imager Sensor for Home, Industrial Use","Generic","FBM","Industrial & Scientific",1529896,"N/A","N/A","N/A","N/A","Thermal Imagers",694,82.99,-16,0,0,,"-","-","N/A","N/A","JShomeDZ","China",1,0,"N/A","N/A","N/A","N/A","N/A","N/A","N/A","N/A","08/31/2025",14,9,0,"N/A"
"https://amazon.com/dp/B0F5W4V789","https://m.media-amazon.com/images/I/41PU4-CHehL._SX450_.jpg","B0F5W4V789","HamGeek 256X192 Thermal Imager for Drones Compatible with CVBS Interface Longwave IR 12um Camera Module(6.8MM Lens)","HeEHQA","FBM","Industrial & Scientific",1530763,"N/A","N/A",7601902496705,"N/A","Thermal Imagers",696,730.09,-49,0,0,-25,"-","-","N/A","N/A","MMYYDMD","China",2,0,"N/A","Small Standard-Size",0.39,0.39,0.39,0.88,"N/A","N/A","12/31/2025",6,1,0,"N/A"
"https://amazon.com/dp/B0FJRTFD32","https://m.media-amazon.com/images/I/518IFG4eBrL._SX450_.jpg","B0FJRTFD32","AMG8833 Infrared Thermal Imaging Camera Array Temperature Sensor Module 8X8 Pixels for IR Thermal Imager Module With 60 Degree Field Of View For Electronic Products Inspection","Lioaeust","FBM","Industrial & Scientific",1532069,"N/A","N/A","N/A","N/A","Thermal Imagers",697,51.88,-44,1,1,,73.94,73.91,"N/A","N/A","Toolfine","China",1,0,"N/A","N/A","N/A","N/A","N/A","N/A","N/A","N/A","01/31/2026",8,9,0,"N/A"
"https://amazon.com/dp/B0FJDNYXRM","https://m.media-amazon.com/images/I/61a4w66IpiL._SX450_.jpg","B0FJDNYXRM","Dpofirs Handheld Thermal Camera, 8H Working Life Infrared Imaging Camera, -20°C to 550°C Temp Range, Built in 8GB, Supports Full Frame Thermal Image Analysis","Dpofirs","FBM","Industrial & Scientific",1545251,"N/A","N/A","N/A","N/A","Thermal Imagers",701,203.04,-25,0,0,,"-","-","N/A","N/A","Chenndus","China",1,0,"N/A","Large Standard-Size",11.02,5.91,3.94,1.26,"N/A","N/A","-",8,9,0,"N/A"
"https://amazon.com/dp/B0B1LZ79PK","https://m.media-amazon.com/images/I/61ck5hMR8WL._SX450_.jpg","B0B1LZ79PK","Testo 871s Thermal Imager – High-Resolution Thermal Camera with 240 x 180 px - Integrated 5 MP Camera and App-Operation – Thermal Images with Automatic Hot and Cold Spot Detection","Testo","FBM","Industrial & Scientific",1555763,"N/A","N/A",4029547024795,"N/A","Thermal Imagers",702,2999,"N/A",0,0,100,"-","-",15,4.6,"Tequipment","USA",2,0,"N/A","Large Standard-Size",18,12.6,7.5,4.5,"N/A","N/A","07/31/2025",42,11,0,0.02
"https://amazon.com/dp/B08RLFCT1F","https://m.media-amazon.com/images/I/616Gbhj6a4L._SX450_.jpg","B08RLFCT1F","FLIR E96 Advanced Thermal Imaging Camera with 42° Lens, 640x480, -20°C to +1500°C","FLIR","FBM","Industrial & Scientific",1562142,845188022273,"N/A",0845188022273,"N/A","Thermal Imagers",703,15399,-14,0,0,,"-","-",1,5,"Quick Direct","USA",1,0,"N/A","Large bulky",19.7,7.5,14.6,12.8,"N/A","N/A","05/31/2024",63,1,0,0
"https://amazon.com/dp/B0DLKWC23T","https://m.media-amazon.com/images/I/61aq-kAIJgL._SX450_.jpg","B0DLKWC23T","YZYDF Thermal Camera AMG8833 8x8 Thermal Imager Array Temperature Farthest Detection Distance","YZYDF","FBM","Industrial & Scientific",1565970,"N/A","N/A",7641950517786,"N/A","Thermal Imagers",704,56.69,-26,0,0,,"-","-","N/A","N/A","sengelidianzishangwuyouxiangongsi","China",1,0,"N/A","N/A","N/A","N/A","N/A","N/A","N/A","N/A","07/31/2025",17,7,0,"N/A"
"https://amazon.com/dp/B08RL551XH","https://m.media-amazon.com/images/I/61Qmthkr+hL._SX450_.jpg","B08RL551XH","FLIR E86 Advanced Thermal Imaging Camera with 42° Lens, 464x348, -20°C to +1500°C","FLIR","FBM","Industrial & Scientific",1567448,845188022686,"N/A",0845188022686,"N/A","Thermal Imagers",705,14099,-10,1,0,300,9206.61,"-",1,5,"Quick Direct","USA",1,3,"N/A","Large bulky",19.7,7.5,14.6,12.8,"N/A","N/A","01/31/2025",34,1,7,0.66
"https://amazon.com/dp/B08TGS2342","https://m.media-amazon.com/images/I/61Qmthkr+hL._SX450_.jpg","B08TGS2342","FLIR E86 Advanced Thermal Imaging Camera with 24° + 42° Lens, 464x348, -20°C to +1500°C","FLIR","FBM","Industrial & Scientific",1567532,845188022709,"N/A",0845188022709,"N/A","Thermal Imagers",705,16049,-22,1,0,300,9206.61,"-",1,5,"Quick Direct","USA",1,3,"N/A","Large bulky",19.7,7.5,14.6,14.1,"N/A","N/A","01/31/2025",34,1,7,0.66
"https://amazon.com/dp/B01F1Z2PIS","https://m.media-amazon.com/images/I/61zL7yEWEgL._SX450_.jpg","B01F1Z2PIS","Seek LT-AAO Compact 20° Thermal Imager - Otterbox Universe Case System, Black Detection Accessory. Commercial Thermal Cameras","Seek Thermal","FBM","Industrial & Scientific",1567912,855753005822,00855753005822,0855753005822,"N/A","Thermal Imagers",706,289.99,-26,0,0,,"-","-",10,3.4,"OutCrate","USA",1,1,"N/A","Large Standard-Size",1.73,3.86,7.2,0.46,"N/A","N/A","09/30/2024",118,5,0,0
"https://amazon.com/dp/B08RK35X86","https://m.media-amazon.com/images/I/616Gbhj6a4L._SX450_.jpg","B08RK35X86","FLIR E96 Advanced Thermal Imaging Camera with 24° + 14° & 42° Lens, 640x480, -20°C to +1500°C","FLIR","FBM","Industrial & Scientific",1584511,845188022303,"N/A",0845188022303,"N/A","Thermal Imagers",710,19299,-13,0,0,,"-","-",1,5,"Quick Direct","USA",1,1,"N/A","Large bulky",19.7,7.5,14.6,14.1,"N/A","N/A","06/30/2025",63,1,0,0
"https://amazon.com/dp/B0CF949DFH","https://m.media-amazon.com/images/I/414UeKAT8PL._SX450_.jpg","B0CF949DFH","SPANN Battery Replacement for Extech Flir i7, i5 Infrared Camera, Part No: 1950986, T197410 3.7V","SPANN","FBM","Industrial & Scientific",1611191,712142861288,"N/A",0712142861288,"N/A","Thermal Imagers",714,18.67,-69,0,0,,"-","-","N/A","N/A","HJS-JSMY","China",1,0,"N/A","N/A","N/A","N/A","N/A","N/A","N/A","N/A","-",31,6,0,"N/A"
"https://amazon.com/dp/B0BN5HLGMS","https://m.media-amazon.com/images/I/41ihDc77U8L._SX450_.jpg","B0BN5HLGMS","UNI-T Touch Screen Handheld UTi256G Adjustable Focus 256 * 192 IR -20~550C Thermal Imaging Camera Thermal Imager","UNI-T","FBM","Industrial & Scientific",1612273,"N/A","N/A",6935750525616,"N/A","Thermal Imagers",716,2899,53,0,0,-143,"-","-","N/A","N/A","UNI-T US","USA",1,0,"N/A","Large Standard-Size",15.75,7.28,13.58,8.6,"N/A","N/A","11/30/2025",40,4,1,"N/A"
"https://amazon.com/dp/B0CPSNT331","https://m.media-amazon.com/images/I/619cYPqgE8L._SX450_.jpg","B0CPSNT331","GOYOJO Mini Mobile Thermal Imager for Android Phone 256x192 IR High Resolution IP65 for Industrial, Fault, PCB Inspection Heat Loss Detection Infrared Camera 34 X 26.5 X 15mm, VC328B","GOYOJO","FBM","Industrial & Scientific",1616334,658361249530,"N/A",0658361249530,"N/A","Thermal Imagers",719,299,"N/A",0,0,,"-","-","N/A","N/A","Elite Meter","China",1,0,"N/A","Large Standard-Size",4,4,2,1,"N/A","N/A","01/31/2025",27,7,0,"N/A"
"https://amazon.com/dp/B0CNY26TH1","https://m.media-amazon.com/images/I/51eqbozYDeL._SX450_.jpg","B0CNY26TH1","Super Cam X 3D Infrared Thermal Imager Camera -20℃~120℃ Mobile Phone PCB Troubleshoot Motherboard Repair Fault Diagnosis Instrument","Wnew","FBM","Industrial & Scientific",1659570,769902959495,"N/A",0769902959495,"N/A","Thermal Imagers",725,1108.14,-7,0,0,,"-","-","N/A","N/A","B&D DIRECT STORE","China",1,0,"N/A","Large Standard-Size",8.66,3.15,5.91,1.61,"N/A","N/A","12/31/2024",28,7,0,"N/A"
"https://amazon.com/dp/B0DXDC26T1","https://m.media-amazon.com/images/I/61jGMGEsclL._SX450_.jpg","B0DXDC26T1","Infrared Thermal Imaging Camera Module 8x8 Array Temperature Measurement Sensor for Microcontroller","Generic","FBM","Industrial & Scientific",1663316,"N/A","N/A","N/A","N/A","Thermal Imagers",726,32.67,"N/A",0,0,,"-","-",1,4,"FangcaoTool","China",1,0,"N/A","N/A","N/A","N/A","N/A","N/A","N/A","N/A","04/30/2025",13,9,0,0
"https://amazon.com/dp/B00XHRZS82","https://m.media-amazon.com/images/I/41zdonx+EIL._SX450_.jpg","B00XHRZS82","FLIR MD-324 Static Thermal Night Vision Camera [432-0010-01-00]","FLIR Systems","FBM","Industrial & Scientific",1675267,815121015426,"N/A",0815121015426,"N/A","Thermal Imagers",728,6126.31,-6,0,0,,"-","-","N/A","N/A","Amber World Wide","N/A",6,0,"N/A","N/A","N/A","N/A","N/A","N/A","N/A","N/A","03/31/2025",130,1,0,"N/A"
"https://amazon.com/dp/B0DBH4KZ6C","https://m.media-amazon.com/images/I/61niHSCYZrL._SX450_.jpg","B0DBH4KZ6C","Handheld DIY Thermal Imaging Camera Temperature Detection Tool, 1.8 inch LCD Display","DAGIJIRD","FBM","Industrial & Scientific",1679624,"N/A","N/A","N/A","N/A","Thermal Imagers",731,62.5,"N/A",0,0,,"-","-","N/A","N/A","Daji-Direct","China",2,"N/A","N/A","Large Standard-Size",3.94,3.15,0.79,0.19,"N/A","N/A","-",20,6,0,"N/A"
"https://amazon.com/dp/B00F2T9GVI","https://m.media-amazon.com/images/I/4129SgRYkYL._SX450_.jpg","B00F2T9GVI","Fluke FLK-TI-TRIPOD3 Tripod MTG Accessory/Holder for TI200/TI300/TI400 Industrial Thermal Imager","Fluke","Amazon","Tools & Home Improvement",1683349,095969668668,00095969668668,6907509200044,"N/A","Networking Products",20979,158.54,-61,0,0,,"-","-",3,4.8,"Amazon","N/A",2,6,50,"Large Standard-Size",5.39,6.26,7.09,0.5,"N/A","N/A","08/31/2025",150,1,0,0
"https://amazon.com/dp/B0DFMZ1Q1L","https://m.media-amazon.com/images/I/51yLMvgodSL._SX450_.jpg","B0DFMZ1Q1L","BoxWave Cable Compatible with Noyafa NF-524 Precision Detector Thermal Imager - USB Type-C Keychain Charger, Key Ring USB Type-C to Type-A 8 in USB Cable - Jet Black","BoxWave","FBM","Industrial & Scientific",1690712,"N/A","N/A","N/A","N/A","Thermal Imagers",734,9.95,-18,0,0,,"-","-","N/A","N/A","BoxWave Corporation","USA",1,0,"N/A","N/A","N/A","N/A","N/A","N/A","N/A","N/A","-",19,6,0,"N/A"
"https://amazon.com/dp/B0DS422X8Y","https://m.media-amazon.com/images/I/31UtUhG6MNL._SX450_.jpg","B0DS422X8Y","Axisflying Dual Lens Thermal Imaging FPV Camera Compatible With Day And Night Use Compatible With DIY Projects(640 x 512)","YJhGFqS","-","Industrial & Scientific",1696851,"N/A","N/A",3571891524380,"N/A","Thermal Imagers",736,1335.49,-50,1,1,,852.66,852.63,"N/A","N/A",,"N/A",1,0,"N/A","Small Standard-Size",1.18,0.79,0.39,0.88,"N/A","N/A","03/31/2025",14,1,3,"N/A"
"https://amazon.com/dp/B0965LJT3T","https://m.media-amazon.com/images/I/41+yOv+gChL._SX450_.jpg","B0965LJT3T","Datalogic ADC, Powerscan Pm9100, 910Mhz, Us, Linear Imager, 4-Key Display, Scanner Only, Req Base (Bc9030-910), Ps (6003-0941 & 8-0935) and Cable","N/A","FBM","Industrial & Scientific",1701837,"N/A","N/A","N/A","N/A","Thermal Imagers",737,683.4,-40,0,0,,"-","-","N/A","N/A","SmartMediaUS","USA",1,1,"N/A","N/A","N/A","N/A","N/A","N/A","N/A","N/A","07/31/2024",102,1,0,"N/A"
"https://amazon.com/dp/B0853BTYP7","https://m.media-amazon.com/images/I/61QASTfjLZL._SX450_.jpg","B0853BTYP7","Marg USB Data/Charging Cable Charger Power Cord Lead for FLIR TG165 Imaging IR Thermometer Thermal Infrared Thermo Meter Camera","Marg","FBM","Industrial & Scientific",1710937,"N/A","N/A",6010830698692,"N/A","Thermal Imagers",738,7.53,-6,0,0,,"-","-","N/A","N/A","Marg Direct","China",1,0,"N/A","N/A","N/A","N/A","N/A","N/A","N/A","N/A","02/28/2025",73,3,0,"N/A"
"https://amazon.com/dp/B0DP4TB6CP","https://m.media-amazon.com/images/I/41gQNtUy6IL._SX450_.jpg","B0DP4TB6CP","TOOLTOP T7 - Thermal Imaging Camera for Android Smartphones USB-C Portable Mini Thermal Imaging Camera 256 * 192 25Hz Type-C Thermal Imager Used with Mobile APP (T7 - Standard)","Generic","FBA","Industrial & Scientific",1714924,"N/A","N/A","N/A","N/A","Thermal Imagers",739,169.99,7,0,0,,"-","-",1,3,"Heegkqu Direct","China",1,1,"N/A","Large Standard-Size",4.53,3.15,2.17,0.44,15.55,42.89,"12/31/2024",16,7,2,0
"https://amazon.com/dp/B0DP4R1RS7","https://m.media-amazon.com/images/I/41fvA+2CtTL._SX450_.jpg","B0DP4R1RS7","TOOLTOP T7 - Thermal Imaging Camera for Android Smartphones USB-C Portable Mini Thermal Imaging Camera 256 * 192 25Hz Type-C Thermal Imager Used with Mobile APP (T7 - with Micro Lens)","Generic","FBA","Industrial & Scientific",1714949,"N/A","N/A","N/A","N/A","Thermal Imagers",739,222.99,11,0,0,,"-","-",1,3,"Heegkqu Direct","China",1,1,"N/A","Large Standard-Size",4.53,3.15,2.17,0.44,15.55,42.89,"12/31/2024",16,8,2,0